{
  "address": "0x04C89607413713Ec9775E14b954286519d836FEf",
  "abi": [
    {
      "anonymous": false,
      "inputs": [
        {
          "indexed": true,
          "internalType": "address",
          "name": "owner",
          "type": "address"
        },
        {
          "indexed": true,
          "internalType": "address",
          "name": "spender",
          "type": "address"
        },
        {
          "indexed": false,
          "internalType": "uint256",
          "name": "value",
          "type": "uint256"
        }
      ],
      "name": "Approval",
      "type": "event"
    },
    {
      "anonymous": false,
      "inputs": [
        {
          "indexed": true,
          "internalType": "address",
          "name": "authorizer",
          "type": "address"
        },
        {
          "indexed": true,
          "internalType": "bytes32",
          "name": "nonce",
          "type": "bytes32"
        }
      ],
      "name": "AuthorizationCanceled",
      "type": "event"
    },
    {
      "anonymous": false,
      "inputs": [
        {
          "indexed": true,
          "internalType": "address",
          "name": "authorizer",
          "type": "address"
        },
        {
          "indexed": true,
          "internalType": "bytes32",
          "name": "nonce",
          "type": "bytes32"
        }
      ],
      "name": "AuthorizationUsed",
      "type": "event"
    },
    {
      "anonymous": false,
      "inputs": [
        {
          "indexed": true,
          "internalType": "address",
          "name": "account",
          "type": "address"
        }
      ],
      "name": "Blacklisted",
      "type": "event"
    },
    {
      "anonymous": false,
      "inputs": [
        {
          "indexed": false,
          "internalType": "address",
          "name": "userAddress",
          "type": "address"
        },
        {
          "indexed": false,
          "internalType": "address payable",
          "name": "relayerAddress",
          "type": "address"
        },
        {
          "indexed": false,
          "internalType": "bytes",
          "name": "functionSignature",
          "type": "bytes"
        }
      ],
      "name": "MetaTransactionExecuted",
      "type": "event"
    },
    {
      "anonymous": false,
      "inputs": [],
      "name": "Pause",
      "type": "event"
    },
    {
      "anonymous": false,
      "inputs": [
        {
          "indexed": true,
          "internalType": "address",
          "name": "newRescuer",
          "type": "address"
        }
      ],
      "name": "RescuerChanged",
      "type": "event"
    },
    {
      "anonymous": false,
      "inputs": [
        {
          "indexed": true,
          "internalType": "bytes32",
          "name": "role",
          "type": "bytes32"
        },
        {
          "indexed": true,
          "internalType": "bytes32",
          "name": "previousAdminRole",
          "type": "bytes32"
        },
        {
          "indexed": true,
          "internalType": "bytes32",
          "name": "newAdminRole",
          "type": "bytes32"
        }
      ],
      "name": "RoleAdminChanged",
      "type": "event"
    },
    {
      "anonymous": false,
      "inputs": [
        {
          "indexed": true,
          "internalType": "bytes32",
          "name": "role",
          "type": "bytes32"
        },
        {
          "indexed": true,
          "internalType": "address",
          "name": "account",
          "type": "address"
        },
        {
          "indexed": true,
          "internalType": "address",
          "name": "sender",
          "type": "address"
        }
      ],
      "name": "RoleGranted",
      "type": "event"
    },
    {
      "anonymous": false,
      "inputs": [
        {
          "indexed": true,
          "internalType": "bytes32",
          "name": "role",
          "type": "bytes32"
        },
        {
          "indexed": true,
          "internalType": "address",
          "name": "account",
          "type": "address"
        },
        {
          "indexed": true,
          "internalType": "address",
          "name": "sender",
          "type": "address"
        }
      ],
      "name": "RoleRevoked",
      "type": "event"
    },
    {
      "anonymous": false,
      "inputs": [
        {
          "indexed": true,
          "internalType": "address",
          "name": "from",
          "type": "address"
        },
        {
          "indexed": true,
          "internalType": "address",
          "name": "to",
          "type": "address"
        },
        {
          "indexed": false,
          "internalType": "uint256",
          "name": "value",
          "type": "uint256"
        }
      ],
      "name": "Transfer",
      "type": "event"
    },
    {
      "anonymous": false,
      "inputs": [
        {
          "indexed": true,
          "internalType": "address",
          "name": "account",
          "type": "address"
        }
      ],
      "name": "UnBlacklisted",
      "type": "event"
    },
    {
      "anonymous": false,
      "inputs": [],
      "name": "Unpause",
      "type": "event"
    },
    {
      "inputs": [],
      "name": "APPROVE_WITH_AUTHORIZATION_TYPEHASH",
      "outputs": [
        {
          "internalType": "bytes32",
          "name": "",
          "type": "bytes32"
        }
      ],
      "stateMutability": "view",
      "type": "function"
    },
    {
      "inputs": [],
      "name": "BLACKLISTER_ROLE",
      "outputs": [
        {
          "internalType": "bytes32",
          "name": "",
          "type": "bytes32"
        }
      ],
      "stateMutability": "view",
      "type": "function"
    },
    {
      "inputs": [],
      "name": "CANCEL_AUTHORIZATION_TYPEHASH",
      "outputs": [
        {
          "internalType": "bytes32",
          "name": "",
          "type": "bytes32"
        }
      ],
      "stateMutability": "view",
      "type": "function"
    },
    {
      "inputs": [],
      "name": "DECREASE_ALLOWANCE_WITH_AUTHORIZATION_TYPEHASH",
      "outputs": [
        {
          "internalType": "bytes32",
          "name": "",
          "type": "bytes32"
        }
      ],
      "stateMutability": "view",
      "type": "function"
    },
    {
      "inputs": [],
      "name": "DEFAULT_ADMIN_ROLE",
      "outputs": [
        {
          "internalType": "bytes32",
          "name": "",
          "type": "bytes32"
        }
      ],
      "stateMutability": "view",
      "type": "function"
    },
    {
      "inputs": [],
      "name": "DEPOSITOR_ROLE",
      "outputs": [
        {
          "internalType": "bytes32",
          "name": "",
          "type": "bytes32"
        }
      ],
      "stateMutability": "view",
      "type": "function"
    },
    {
      "inputs": [],
      "name": "DOMAIN_SEPARATOR",
      "outputs": [
        {
          "internalType": "bytes32",
          "name": "",
          "type": "bytes32"
        }
      ],
      "stateMutability": "view",
      "type": "function"
    },
    {
      "inputs": [],
      "name": "EIP712_VERSION",
      "outputs": [
        {
          "internalType": "string",
          "name": "",
          "type": "string"
        }
      ],
      "stateMutability": "view",
      "type": "function"
    },
    {
      "inputs": [],
      "name": "INCREASE_ALLOWANCE_WITH_AUTHORIZATION_TYPEHASH",
      "outputs": [
        {
          "internalType": "bytes32",
          "name": "",
          "type": "bytes32"
        }
      ],
      "stateMutability": "view",
      "type": "function"
    },
    {
      "inputs": [],
      "name": "META_TRANSACTION_TYPEHASH",
      "outputs": [
        {
          "internalType": "bytes32",
          "name": "",
          "type": "bytes32"
        }
      ],
      "stateMutability": "view",
      "type": "function"
    },
    {
      "inputs": [],
      "name": "PAUSER_ROLE",
      "outputs": [
        {
          "internalType": "bytes32",
          "name": "",
          "type": "bytes32"
        }
      ],
      "stateMutability": "view",
      "type": "function"
    },
    {
      "inputs": [],
      "name": "PERMIT_TYPEHASH",
      "outputs": [
        {
          "internalType": "bytes32",
          "name": "",
          "type": "bytes32"
        }
      ],
      "stateMutability": "view",
      "type": "function"
    },
    {
      "inputs": [],
      "name": "RESCUER_ROLE",
      "outputs": [
        {
          "internalType": "bytes32",
          "name": "",
          "type": "bytes32"
        }
      ],
      "stateMutability": "view",
      "type": "function"
    },
    {
      "inputs": [],
      "name": "TRANSFER_WITH_AUTHORIZATION_TYPEHASH",
      "outputs": [
        {
          "internalType": "bytes32",
          "name": "",
          "type": "bytes32"
        }
      ],
      "stateMutability": "view",
      "type": "function"
    },
    {
      "inputs": [],
      "name": "WITHDRAW_WITH_AUTHORIZATION_TYPEHASH",
      "outputs": [
        {
          "internalType": "bytes32",
          "name": "",
          "type": "bytes32"
        }
      ],
      "stateMutability": "view",
      "type": "function"
    },
    {
      "inputs": [
        {
          "internalType": "address",
          "name": "owner",
          "type": "address"
        },
        {
          "internalType": "address",
          "name": "spender",
          "type": "address"
        }
      ],
      "name": "allowance",
      "outputs": [
        {
          "internalType": "uint256",
          "name": "",
          "type": "uint256"
        }
      ],
      "stateMutability": "view",
      "type": "function"
    },
    {
      "inputs": [
        {
          "internalType": "address",
          "name": "spender",
          "type": "address"
        },
        {
          "internalType": "uint256",
          "name": "amount",
          "type": "uint256"
        }
      ],
      "name": "approve",
      "outputs": [
        {
          "internalType": "bool",
          "name": "",
          "type": "bool"
        }
      ],
      "stateMutability": "nonpayable",
      "type": "function"
    },
    {
      "inputs": [
        {
          "internalType": "address",
          "name": "owner",
          "type": "address"
        },
        {
          "internalType": "address",
          "name": "spender",
          "type": "address"
        },
        {
          "internalType": "uint256",
          "name": "value",
          "type": "uint256"
        },
        {
          "internalType": "uint256",
          "name": "validAfter",
          "type": "uint256"
        },
        {
          "internalType": "uint256",
          "name": "validBefore",
          "type": "uint256"
        },
        {
          "internalType": "bytes32",
          "name": "nonce",
          "type": "bytes32"
        },
        {
          "internalType": "uint8",
          "name": "v",
          "type": "uint8"
        },
        {
          "internalType": "bytes32",
          "name": "r",
          "type": "bytes32"
        },
        {
          "internalType": "bytes32",
          "name": "s",
          "type": "bytes32"
        }
      ],
      "name": "approveWithAuthorization",
      "outputs": [],
      "stateMutability": "nonpayable",
      "type": "function"
    },
    {
      "inputs": [
        {
          "internalType": "address",
          "name": "authorizer",
          "type": "address"
        },
        {
          "internalType": "bytes32",
          "name": "nonce",
          "type": "bytes32"
        }
      ],
      "name": "authorizationState",
      "outputs": [
        {
          "internalType": "enum GasAbstraction.AuthorizationState",
          "name": "",
          "type": "uint8"
        }
      ],
      "stateMutability": "view",
      "type": "function"
    },
    {
      "inputs": [
        {
          "internalType": "address",
          "name": "account",
          "type": "address"
        }
      ],
      "name": "balanceOf",
      "outputs": [
        {
          "internalType": "uint256",
          "name": "",
          "type": "uint256"
        }
      ],
      "stateMutability": "view",
      "type": "function"
    },
    {
      "inputs": [
        {
          "internalType": "address",
          "name": "account",
          "type": "address"
        }
      ],
      "name": "blacklist",
      "outputs": [],
      "stateMutability": "nonpayable",
      "type": "function"
    },
    {
      "inputs": [],
      "name": "blacklisters",
      "outputs": [
        {
          "internalType": "address[]",
          "name": "",
          "type": "address[]"
        }
      ],
      "stateMutability": "view",
      "type": "function"
    },
    {
      "inputs": [
        {
          "internalType": "address",
          "name": "authorizer",
          "type": "address"
        },
        {
          "internalType": "bytes32",
          "name": "nonce",
          "type": "bytes32"
        },
        {
          "internalType": "uint8",
          "name": "v",
          "type": "uint8"
        },
        {
          "internalType": "bytes32",
          "name": "r",
          "type": "bytes32"
        },
        {
          "internalType": "bytes32",
          "name": "s",
          "type": "bytes32"
        }
      ],
      "name": "cancelAuthorization",
      "outputs": [],
      "stateMutability": "nonpayable",
      "type": "function"
    },
    {
      "inputs": [],
      "name": "decimals",
      "outputs": [
        {
          "internalType": "uint8",
          "name": "",
          "type": "uint8"
        }
      ],
      "stateMutability": "view",
      "type": "function"
    },
    {
      "inputs": [
        {
          "internalType": "address",
          "name": "spender",
          "type": "address"
        },
        {
          "internalType": "uint256",
          "name": "subtractedValue",
          "type": "uint256"
        }
      ],
      "name": "decreaseAllowance",
      "outputs": [
        {
          "internalType": "bool",
          "name": "",
          "type": "bool"
        }
      ],
      "stateMutability": "nonpayable",
      "type": "function"
    },
    {
      "inputs": [
        {
          "internalType": "address",
          "name": "owner",
          "type": "address"
        },
        {
          "internalType": "address",
          "name": "spender",
          "type": "address"
        },
        {
          "internalType": "uint256",
          "name": "decrement",
          "type": "uint256"
        },
        {
          "internalType": "uint256",
          "name": "validAfter",
          "type": "uint256"
        },
        {
          "internalType": "uint256",
          "name": "validBefore",
          "type": "uint256"
        },
        {
          "internalType": "bytes32",
          "name": "nonce",
          "type": "bytes32"
        },
        {
          "internalType": "uint8",
          "name": "v",
          "type": "uint8"
        },
        {
          "internalType": "bytes32",
          "name": "r",
          "type": "bytes32"
        },
        {
          "internalType": "bytes32",
          "name": "s",
          "type": "bytes32"
        }
      ],
      "name": "decreaseAllowanceWithAuthorization",
      "outputs": [],
      "stateMutability": "nonpayable",
      "type": "function"
    },
    {
      "inputs": [
        {
          "internalType": "address",
          "name": "user",
          "type": "address"
        },
        {
          "internalType": "bytes",
          "name": "depositData",
          "type": "bytes"
        }
      ],
      "name": "deposit",
      "outputs": [],
      "stateMutability": "nonpayable",
      "type": "function"
    },
    {
      "inputs": [
        {
          "internalType": "address",
          "name": "userAddress",
          "type": "address"
        },
        {
          "internalType": "bytes",
          "name": "functionSignature",
          "type": "bytes"
        },
        {
          "internalType": "bytes32",
          "name": "sigR",
          "type": "bytes32"
        },
        {
          "internalType": "bytes32",
          "name": "sigS",
          "type": "bytes32"
        },
        {
          "internalType": "uint8",
          "name": "sigV",
          "type": "uint8"
        }
      ],
      "name": "executeMetaTransaction",
      "outputs": [
        {
          "internalType": "bytes",
          "name": "",
          "type": "bytes"
        }
      ],
      "stateMutability": "payable",
      "type": "function"
    },
    {
      "inputs": [],
      "name": "getChainId",
      "outputs": [
        {
          "internalType": "uint256",
          "name": "chainId",
          "type": "uint256"
        }
      ],
      "stateMutability": "view",
      "type": "function"
    },
    {
      "inputs": [
        {
          "internalType": "bytes32",
          "name": "role",
          "type": "bytes32"
        }
      ],
      "name": "getRoleAdmin",
      "outputs": [
        {
          "internalType": "bytes32",
          "name": "",
          "type": "bytes32"
        }
      ],
      "stateMutability": "view",
      "type": "function"
    },
    {
      "inputs": [
        {
          "internalType": "bytes32",
          "name": "role",
          "type": "bytes32"
        },
        {
          "internalType": "uint256",
          "name": "index",
          "type": "uint256"
        }
      ],
      "name": "getRoleMember",
      "outputs": [
        {
          "internalType": "address",
          "name": "",
          "type": "address"
        }
      ],
      "stateMutability": "view",
      "type": "function"
    },
    {
      "inputs": [
        {
          "internalType": "bytes32",
          "name": "role",
          "type": "bytes32"
        }
      ],
      "name": "getRoleMemberCount",
      "outputs": [
        {
          "internalType": "uint256",
          "name": "",
          "type": "uint256"
        }
      ],
      "stateMutability": "view",
      "type": "function"
    },
    {
      "inputs": [
        {
          "internalType": "bytes32",
          "name": "role",
          "type": "bytes32"
        },
        {
          "internalType": "address",
          "name": "account",
          "type": "address"
        }
      ],
      "name": "grantRole",
      "outputs": [],
      "stateMutability": "nonpayable",
      "type": "function"
    },
    {
      "inputs": [
        {
          "internalType": "bytes32",
          "name": "role",
          "type": "bytes32"
        },
        {
          "internalType": "address",
          "name": "account",
          "type": "address"
        }
      ],
      "name": "hasRole",
      "outputs": [
        {
          "internalType": "bool",
          "name": "",
          "type": "bool"
        }
      ],
      "stateMutability": "view",
      "type": "function"
    },
    {
      "inputs": [
        {
          "internalType": "address",
          "name": "spender",
          "type": "address"
        },
        {
          "internalType": "uint256",
          "name": "addedValue",
          "type": "uint256"
        }
      ],
      "name": "increaseAllowance",
      "outputs": [
        {
          "internalType": "bool",
          "name": "",
          "type": "bool"
        }
      ],
      "stateMutability": "nonpayable",
      "type": "function"
    },
    {
      "inputs": [
        {
          "internalType": "address",
          "name": "owner",
          "type": "address"
        },
        {
          "internalType": "address",
          "name": "spender",
          "type": "address"
        },
        {
          "internalType": "uint256",
          "name": "increment",
          "type": "uint256"
        },
        {
          "internalType": "uint256",
          "name": "validAfter",
          "type": "uint256"
        },
        {
          "internalType": "uint256",
          "name": "validBefore",
          "type": "uint256"
        },
        {
          "internalType": "bytes32",
          "name": "nonce",
          "type": "bytes32"
        },
        {
          "internalType": "uint8",
          "name": "v",
          "type": "uint8"
        },
        {
          "internalType": "bytes32",
          "name": "r",
          "type": "bytes32"
        },
        {
          "internalType": "bytes32",
          "name": "s",
          "type": "bytes32"
        }
      ],
      "name": "increaseAllowanceWithAuthorization",
      "outputs": [],
      "stateMutability": "nonpayable",
      "type": "function"
    },
    {
      "inputs": [
        {
          "internalType": "string",
          "name": "newName",
          "type": "string"
        },
        {
          "internalType": "string",
          "name": "newSymbol",
          "type": "string"
        },
        {
          "internalType": "uint8",
          "name": "newDecimals",
          "type": "uint8"
        },
        {
          "internalType": "address",
          "name": "childChainManager",
          "type": "address"
        }
      ],
      "name": "initialize",
      "outputs": [],
      "stateMutability": "nonpayable",
      "type": "function"
    },
    {
      "inputs": [],
      "name": "initialized",
      "outputs": [
        {
          "internalType": "bool",
          "name": "",
          "type": "bool"
        }
      ],
      "stateMutability": "view",
      "type": "function"
    },
    {
      "inputs": [
        {
          "internalType": "address",
          "name": "account",
          "type": "address"
        }
      ],
      "name": "isBlacklisted",
      "outputs": [
        {
          "internalType": "bool",
          "name": "",
          "type": "bool"
        }
      ],
      "stateMutability": "view",
      "type": "function"
    },
    {
      "inputs": [
        {
          "internalType": "address",
          "name": "_to",
          "type": "address"
        },
        {
          "internalType": "uint256",
          "name": "_amount",
          "type": "uint256"
        }
      ],
      "name": "mint",
      "outputs": [],
      "stateMutability": "nonpayable",
      "type": "function"
    },
    {
      "inputs": [],
      "name": "name",
      "outputs": [
        {
          "internalType": "string",
          "name": "",
          "type": "string"
        }
      ],
      "stateMutability": "view",
      "type": "function"
    },
    {
      "inputs": [
        {
          "internalType": "address",
          "name": "owner",
          "type": "address"
        }
      ],
      "name": "nonces",
      "outputs": [
        {
          "internalType": "uint256",
          "name": "",
          "type": "uint256"
        }
      ],
      "stateMutability": "view",
      "type": "function"
    },
    {
      "inputs": [],
      "name": "pause",
      "outputs": [],
      "stateMutability": "nonpayable",
      "type": "function"
    },
    {
      "inputs": [],
      "name": "paused",
      "outputs": [
        {
          "internalType": "bool",
          "name": "",
          "type": "bool"
        }
      ],
      "stateMutability": "view",
      "type": "function"
    },
    {
      "inputs": [],
      "name": "pausers",
      "outputs": [
        {
          "internalType": "address[]",
          "name": "",
          "type": "address[]"
        }
      ],
      "stateMutability": "view",
      "type": "function"
    },
    {
      "inputs": [
        {
          "internalType": "address",
          "name": "owner",
          "type": "address"
        },
        {
          "internalType": "address",
          "name": "spender",
          "type": "address"
        },
        {
          "internalType": "uint256",
          "name": "value",
          "type": "uint256"
        },
        {
          "internalType": "uint256",
          "name": "deadline",
          "type": "uint256"
        },
        {
          "internalType": "uint8",
          "name": "v",
          "type": "uint8"
        },
        {
          "internalType": "bytes32",
          "name": "r",
          "type": "bytes32"
        },
        {
          "internalType": "bytes32",
          "name": "s",
          "type": "bytes32"
        }
      ],
      "name": "permit",
      "outputs": [],
      "stateMutability": "nonpayable",
      "type": "function"
    },
    {
      "inputs": [
        {
          "internalType": "bytes32",
          "name": "role",
          "type": "bytes32"
        },
        {
          "internalType": "address",
          "name": "account",
          "type": "address"
        }
      ],
      "name": "renounceRole",
      "outputs": [],
      "stateMutability": "nonpayable",
      "type": "function"
    },
    {
      "inputs": [
        {
          "internalType": "contract IERC20",
          "name": "tokenContract",
          "type": "address"
        },
        {
          "internalType": "address",
          "name": "to",
          "type": "address"
        },
        {
          "internalType": "uint256",
          "name": "amount",
          "type": "uint256"
        }
      ],
      "name": "rescueERC20",
      "outputs": [],
      "stateMutability": "nonpayable",
      "type": "function"
    },
    {
      "inputs": [],
      "name": "rescuers",
      "outputs": [
        {
          "internalType": "address[]",
          "name": "",
          "type": "address[]"
        }
      ],
      "stateMutability": "view",
      "type": "function"
    },
    {
      "inputs": [
        {
          "internalType": "bytes32",
          "name": "role",
          "type": "bytes32"
        },
        {
          "internalType": "address",
          "name": "account",
          "type": "address"
        }
      ],
      "name": "revokeRole",
      "outputs": [],
      "stateMutability": "nonpayable",
      "type": "function"
    },
    {
      "inputs": [],
      "name": "symbol",
      "outputs": [
        {
          "internalType": "string",
          "name": "",
          "type": "string"
        }
      ],
      "stateMutability": "view",
      "type": "function"
    },
    {
      "inputs": [],
      "name": "totalSupply",
      "outputs": [
        {
          "internalType": "uint256",
          "name": "",
          "type": "uint256"
        }
      ],
      "stateMutability": "view",
      "type": "function"
    },
    {
      "inputs": [
        {
          "internalType": "address",
          "name": "recipient",
          "type": "address"
        },
        {
          "internalType": "uint256",
          "name": "amount",
          "type": "uint256"
        }
      ],
      "name": "transfer",
      "outputs": [
        {
          "internalType": "bool",
          "name": "",
          "type": "bool"
        }
      ],
      "stateMutability": "nonpayable",
      "type": "function"
    },
    {
      "inputs": [
        {
          "internalType": "address",
          "name": "sender",
          "type": "address"
        },
        {
          "internalType": "address",
          "name": "recipient",
          "type": "address"
        },
        {
          "internalType": "uint256",
          "name": "amount",
          "type": "uint256"
        }
      ],
      "name": "transferFrom",
      "outputs": [
        {
          "internalType": "bool",
          "name": "",
          "type": "bool"
        }
      ],
      "stateMutability": "nonpayable",
      "type": "function"
    },
    {
      "inputs": [
        {
          "internalType": "address",
          "name": "from",
          "type": "address"
        },
        {
          "internalType": "address",
          "name": "to",
          "type": "address"
        },
        {
          "internalType": "uint256",
          "name": "value",
          "type": "uint256"
        },
        {
          "internalType": "uint256",
          "name": "validAfter",
          "type": "uint256"
        },
        {
          "internalType": "uint256",
          "name": "validBefore",
          "type": "uint256"
        },
        {
          "internalType": "bytes32",
          "name": "nonce",
          "type": "bytes32"
        },
        {
          "internalType": "uint8",
          "name": "v",
          "type": "uint8"
        },
        {
          "internalType": "bytes32",
          "name": "r",
          "type": "bytes32"
        },
        {
          "internalType": "bytes32",
          "name": "s",
          "type": "bytes32"
        }
      ],
      "name": "transferWithAuthorization",
      "outputs": [],
      "stateMutability": "nonpayable",
      "type": "function"
    },
    {
      "inputs": [
        {
          "internalType": "address",
          "name": "account",
          "type": "address"
        }
      ],
      "name": "unBlacklist",
      "outputs": [],
      "stateMutability": "nonpayable",
      "type": "function"
    },
    {
      "inputs": [],
      "name": "unpause",
      "outputs": [],
      "stateMutability": "nonpayable",
      "type": "function"
    },
    {
      "inputs": [
        {
          "internalType": "string",
          "name": "newName",
          "type": "string"
        },
        {
          "internalType": "string",
          "name": "newSymbol",
          "type": "string"
        }
      ],
      "name": "updateMetadata",
      "outputs": [],
      "stateMutability": "nonpayable",
      "type": "function"
    },
    {
      "inputs": [
        {
          "internalType": "uint256",
          "name": "amount",
          "type": "uint256"
        }
      ],
      "name": "withdraw",
      "outputs": [],
      "stateMutability": "nonpayable",
      "type": "function"
    },
    {
      "inputs": [
        {
          "internalType": "address",
          "name": "owner",
          "type": "address"
        },
        {
          "internalType": "uint256",
          "name": "value",
          "type": "uint256"
        },
        {
          "internalType": "uint256",
          "name": "validAfter",
          "type": "uint256"
        },
        {
          "internalType": "uint256",
          "name": "validBefore",
          "type": "uint256"
        },
        {
          "internalType": "bytes32",
          "name": "nonce",
          "type": "bytes32"
        },
        {
          "internalType": "uint8",
          "name": "v",
          "type": "uint8"
        },
        {
          "internalType": "bytes32",
          "name": "r",
          "type": "bytes32"
        },
        {
          "internalType": "bytes32",
          "name": "s",
          "type": "bytes32"
        }
      ],
      "name": "withdrawWithAuthorization",
      "outputs": [],
      "stateMutability": "nonpayable",
      "type": "function"
    }
  ],
  "transactionHash": "0x2a60b5fa4942b613a04edfc1c0b434aac47bf8dfe0a8b6b7e5aeb1266dbab821",
  "receipt": {
    "to": null,
    "from": "0xf39Fd6e51aad88F6F4ce6aB8827279cffFb92266",
    "contractAddress": "0x04C89607413713Ec9775E14b954286519d836FEf",
    "transactionIndex": 0,
    "gasUsed": "4270832",
    "logsBloom": "0x00000000000000000000000000000000000000000000000000000000000000000000000000000000000000000000000000000000000000000000000000000000000000000000000000000000000000000000000000000000000000000000000000000000000000000000000000000000000000000000000000000000000000000000000000000000000000000000000000000000000000000000000000000000000000000000000000000000000000000000000000000000000000000000000000000000000000000000000000000000000000000000000000000000000000000000000000000000000000000000000000000000000000000000000000000000",
    "blockHash": "0xb7b295769383081e748eeca357f7cdbbd74d522fe780d7aa1b7499f76a3e6a99",
    "transactionHash": "0x2a60b5fa4942b613a04edfc1c0b434aac47bf8dfe0a8b6b7e5aeb1266dbab821",
    "logs": [],
    "blockNumber": 69,
    "cumulativeGasUsed": "4270832",
    "status": 1,
    "byzantium": true
  },
  "args": [],
  "numDeployments": 1,
  "solcInputHash": "02ff3cbc8e12c323649252c235481aa1",
  "metadata": "{\"compiler\":{\"version\":\"0.6.12+commit.27d51765\"},\"language\":\"Solidity\",\"output\":{\"abi\":[{\"anonymous\":false,\"inputs\":[{\"indexed\":true,\"internalType\":\"address\",\"name\":\"owner\",\"type\":\"address\"},{\"indexed\":true,\"internalType\":\"address\",\"name\":\"spender\",\"type\":\"address\"},{\"indexed\":false,\"internalType\":\"uint256\",\"name\":\"value\",\"type\":\"uint256\"}],\"name\":\"Approval\",\"type\":\"event\"},{\"anonymous\":false,\"inputs\":[{\"indexed\":true,\"internalType\":\"address\",\"name\":\"authorizer\",\"type\":\"address\"},{\"indexed\":true,\"internalType\":\"bytes32\",\"name\":\"nonce\",\"type\":\"bytes32\"}],\"name\":\"AuthorizationCanceled\",\"type\":\"event\"},{\"anonymous\":false,\"inputs\":[{\"indexed\":true,\"internalType\":\"address\",\"name\":\"authorizer\",\"type\":\"address\"},{\"indexed\":true,\"internalType\":\"bytes32\",\"name\":\"nonce\",\"type\":\"bytes32\"}],\"name\":\"AuthorizationUsed\",\"type\":\"event\"},{\"anonymous\":false,\"inputs\":[{\"indexed\":true,\"internalType\":\"address\",\"name\":\"account\",\"type\":\"address\"}],\"name\":\"Blacklisted\",\"type\":\"event\"},{\"anonymous\":false,\"inputs\":[{\"indexed\":false,\"internalType\":\"address\",\"name\":\"userAddress\",\"type\":\"address\"},{\"indexed\":false,\"internalType\":\"address payable\",\"name\":\"relayerAddress\",\"type\":\"address\"},{\"indexed\":false,\"internalType\":\"bytes\",\"name\":\"functionSignature\",\"type\":\"bytes\"}],\"name\":\"MetaTransactionExecuted\",\"type\":\"event\"},{\"anonymous\":false,\"inputs\":[],\"name\":\"Pause\",\"type\":\"event\"},{\"anonymous\":false,\"inputs\":[{\"indexed\":true,\"internalType\":\"address\",\"name\":\"newRescuer\",\"type\":\"address\"}],\"name\":\"RescuerChanged\",\"type\":\"event\"},{\"anonymous\":false,\"inputs\":[{\"indexed\":true,\"internalType\":\"bytes32\",\"name\":\"role\",\"type\":\"bytes32\"},{\"indexed\":true,\"internalType\":\"bytes32\",\"name\":\"previousAdminRole\",\"type\":\"bytes32\"},{\"indexed\":true,\"internalType\":\"bytes32\",\"name\":\"newAdminRole\",\"type\":\"bytes32\"}],\"name\":\"RoleAdminChanged\",\"type\":\"event\"},{\"anonymous\":false,\"inputs\":[{\"indexed\":true,\"internalType\":\"bytes32\",\"name\":\"role\",\"type\":\"bytes32\"},{\"indexed\":true,\"internalType\":\"address\",\"name\":\"account\",\"type\":\"address\"},{\"indexed\":true,\"internalType\":\"address\",\"name\":\"sender\",\"type\":\"address\"}],\"name\":\"RoleGranted\",\"type\":\"event\"},{\"anonymous\":false,\"inputs\":[{\"indexed\":true,\"internalType\":\"bytes32\",\"name\":\"role\",\"type\":\"bytes32\"},{\"indexed\":true,\"internalType\":\"address\",\"name\":\"account\",\"type\":\"address\"},{\"indexed\":true,\"internalType\":\"address\",\"name\":\"sender\",\"type\":\"address\"}],\"name\":\"RoleRevoked\",\"type\":\"event\"},{\"anonymous\":false,\"inputs\":[{\"indexed\":true,\"internalType\":\"address\",\"name\":\"from\",\"type\":\"address\"},{\"indexed\":true,\"internalType\":\"address\",\"name\":\"to\",\"type\":\"address\"},{\"indexed\":false,\"internalType\":\"uint256\",\"name\":\"value\",\"type\":\"uint256\"}],\"name\":\"Transfer\",\"type\":\"event\"},{\"anonymous\":false,\"inputs\":[{\"indexed\":true,\"internalType\":\"address\",\"name\":\"account\",\"type\":\"address\"}],\"name\":\"UnBlacklisted\",\"type\":\"event\"},{\"anonymous\":false,\"inputs\":[],\"name\":\"Unpause\",\"type\":\"event\"},{\"inputs\":[],\"name\":\"APPROVE_WITH_AUTHORIZATION_TYPEHASH\",\"outputs\":[{\"internalType\":\"bytes32\",\"name\":\"\",\"type\":\"bytes32\"}],\"stateMutability\":\"view\",\"type\":\"function\"},{\"inputs\":[],\"name\":\"BLACKLISTER_ROLE\",\"outputs\":[{\"internalType\":\"bytes32\",\"name\":\"\",\"type\":\"bytes32\"}],\"stateMutability\":\"view\",\"type\":\"function\"},{\"inputs\":[],\"name\":\"CANCEL_AUTHORIZATION_TYPEHASH\",\"outputs\":[{\"internalType\":\"bytes32\",\"name\":\"\",\"type\":\"bytes32\"}],\"stateMutability\":\"view\",\"type\":\"function\"},{\"inputs\":[],\"name\":\"DECREASE_ALLOWANCE_WITH_AUTHORIZATION_TYPEHASH\",\"outputs\":[{\"internalType\":\"bytes32\",\"name\":\"\",\"type\":\"bytes32\"}],\"stateMutability\":\"view\",\"type\":\"function\"},{\"inputs\":[],\"name\":\"DEFAULT_ADMIN_ROLE\",\"outputs\":[{\"internalType\":\"bytes32\",\"name\":\"\",\"type\":\"bytes32\"}],\"stateMutability\":\"view\",\"type\":\"function\"},{\"inputs\":[],\"name\":\"DEPOSITOR_ROLE\",\"outputs\":[{\"internalType\":\"bytes32\",\"name\":\"\",\"type\":\"bytes32\"}],\"stateMutability\":\"view\",\"type\":\"function\"},{\"inputs\":[],\"name\":\"DOMAIN_SEPARATOR\",\"outputs\":[{\"internalType\":\"bytes32\",\"name\":\"\",\"type\":\"bytes32\"}],\"stateMutability\":\"view\",\"type\":\"function\"},{\"inputs\":[],\"name\":\"EIP712_VERSION\",\"outputs\":[{\"internalType\":\"string\",\"name\":\"\",\"type\":\"string\"}],\"stateMutability\":\"view\",\"type\":\"function\"},{\"inputs\":[],\"name\":\"INCREASE_ALLOWANCE_WITH_AUTHORIZATION_TYPEHASH\",\"outputs\":[{\"internalType\":\"bytes32\",\"name\":\"\",\"type\":\"bytes32\"}],\"stateMutability\":\"view\",\"type\":\"function\"},{\"inputs\":[],\"name\":\"META_TRANSACTION_TYPEHASH\",\"outputs\":[{\"internalType\":\"bytes32\",\"name\":\"\",\"type\":\"bytes32\"}],\"stateMutability\":\"view\",\"type\":\"function\"},{\"inputs\":[],\"name\":\"PAUSER_ROLE\",\"outputs\":[{\"internalType\":\"bytes32\",\"name\":\"\",\"type\":\"bytes32\"}],\"stateMutability\":\"view\",\"type\":\"function\"},{\"inputs\":[],\"name\":\"PERMIT_TYPEHASH\",\"outputs\":[{\"internalType\":\"bytes32\",\"name\":\"\",\"type\":\"bytes32\"}],\"stateMutability\":\"view\",\"type\":\"function\"},{\"inputs\":[],\"name\":\"RESCUER_ROLE\",\"outputs\":[{\"internalType\":\"bytes32\",\"name\":\"\",\"type\":\"bytes32\"}],\"stateMutability\":\"view\",\"type\":\"function\"},{\"inputs\":[],\"name\":\"TRANSFER_WITH_AUTHORIZATION_TYPEHASH\",\"outputs\":[{\"internalType\":\"bytes32\",\"name\":\"\",\"type\":\"bytes32\"}],\"stateMutability\":\"view\",\"type\":\"function\"},{\"inputs\":[],\"name\":\"WITHDRAW_WITH_AUTHORIZATION_TYPEHASH\",\"outputs\":[{\"internalType\":\"bytes32\",\"name\":\"\",\"type\":\"bytes32\"}],\"stateMutability\":\"view\",\"type\":\"function\"},{\"inputs\":[{\"internalType\":\"address\",\"name\":\"owner\",\"type\":\"address\"},{\"internalType\":\"address\",\"name\":\"spender\",\"type\":\"address\"}],\"name\":\"allowance\",\"outputs\":[{\"internalType\":\"uint256\",\"name\":\"\",\"type\":\"uint256\"}],\"stateMutability\":\"view\",\"type\":\"function\"},{\"inputs\":[{\"internalType\":\"address\",\"name\":\"spender\",\"type\":\"address\"},{\"internalType\":\"uint256\",\"name\":\"amount\",\"type\":\"uint256\"}],\"name\":\"approve\",\"outputs\":[{\"internalType\":\"bool\",\"name\":\"\",\"type\":\"bool\"}],\"stateMutability\":\"nonpayable\",\"type\":\"function\"},{\"inputs\":[{\"internalType\":\"address\",\"name\":\"owner\",\"type\":\"address\"},{\"internalType\":\"address\",\"name\":\"spender\",\"type\":\"address\"},{\"internalType\":\"uint256\",\"name\":\"value\",\"type\":\"uint256\"},{\"internalType\":\"uint256\",\"name\":\"validAfter\",\"type\":\"uint256\"},{\"internalType\":\"uint256\",\"name\":\"validBefore\",\"type\":\"uint256\"},{\"internalType\":\"bytes32\",\"name\":\"nonce\",\"type\":\"bytes32\"},{\"internalType\":\"uint8\",\"name\":\"v\",\"type\":\"uint8\"},{\"internalType\":\"bytes32\",\"name\":\"r\",\"type\":\"bytes32\"},{\"internalType\":\"bytes32\",\"name\":\"s\",\"type\":\"bytes32\"}],\"name\":\"approveWithAuthorization\",\"outputs\":[],\"stateMutability\":\"nonpayable\",\"type\":\"function\"},{\"inputs\":[{\"internalType\":\"address\",\"name\":\"authorizer\",\"type\":\"address\"},{\"internalType\":\"bytes32\",\"name\":\"nonce\",\"type\":\"bytes32\"}],\"name\":\"authorizationState\",\"outputs\":[{\"internalType\":\"enum GasAbstraction.AuthorizationState\",\"name\":\"\",\"type\":\"uint8\"}],\"stateMutability\":\"view\",\"type\":\"function\"},{\"inputs\":[{\"internalType\":\"address\",\"name\":\"account\",\"type\":\"address\"}],\"name\":\"balanceOf\",\"outputs\":[{\"internalType\":\"uint256\",\"name\":\"\",\"type\":\"uint256\"}],\"stateMutability\":\"view\",\"type\":\"function\"},{\"inputs\":[{\"internalType\":\"address\",\"name\":\"account\",\"type\":\"address\"}],\"name\":\"blacklist\",\"outputs\":[],\"stateMutability\":\"nonpayable\",\"type\":\"function\"},{\"inputs\":[],\"name\":\"blacklisters\",\"outputs\":[{\"internalType\":\"address[]\",\"name\":\"\",\"type\":\"address[]\"}],\"stateMutability\":\"view\",\"type\":\"function\"},{\"inputs\":[{\"internalType\":\"address\",\"name\":\"authorizer\",\"type\":\"address\"},{\"internalType\":\"bytes32\",\"name\":\"nonce\",\"type\":\"bytes32\"},{\"internalType\":\"uint8\",\"name\":\"v\",\"type\":\"uint8\"},{\"internalType\":\"bytes32\",\"name\":\"r\",\"type\":\"bytes32\"},{\"internalType\":\"bytes32\",\"name\":\"s\",\"type\":\"bytes32\"}],\"name\":\"cancelAuthorization\",\"outputs\":[],\"stateMutability\":\"nonpayable\",\"type\":\"function\"},{\"inputs\":[],\"name\":\"decimals\",\"outputs\":[{\"internalType\":\"uint8\",\"name\":\"\",\"type\":\"uint8\"}],\"stateMutability\":\"view\",\"type\":\"function\"},{\"inputs\":[{\"internalType\":\"address\",\"name\":\"spender\",\"type\":\"address\"},{\"internalType\":\"uint256\",\"name\":\"subtractedValue\",\"type\":\"uint256\"}],\"name\":\"decreaseAllowance\",\"outputs\":[{\"internalType\":\"bool\",\"name\":\"\",\"type\":\"bool\"}],\"stateMutability\":\"nonpayable\",\"type\":\"function\"},{\"inputs\":[{\"internalType\":\"address\",\"name\":\"owner\",\"type\":\"address\"},{\"internalType\":\"address\",\"name\":\"spender\",\"type\":\"address\"},{\"internalType\":\"uint256\",\"name\":\"decrement\",\"type\":\"uint256\"},{\"internalType\":\"uint256\",\"name\":\"validAfter\",\"type\":\"uint256\"},{\"internalType\":\"uint256\",\"name\":\"validBefore\",\"type\":\"uint256\"},{\"internalType\":\"bytes32\",\"name\":\"nonce\",\"type\":\"bytes32\"},{\"internalType\":\"uint8\",\"name\":\"v\",\"type\":\"uint8\"},{\"internalType\":\"bytes32\",\"name\":\"r\",\"type\":\"bytes32\"},{\"internalType\":\"bytes32\",\"name\":\"s\",\"type\":\"bytes32\"}],\"name\":\"decreaseAllowanceWithAuthorization\",\"outputs\":[],\"stateMutability\":\"nonpayable\",\"type\":\"function\"},{\"inputs\":[{\"internalType\":\"address\",\"name\":\"user\",\"type\":\"address\"},{\"internalType\":\"bytes\",\"name\":\"depositData\",\"type\":\"bytes\"}],\"name\":\"deposit\",\"outputs\":[],\"stateMutability\":\"nonpayable\",\"type\":\"function\"},{\"inputs\":[{\"internalType\":\"address\",\"name\":\"userAddress\",\"type\":\"address\"},{\"internalType\":\"bytes\",\"name\":\"functionSignature\",\"type\":\"bytes\"},{\"internalType\":\"bytes32\",\"name\":\"sigR\",\"type\":\"bytes32\"},{\"internalType\":\"bytes32\",\"name\":\"sigS\",\"type\":\"bytes32\"},{\"internalType\":\"uint8\",\"name\":\"sigV\",\"type\":\"uint8\"}],\"name\":\"executeMetaTransaction\",\"outputs\":[{\"internalType\":\"bytes\",\"name\":\"\",\"type\":\"bytes\"}],\"stateMutability\":\"payable\",\"type\":\"function\"},{\"inputs\":[],\"name\":\"getChainId\",\"outputs\":[{\"internalType\":\"uint256\",\"name\":\"chainId\",\"type\":\"uint256\"}],\"stateMutability\":\"view\",\"type\":\"function\"},{\"inputs\":[{\"internalType\":\"bytes32\",\"name\":\"role\",\"type\":\"bytes32\"}],\"name\":\"getRoleAdmin\",\"outputs\":[{\"internalType\":\"bytes32\",\"name\":\"\",\"type\":\"bytes32\"}],\"stateMutability\":\"view\",\"type\":\"function\"},{\"inputs\":[{\"internalType\":\"bytes32\",\"name\":\"role\",\"type\":\"bytes32\"},{\"internalType\":\"uint256\",\"name\":\"index\",\"type\":\"uint256\"}],\"name\":\"getRoleMember\",\"outputs\":[{\"internalType\":\"address\",\"name\":\"\",\"type\":\"address\"}],\"stateMutability\":\"view\",\"type\":\"function\"},{\"inputs\":[{\"internalType\":\"bytes32\",\"name\":\"role\",\"type\":\"bytes32\"}],\"name\":\"getRoleMemberCount\",\"outputs\":[{\"internalType\":\"uint256\",\"name\":\"\",\"type\":\"uint256\"}],\"stateMutability\":\"view\",\"type\":\"function\"},{\"inputs\":[{\"internalType\":\"bytes32\",\"name\":\"role\",\"type\":\"bytes32\"},{\"internalType\":\"address\",\"name\":\"account\",\"type\":\"address\"}],\"name\":\"grantRole\",\"outputs\":[],\"stateMutability\":\"nonpayable\",\"type\":\"function\"},{\"inputs\":[{\"internalType\":\"bytes32\",\"name\":\"role\",\"type\":\"bytes32\"},{\"internalType\":\"address\",\"name\":\"account\",\"type\":\"address\"}],\"name\":\"hasRole\",\"outputs\":[{\"internalType\":\"bool\",\"name\":\"\",\"type\":\"bool\"}],\"stateMutability\":\"view\",\"type\":\"function\"},{\"inputs\":[{\"internalType\":\"address\",\"name\":\"spender\",\"type\":\"address\"},{\"internalType\":\"uint256\",\"name\":\"addedValue\",\"type\":\"uint256\"}],\"name\":\"increaseAllowance\",\"outputs\":[{\"internalType\":\"bool\",\"name\":\"\",\"type\":\"bool\"}],\"stateMutability\":\"nonpayable\",\"type\":\"function\"},{\"inputs\":[{\"internalType\":\"address\",\"name\":\"owner\",\"type\":\"address\"},{\"internalType\":\"address\",\"name\":\"spender\",\"type\":\"address\"},{\"internalType\":\"uint256\",\"name\":\"increment\",\"type\":\"uint256\"},{\"internalType\":\"uint256\",\"name\":\"validAfter\",\"type\":\"uint256\"},{\"internalType\":\"uint256\",\"name\":\"validBefore\",\"type\":\"uint256\"},{\"internalType\":\"bytes32\",\"name\":\"nonce\",\"type\":\"bytes32\"},{\"internalType\":\"uint8\",\"name\":\"v\",\"type\":\"uint8\"},{\"internalType\":\"bytes32\",\"name\":\"r\",\"type\":\"bytes32\"},{\"internalType\":\"bytes32\",\"name\":\"s\",\"type\":\"bytes32\"}],\"name\":\"increaseAllowanceWithAuthorization\",\"outputs\":[],\"stateMutability\":\"nonpayable\",\"type\":\"function\"},{\"inputs\":[{\"internalType\":\"string\",\"name\":\"newName\",\"type\":\"string\"},{\"internalType\":\"string\",\"name\":\"newSymbol\",\"type\":\"string\"},{\"internalType\":\"uint8\",\"name\":\"newDecimals\",\"type\":\"uint8\"},{\"internalType\":\"address\",\"name\":\"childChainManager\",\"type\":\"address\"}],\"name\":\"initialize\",\"outputs\":[],\"stateMutability\":\"nonpayable\",\"type\":\"function\"},{\"inputs\":[],\"name\":\"initialized\",\"outputs\":[{\"internalType\":\"bool\",\"name\":\"\",\"type\":\"bool\"}],\"stateMutability\":\"view\",\"type\":\"function\"},{\"inputs\":[{\"internalType\":\"address\",\"name\":\"account\",\"type\":\"address\"}],\"name\":\"isBlacklisted\",\"outputs\":[{\"internalType\":\"bool\",\"name\":\"\",\"type\":\"bool\"}],\"stateMutability\":\"view\",\"type\":\"function\"},{\"inputs\":[{\"internalType\":\"address\",\"name\":\"_to\",\"type\":\"address\"},{\"internalType\":\"uint256\",\"name\":\"_amount\",\"type\":\"uint256\"}],\"name\":\"mint\",\"outputs\":[],\"stateMutability\":\"nonpayable\",\"type\":\"function\"},{\"inputs\":[],\"name\":\"name\",\"outputs\":[{\"internalType\":\"string\",\"name\":\"\",\"type\":\"string\"}],\"stateMutability\":\"view\",\"type\":\"function\"},{\"inputs\":[{\"internalType\":\"address\",\"name\":\"owner\",\"type\":\"address\"}],\"name\":\"nonces\",\"outputs\":[{\"internalType\":\"uint256\",\"name\":\"\",\"type\":\"uint256\"}],\"stateMutability\":\"view\",\"type\":\"function\"},{\"inputs\":[],\"name\":\"pause\",\"outputs\":[],\"stateMutability\":\"nonpayable\",\"type\":\"function\"},{\"inputs\":[],\"name\":\"paused\",\"outputs\":[{\"internalType\":\"bool\",\"name\":\"\",\"type\":\"bool\"}],\"stateMutability\":\"view\",\"type\":\"function\"},{\"inputs\":[],\"name\":\"pausers\",\"outputs\":[{\"internalType\":\"address[]\",\"name\":\"\",\"type\":\"address[]\"}],\"stateMutability\":\"view\",\"type\":\"function\"},{\"inputs\":[{\"internalType\":\"address\",\"name\":\"owner\",\"type\":\"address\"},{\"internalType\":\"address\",\"name\":\"spender\",\"type\":\"address\"},{\"internalType\":\"uint256\",\"name\":\"value\",\"type\":\"uint256\"},{\"internalType\":\"uint256\",\"name\":\"deadline\",\"type\":\"uint256\"},{\"internalType\":\"uint8\",\"name\":\"v\",\"type\":\"uint8\"},{\"internalType\":\"bytes32\",\"name\":\"r\",\"type\":\"bytes32\"},{\"internalType\":\"bytes32\",\"name\":\"s\",\"type\":\"bytes32\"}],\"name\":\"permit\",\"outputs\":[],\"stateMutability\":\"nonpayable\",\"type\":\"function\"},{\"inputs\":[{\"internalType\":\"bytes32\",\"name\":\"role\",\"type\":\"bytes32\"},{\"internalType\":\"address\",\"name\":\"account\",\"type\":\"address\"}],\"name\":\"renounceRole\",\"outputs\":[],\"stateMutability\":\"nonpayable\",\"type\":\"function\"},{\"inputs\":[{\"internalType\":\"contract IERC20\",\"name\":\"tokenContract\",\"type\":\"address\"},{\"internalType\":\"address\",\"name\":\"to\",\"type\":\"address\"},{\"internalType\":\"uint256\",\"name\":\"amount\",\"type\":\"uint256\"}],\"name\":\"rescueERC20\",\"outputs\":[],\"stateMutability\":\"nonpayable\",\"type\":\"function\"},{\"inputs\":[],\"name\":\"rescuers\",\"outputs\":[{\"internalType\":\"address[]\",\"name\":\"\",\"type\":\"address[]\"}],\"stateMutability\":\"view\",\"type\":\"function\"},{\"inputs\":[{\"internalType\":\"bytes32\",\"name\":\"role\",\"type\":\"bytes32\"},{\"internalType\":\"address\",\"name\":\"account\",\"type\":\"address\"}],\"name\":\"revokeRole\",\"outputs\":[],\"stateMutability\":\"nonpayable\",\"type\":\"function\"},{\"inputs\":[],\"name\":\"symbol\",\"outputs\":[{\"internalType\":\"string\",\"name\":\"\",\"type\":\"string\"}],\"stateMutability\":\"view\",\"type\":\"function\"},{\"inputs\":[],\"name\":\"totalSupply\",\"outputs\":[{\"internalType\":\"uint256\",\"name\":\"\",\"type\":\"uint256\"}],\"stateMutability\":\"view\",\"type\":\"function\"},{\"inputs\":[{\"internalType\":\"address\",\"name\":\"recipient\",\"type\":\"address\"},{\"internalType\":\"uint256\",\"name\":\"amount\",\"type\":\"uint256\"}],\"name\":\"transfer\",\"outputs\":[{\"internalType\":\"bool\",\"name\":\"\",\"type\":\"bool\"}],\"stateMutability\":\"nonpayable\",\"type\":\"function\"},{\"inputs\":[{\"internalType\":\"address\",\"name\":\"sender\",\"type\":\"address\"},{\"internalType\":\"address\",\"name\":\"recipient\",\"type\":\"address\"},{\"internalType\":\"uint256\",\"name\":\"amount\",\"type\":\"uint256\"}],\"name\":\"transferFrom\",\"outputs\":[{\"internalType\":\"bool\",\"name\":\"\",\"type\":\"bool\"}],\"stateMutability\":\"nonpayable\",\"type\":\"function\"},{\"inputs\":[{\"internalType\":\"address\",\"name\":\"from\",\"type\":\"address\"},{\"internalType\":\"address\",\"name\":\"to\",\"type\":\"address\"},{\"internalType\":\"uint256\",\"name\":\"value\",\"type\":\"uint256\"},{\"internalType\":\"uint256\",\"name\":\"validAfter\",\"type\":\"uint256\"},{\"internalType\":\"uint256\",\"name\":\"validBefore\",\"type\":\"uint256\"},{\"internalType\":\"bytes32\",\"name\":\"nonce\",\"type\":\"bytes32\"},{\"internalType\":\"uint8\",\"name\":\"v\",\"type\":\"uint8\"},{\"internalType\":\"bytes32\",\"name\":\"r\",\"type\":\"bytes32\"},{\"internalType\":\"bytes32\",\"name\":\"s\",\"type\":\"bytes32\"}],\"name\":\"transferWithAuthorization\",\"outputs\":[],\"stateMutability\":\"nonpayable\",\"type\":\"function\"},{\"inputs\":[{\"internalType\":\"address\",\"name\":\"account\",\"type\":\"address\"}],\"name\":\"unBlacklist\",\"outputs\":[],\"stateMutability\":\"nonpayable\",\"type\":\"function\"},{\"inputs\":[],\"name\":\"unpause\",\"outputs\":[],\"stateMutability\":\"nonpayable\",\"type\":\"function\"},{\"inputs\":[{\"internalType\":\"string\",\"name\":\"newName\",\"type\":\"string\"},{\"internalType\":\"string\",\"name\":\"newSymbol\",\"type\":\"string\"}],\"name\":\"updateMetadata\",\"outputs\":[],\"stateMutability\":\"nonpayable\",\"type\":\"function\"},{\"inputs\":[{\"internalType\":\"uint256\",\"name\":\"amount\",\"type\":\"uint256\"}],\"name\":\"withdraw\",\"outputs\":[],\"stateMutability\":\"nonpayable\",\"type\":\"function\"},{\"inputs\":[{\"internalType\":\"address\",\"name\":\"owner\",\"type\":\"address\"},{\"internalType\":\"uint256\",\"name\":\"value\",\"type\":\"uint256\"},{\"internalType\":\"uint256\",\"name\":\"validAfter\",\"type\":\"uint256\"},{\"internalType\":\"uint256\",\"name\":\"validBefore\",\"type\":\"uint256\"},{\"internalType\":\"bytes32\",\"name\":\"nonce\",\"type\":\"bytes32\"},{\"internalType\":\"uint8\",\"name\":\"v\",\"type\":\"uint8\"},{\"internalType\":\"bytes32\",\"name\":\"r\",\"type\":\"bytes32\"},{\"internalType\":\"bytes32\",\"name\":\"s\",\"type\":\"bytes32\"}],\"name\":\"withdrawWithAuthorization\",\"outputs\":[],\"stateMutability\":\"nonpayable\",\"type\":\"function\"}],\"devdoc\":{\"kind\":\"dev\",\"methods\":{\"allowance(address,address)\":{\"details\":\"See {IERC20-allowance}.\"},\"approve(address,uint256)\":{\"details\":\"See {IERC20-approve}. Requirements: - `spender` cannot be the zero address.\"},\"approveWithAuthorization(address,address,uint256,uint256,uint256,bytes32,uint8,bytes32,bytes32)\":{\"params\":{\"nonce\":\"Unique nonce\",\"owner\":\"Token owner's address (Authorizer)\",\"r\":\"r of the signature\",\"s\":\"s of the signature\",\"spender\":\"Spender's address\",\"v\":\"v of the signature\",\"validAfter\":\"The time after which this is valid (unix time)\",\"validBefore\":\"The time before which this is valid (unix time)\",\"value\":\"Amount of allowance\"}},\"authorizationState(address,bytes32)\":{\"params\":{\"authorizer\":\"Authorizer's address\",\"nonce\":\"Nonce of the authorization\"},\"returns\":{\"_0\":\"Authorization state\"}},\"balanceOf(address)\":{\"details\":\"See {IERC20-balanceOf}.\"},\"blacklist(address)\":{\"details\":\"Adds an account to the blacklist\",\"params\":{\"account\":\"The address to blacklist\"}},\"blacklisters()\":{\"returns\":{\"_0\":\"Addresses\"}},\"cancelAuthorization(address,bytes32,uint8,bytes32,bytes32)\":{\"details\":\"Works only if the authorization is not yet used.\",\"params\":{\"authorizer\":\"Authorizer's address\",\"nonce\":\"Nonce of the authorization\",\"r\":\"r of the signature\",\"s\":\"s of the signature\",\"v\":\"v of the signature\"}},\"decimals()\":{\"details\":\"Returns the number of decimals used to get its user representation. For example, if `decimals` equals `2`, a balance of `505` tokens should be displayed to a user as `5,05` (`505 / 10 ** 2`). Tokens usually opt for a value of 18, imitating the relationship between Ether and Wei. This is the value {ERC20} uses, unless {_setupDecimals} is called. NOTE: This information is only used for _display_ purposes: it in no way affects any of the arithmetic of the contract, including {IERC20-balanceOf} and {IERC20-transfer}.\"},\"decreaseAllowance(address,uint256)\":{\"details\":\"Atomically decreases the allowance granted to `spender` by the caller. This is an alternative to {approve} that can be used as a mitigation for problems described in {IERC20-approve}. Emits an {Approval} event indicating the updated allowance. Requirements: - `spender` cannot be the zero address. - `spender` must have allowance for the caller of at least `subtractedValue`.\"},\"decreaseAllowanceWithAuthorization(address,address,uint256,uint256,uint256,bytes32,uint8,bytes32,bytes32)\":{\"params\":{\"decrement\":\"Amount of decrease in allowance\",\"nonce\":\"Unique nonce\",\"owner\":\"Token owner's address (Authorizer)\",\"r\":\"r of the signature\",\"s\":\"s of the signature\",\"spender\":\"Spender's address\",\"v\":\"v of the signature\",\"validAfter\":\"The time after which this is valid (unix time)\",\"validBefore\":\"The time before which this is valid (unix time)\"}},\"deposit(address,bytes)\":{\"details\":\"Should be callable only by ChildChainManager Should handle deposit by minting the required amount for user Make sure minting is done only by this function\",\"params\":{\"depositData\":\"abi encoded amount\",\"user\":\"user address for whom deposit is being done\"}},\"getRoleAdmin(bytes32)\":{\"details\":\"Returns the admin role that controls `role`. See {grantRole} and {revokeRole}. To change a role's admin, use {_setRoleAdmin}.\"},\"getRoleMember(bytes32,uint256)\":{\"details\":\"Returns one of the accounts that have `role`. `index` must be a value between 0 and {getRoleMemberCount}, non-inclusive. Role bearers are not sorted in any particular way, and their ordering may change at any point. WARNING: When using {getRoleMember} and {getRoleMemberCount}, make sure you perform all queries on the same block. See the following https://forum.openzeppelin.com/t/iterating-over-elements-on-enumerableset-in-openzeppelin-contracts/2296[forum post] for more information.\"},\"getRoleMemberCount(bytes32)\":{\"details\":\"Returns the number of accounts that have `role`. Can be used together with {getRoleMember} to enumerate all bearers of a role.\"},\"grantRole(bytes32,address)\":{\"details\":\"Grants `role` to `account`. If `account` had not been already granted `role`, emits a {RoleGranted} event. Requirements: - the caller must have ``role``'s admin role.\"},\"hasRole(bytes32,address)\":{\"details\":\"Returns `true` if `account` has been granted `role`.\"},\"increaseAllowance(address,uint256)\":{\"details\":\"Atomically increases the allowance granted to `spender` by the caller. This is an alternative to {approve} that can be used as a mitigation for problems described in {IERC20-approve}. Emits an {Approval} event indicating the updated allowance. Requirements: - `spender` cannot be the zero address.\"},\"increaseAllowanceWithAuthorization(address,address,uint256,uint256,uint256,bytes32,uint8,bytes32,bytes32)\":{\"params\":{\"increment\":\"Amount of increase in allowance\",\"nonce\":\"Unique nonce\",\"owner\":\"Token owner's address (Authorizer)\",\"r\":\"r of the signature\",\"s\":\"s of the signature\",\"spender\":\"Spender's address\",\"v\":\"v of the signature\",\"validAfter\":\"The time after which this is valid (unix time)\",\"validBefore\":\"The time before which this is valid (unix time)\"}},\"initialize(string,string,uint8,address)\":{\"details\":\"meant to be called once immediately after deployment\"},\"isBlacklisted(address)\":{\"details\":\"Checks if an account is blacklisted\",\"params\":{\"account\":\"The address to check\"}},\"name()\":{\"details\":\"Returns the name of the token.\"},\"nonces(address)\":{\"params\":{\"owner\":\"Token owner's address\"},\"returns\":{\"_0\":\"Next nonce\"}},\"paused()\":{\"returns\":{\"_0\":\"True if paused\"}},\"pausers()\":{\"returns\":{\"_0\":\"Addresses\"}},\"permit(address,address,uint256,uint256,uint8,bytes32,bytes32)\":{\"params\":{\"deadline\":\"Expiration time, seconds since the epoch\",\"owner\":\"Token owner's address (Authorizer)\",\"r\":\"r of the signature\",\"s\":\"s of the signature\",\"spender\":\"Spender's address\",\"v\":\"v of the signature\",\"value\":\"Amount of allowance\"}},\"renounceRole(bytes32,address)\":{\"details\":\"Revokes `role` from the calling account. Roles are often managed via {grantRole} and {revokeRole}: this function's purpose is to provide a mechanism for accounts to lose their privileges if they are compromised (such as when a trusted device is misplaced). If the calling account had been granted `role`, emits a {RoleRevoked} event. Requirements: - the caller must be `account`.\"},\"rescueERC20(address,address,uint256)\":{\"params\":{\"amount\":\"Amount to withdraw\",\"to\":\"Recipient address\",\"tokenContract\":\"ERC20 token contract address\"}},\"rescuers()\":{\"returns\":{\"_0\":\"Addresses\"}},\"revokeRole(bytes32,address)\":{\"details\":\"Revokes `role` from `account`. If `account` had been granted `role`, emits a {RoleRevoked} event. Requirements: - the caller must have ``role``'s admin role.\"},\"symbol()\":{\"details\":\"Returns the symbol of the token, usually a shorter version of the name.\"},\"totalSupply()\":{\"details\":\"See {IERC20-totalSupply}.\"},\"transfer(address,uint256)\":{\"details\":\"See {IERC20-transfer}. Requirements: - `recipient` cannot be the zero address. - the caller must have a balance of at least `amount`.\"},\"transferFrom(address,address,uint256)\":{\"details\":\"See {IERC20-transferFrom}. Emits an {Approval} event indicating the updated allowance. This is not required by the EIP. See the note at the beginning of {ERC20}; Requirements: - `sender` and `recipient` cannot be the zero address. - `sender` must have a balance of at least `amount`. - the caller must have allowance for ``sender``'s tokens of at least `amount`.\"},\"transferWithAuthorization(address,address,uint256,uint256,uint256,bytes32,uint8,bytes32,bytes32)\":{\"params\":{\"from\":\"Payer's address (Authorizer)\",\"nonce\":\"Unique nonce\",\"r\":\"r of the signature\",\"s\":\"s of the signature\",\"to\":\"Payee's address\",\"v\":\"v of the signature\",\"validAfter\":\"The time after which this is valid (unix time)\",\"validBefore\":\"The time before which this is valid (unix time)\",\"value\":\"Amount to be transferred\"}},\"unBlacklist(address)\":{\"params\":{\"account\":\"The address to remove from the blacklist\"}},\"withdraw(uint256)\":{\"details\":\"Should burn user's tokens. This transaction will be verified when exiting on root chain\",\"params\":{\"amount\":\"amount of tokens to withdraw\"}},\"withdrawWithAuthorization(address,uint256,uint256,uint256,bytes32,uint8,bytes32,bytes32)\":{\"params\":{\"nonce\":\"Unique nonce\",\"owner\":\"Token owner's address (Authorizer)\",\"r\":\"r of the signature\",\"s\":\"s of the signature\",\"v\":\"v of the signature\",\"validAfter\":\"The time after which this is valid (unix time)\",\"validBefore\":\"The time before which this is valid (unix time)\",\"value\":\"Amount to be withdrawn\"}}},\"version\":1},\"userdoc\":{\"kind\":\"user\",\"methods\":{\"approveWithAuthorization(address,address,uint256,uint256,uint256,bytes32,uint8,bytes32,bytes32)\":{\"notice\":\"Update allowance with a signed authorization\"},\"authorizationState(address,bytes32)\":{\"notice\":\"Returns the state of an authorization\"},\"blacklisters()\":{\"notice\":\"Return the members of the blacklister role\"},\"cancelAuthorization(address,bytes32,uint8,bytes32,bytes32)\":{\"notice\":\"Attempt to cancel an authorization\"},\"decreaseAllowanceWithAuthorization(address,address,uint256,uint256,uint256,bytes32,uint8,bytes32,bytes32)\":{\"notice\":\"Decrease allowance with a signed authorization\"},\"deposit(address,bytes)\":{\"notice\":\"called when token is deposited on root chain\"},\"increaseAllowanceWithAuthorization(address,address,uint256,uint256,uint256,bytes32,uint8,bytes32,bytes32)\":{\"notice\":\"Increase allowance with a signed authorization\"},\"initialize(string,string,uint8,address)\":{\"notice\":\"Initialize the contract after it has been proxified\"},\"nonces(address)\":{\"notice\":\"Nonces for permit / meta-transactions\"},\"pause()\":{\"notice\":\"Pause this contract\"},\"paused()\":{\"notice\":\"Returns whether this contract is paused\"},\"pausers()\":{\"notice\":\"Return the members of the pauser role\"},\"permit(address,address,uint256,uint256,uint8,bytes32,bytes32)\":{\"notice\":\"Update allowance with a signed permit\"},\"rescueERC20(address,address,uint256)\":{\"notice\":\"Rescue ERC20 tokens locked up in this contract.\"},\"rescuers()\":{\"notice\":\"Return the members of the rescuer role\"},\"transferWithAuthorization(address,address,uint256,uint256,uint256,bytes32,uint8,bytes32,bytes32)\":{\"notice\":\"Execute a transfer with a signed authorization\"},\"unBlacklist(address)\":{\"notice\":\"Removes an account from the blacklist\"},\"unpause()\":{\"notice\":\"Unpause this contract\"},\"withdraw(uint256)\":{\"notice\":\"called when user wants to withdraw tokens back to root chain\"},\"withdrawWithAuthorization(address,uint256,uint256,uint256,bytes32,uint8,bytes32,bytes32)\":{\"notice\":\"Execute a withdrawal with a signed authorization. This is used to transfer tokens back to the root chain.\"}},\"version\":1}},\"settings\":{\"compilationTarget\":{\"contracts/USDC.sol\":\"UChildAdministrableERC20\"},\"evmVersion\":\"istanbul\",\"libraries\":{},\"metadata\":{\"bytecodeHash\":\"none\",\"useLiteralContent\":true},\"optimizer\":{\"enabled\":true,\"runs\":1},\"remappings\":[]},\"sources\":{\"contracts/USDC.sol\":{\"content\":\"// SPDX-License-Identifier: MIT\\npragma solidity 0.6.12;\\n\\nabstract contract Context {\\n    function _msgSender() internal view virtual returns (address payable) {\\n        return msg.sender;\\n    }\\n\\n    function _msgData() internal view virtual returns (bytes memory) {\\n        this; // silence state mutability warning without generating bytecode - see https://github.com/ethereum/solidity/issues/2691\\n        return msg.data;\\n    }\\n}\\n\\ninterface IERC20 {\\n    /**\\n     * @dev Returns the amount of tokens in existence.\\n     */\\n    function totalSupply() external view returns (uint256);\\n\\n    /**\\n     * @dev Returns the amount of tokens owned by `account`.\\n     */\\n    function balanceOf(address account) external view returns (uint256);\\n\\n    /**\\n     * @dev Moves `amount` tokens from the caller's account to `recipient`.\\n     *\\n     * Returns a boolean value indicating whether the operation succeeded.\\n     *\\n     * Emits a {Transfer} event.\\n     */\\n    function transfer(address recipient, uint256 amount)\\n        external\\n        returns (bool);\\n\\n    /**\\n     * @dev Returns the remaining number of tokens that `spender` will be\\n     * allowed to spend on behalf of `owner` through {transferFrom}. This is\\n     * zero by default.\\n     *\\n     * This value changes when {approve} or {transferFrom} are called.\\n     */\\n    function allowance(address owner, address spender)\\n        external\\n        view\\n        returns (uint256);\\n\\n    /**\\n     * @dev Sets `amount` as the allowance of `spender` over the caller's tokens.\\n     *\\n     * Returns a boolean value indicating whether the operation succeeded.\\n     *\\n     * IMPORTANT: Beware that changing an allowance with this method brings the risk\\n     * that someone may use both the old and the new allowance by unfortunate\\n     * transaction ordering. One possible solution to mitigate this race\\n     * condition is to first reduce the spender's allowance to 0 and set the\\n     * desired value afterwards:\\n     * https://github.com/ethereum/EIPs/issues/20#issuecomment-263524729\\n     *\\n     * Emits an {Approval} event.\\n     */\\n    function approve(address spender, uint256 amount) external returns (bool);\\n\\n    /**\\n     * @dev Moves `amount` tokens from `sender` to `recipient` using the\\n     * allowance mechanism. `amount` is then deducted from the caller's\\n     * allowance.\\n     *\\n     * Returns a boolean value indicating whether the operation succeeded.\\n     *\\n     * Emits a {Transfer} event.\\n     */\\n    function transferFrom(\\n        address sender,\\n        address recipient,\\n        uint256 amount\\n    ) external returns (bool);\\n\\n    /**\\n     * @dev Emitted when `value` tokens are moved from one account (`from`) to\\n     * another (`to`).\\n     *\\n     * Note that `value` may be zero.\\n     */\\n    event Transfer(address indexed from, address indexed to, uint256 value);\\n\\n    /**\\n     * @dev Emitted when the allowance of a `spender` for an `owner` is set by\\n     * a call to {approve}. `value` is the new allowance.\\n     */\\n    event Approval(\\n        address indexed owner,\\n        address indexed spender,\\n        uint256 value\\n    );\\n}\\nlibrary SafeMath {\\n    /**\\n     * @dev Returns the addition of two unsigned integers, reverting on\\n     * overflow.\\n     *\\n     * Counterpart to Solidity's `+` operator.\\n     *\\n     * Requirements:\\n     *\\n     * - Addition cannot overflow.\\n     */\\n    function add(uint256 a, uint256 b) internal pure returns (uint256) {\\n        uint256 c = a + b;\\n        require(c >= a, \\\"SafeMath: addition overflow\\\");\\n\\n        return c;\\n    }\\n\\n    /**\\n     * @dev Returns the subtraction of two unsigned integers, reverting on\\n     * overflow (when the result is negative).\\n     *\\n     * Counterpart to Solidity's `-` operator.\\n     *\\n     * Requirements:\\n     *\\n     * - Subtraction cannot overflow.\\n     */\\n    function sub(uint256 a, uint256 b) internal pure returns (uint256) {\\n        return sub(a, b, \\\"SafeMath: subtraction overflow\\\");\\n    }\\n\\n    /**\\n     * @dev Returns the subtraction of two unsigned integers, reverting with custom message on\\n     * overflow (when the result is negative).\\n     *\\n     * Counterpart to Solidity's `-` operator.\\n     *\\n     * Requirements:\\n     *\\n     * - Subtraction cannot overflow.\\n     */\\n    function sub(\\n        uint256 a,\\n        uint256 b,\\n        string memory errorMessage\\n    ) internal pure returns (uint256) {\\n        require(b <= a, errorMessage);\\n        uint256 c = a - b;\\n\\n        return c;\\n    }\\n\\n    /**\\n     * @dev Returns the multiplication of two unsigned integers, reverting on\\n     * overflow.\\n     *\\n     * Counterpart to Solidity's `*` operator.\\n     *\\n     * Requirements:\\n     *\\n     * - Multiplication cannot overflow.\\n     */\\n    function mul(uint256 a, uint256 b) internal pure returns (uint256) {\\n        // Gas optimization: this is cheaper than requiring 'a' not being zero, but the\\n        // benefit is lost if 'b' is also tested.\\n        // See: https://github.com/OpenZeppelin/openzeppelin-contracts/pull/522\\n        if (a == 0) {\\n            return 0;\\n        }\\n\\n        uint256 c = a * b;\\n        require(c / a == b, \\\"SafeMath: multiplication overflow\\\");\\n\\n        return c;\\n    }\\n\\n    /**\\n     * @dev Returns the integer division of two unsigned integers. Reverts on\\n     * division by zero. The result is rounded towards zero.\\n     *\\n     * Counterpart to Solidity's `/` operator. Note: this function uses a\\n     * `revert` opcode (which leaves remaining gas untouched) while Solidity\\n     * uses an invalid opcode to revert (consuming all remaining gas).\\n     *\\n     * Requirements:\\n     *\\n     * - The divisor cannot be zero.\\n     */\\n    function div(uint256 a, uint256 b) internal pure returns (uint256) {\\n        return div(a, b, \\\"SafeMath: division by zero\\\");\\n    }\\n\\n    /**\\n     * @dev Returns the integer division of two unsigned integers. Reverts with custom message on\\n     * division by zero. The result is rounded towards zero.\\n     *\\n     * Counterpart to Solidity's `/` operator. Note: this function uses a\\n     * `revert` opcode (which leaves remaining gas untouched) while Solidity\\n     * uses an invalid opcode to revert (consuming all remaining gas).\\n     *\\n     * Requirements:\\n     *\\n     * - The divisor cannot be zero.\\n     */\\n    function div(\\n        uint256 a,\\n        uint256 b,\\n        string memory errorMessage\\n    ) internal pure returns (uint256) {\\n        require(b > 0, errorMessage);\\n        uint256 c = a / b;\\n        // assert(a == b * c + a % b); // There is no case in which this doesn't hold\\n\\n        return c;\\n    }\\n\\n    /**\\n     * @dev Returns the remainder of dividing two unsigned integers. (unsigned integer modulo),\\n     * Reverts when dividing by zero.\\n     *\\n     * Counterpart to Solidity's `%` operator. This function uses a `revert`\\n     * opcode (which leaves remaining gas untouched) while Solidity uses an\\n     * invalid opcode to revert (consuming all remaining gas).\\n     *\\n     * Requirements:\\n     *\\n     * - The divisor cannot be zero.\\n     */\\n    function mod(uint256 a, uint256 b) internal pure returns (uint256) {\\n        return mod(a, b, \\\"SafeMath: modulo by zero\\\");\\n    }\\n\\n    /**\\n     * @dev Returns the remainder of dividing two unsigned integers. (unsigned integer modulo),\\n     * Reverts with custom message when dividing by zero.\\n     *\\n     * Counterpart to Solidity's `%` operator. This function uses a `revert`\\n     * opcode (which leaves remaining gas untouched) while Solidity uses an\\n     * invalid opcode to revert (consuming all remaining gas).\\n     *\\n     * Requirements:\\n     *\\n     * - The divisor cannot be zero.\\n     */\\n    function mod(\\n        uint256 a,\\n        uint256 b,\\n        string memory errorMessage\\n    ) internal pure returns (uint256) {\\n        require(b != 0, errorMessage);\\n        return a % b;\\n    }\\n}\\nlibrary Address {\\n    /**\\n     * @dev Returns true if `account` is a contract.\\n     *\\n     * [IMPORTANT]\\n     * ====\\n     * It is unsafe to assume that an address for which this function returns\\n     * false is an externally-owned account (EOA) and not a contract.\\n     *\\n     * Among others, `isContract` will return false for the following\\n     * types of addresses:\\n     *\\n     *  - an externally-owned account\\n     *  - a contract in construction\\n     *  - an address where a contract will be created\\n     *  - an address where a contract lived, but was destroyed\\n     * ====\\n     */\\n    function isContract(address account) internal view returns (bool) {\\n        // This method relies in extcodesize, which returns 0 for contracts in\\n        // construction, since the code is only stored at the end of the\\n        // constructor execution.\\n\\n        uint256 size;\\n        // solhint-disable-next-line no-inline-assembly\\n        assembly {\\n            size := extcodesize(account)\\n        }\\n        return size > 0;\\n    }\\n\\n    /**\\n     * @dev Replacement for Solidity's `transfer`: sends `amount` wei to\\n     * `recipient`, forwarding all available gas and reverting on errors.\\n     *\\n     * https://eips.ethereum.org/EIPS/eip-1884[EIP1884] increases the gas cost\\n     * of certain opcodes, possibly making contracts go over the 2300 gas limit\\n     * imposed by `transfer`, making them unable to receive funds via\\n     * `transfer`. {sendValue} removes this limitation.\\n     *\\n     * https://diligence.consensys.net/posts/2019/09/stop-using-soliditys-transfer-now/[Learn more].\\n     *\\n     * IMPORTANT: because control is transferred to `recipient`, care must be\\n     * taken to not create reentrancy vulnerabilities. Consider using\\n     * {ReentrancyGuard} or the\\n     * https://solidity.readthedocs.io/en/v0.5.11/security-considerations.html#use-the-checks-effects-interactions-pattern[checks-effects-interactions pattern].\\n     */\\n    function sendValue(address payable recipient, uint256 amount) internal {\\n        require(\\n            address(this).balance >= amount,\\n            \\\"Address: insufficient balance\\\"\\n        );\\n\\n        // solhint-disable-next-line avoid-low-level-calls, avoid-call-value\\n        (bool success, ) = recipient.call{value: amount}(\\\"\\\");\\n        require(\\n            success,\\n            \\\"Address: unable to send value, recipient may have reverted\\\"\\n        );\\n    }\\n\\n    /**\\n     * @dev Performs a Solidity function call using a low level `call`. A\\n     * plain`call` is an unsafe replacement for a function call: use this\\n     * function instead.\\n     *\\n     * If `target` reverts with a revert reason, it is bubbled up by this\\n     * function (like regular Solidity function calls).\\n     *\\n     * Returns the raw returned data. To convert to the expected return value,\\n     * use https://solidity.readthedocs.io/en/latest/units-and-global-variables.html?highlight=abi.decode#abi-encoding-and-decoding-functions[`abi.decode`].\\n     *\\n     * Requirements:\\n     *\\n     * - `target` must be a contract.\\n     * - calling `target` with `data` must not revert.\\n     *\\n     * _Available since v3.1._\\n     */\\n    function functionCall(address target, bytes memory data)\\n        internal\\n        returns (bytes memory)\\n    {\\n        return functionCall(target, data, \\\"Address: low-level call failed\\\");\\n    }\\n\\n    /**\\n     * @dev Same as {xref-Address-functionCall-address-bytes-}[`functionCall`], but with\\n     * `errorMessage` as a fallback revert reason when `target` reverts.\\n     *\\n     * _Available since v3.1._\\n     */\\n    function functionCall(\\n        address target,\\n        bytes memory data,\\n        string memory errorMessage\\n    ) internal returns (bytes memory) {\\n        return _functionCallWithValue(target, data, 0, errorMessage);\\n    }\\n\\n    /**\\n     * @dev Same as {xref-Address-functionCall-address-bytes-}[`functionCall`],\\n     * but also transferring `value` wei to `target`.\\n     *\\n     * Requirements:\\n     *\\n     * - the calling contract must have an ETH balance of at least `value`.\\n     * - the called Solidity function must be `payable`.\\n     *\\n     * _Available since v3.1._\\n     */\\n    function functionCallWithValue(\\n        address target,\\n        bytes memory data,\\n        uint256 value\\n    ) internal returns (bytes memory) {\\n        return\\n            functionCallWithValue(\\n                target,\\n                data,\\n                value,\\n                \\\"Address: low-level call with value failed\\\"\\n            );\\n    }\\n\\n    /**\\n     * @dev Same as {xref-Address-functionCallWithValue-address-bytes-uint256-}[`functionCallWithValue`], but\\n     * with `errorMessage` as a fallback revert reason when `target` reverts.\\n     *\\n     * _Available since v3.1._\\n     */\\n    function functionCallWithValue(\\n        address target,\\n        bytes memory data,\\n        uint256 value,\\n        string memory errorMessage\\n    ) internal returns (bytes memory) {\\n        require(\\n            address(this).balance >= value,\\n            \\\"Address: insufficient balance for call\\\"\\n        );\\n        return _functionCallWithValue(target, data, value, errorMessage);\\n    }\\n\\n    function _functionCallWithValue(\\n        address target,\\n        bytes memory data,\\n        uint256 weiValue,\\n        string memory errorMessage\\n    ) private returns (bytes memory) {\\n        require(isContract(target), \\\"Address: call to non-contract\\\");\\n\\n        // solhint-disable-next-line avoid-low-level-calls\\n        (bool success, bytes memory returndata) = target.call{value: weiValue}(\\n            data\\n        );\\n        if (success) {\\n            return returndata;\\n        } else {\\n            // Look for revert reason and bubble it up if present\\n            if (returndata.length > 0) {\\n                // The easiest way to bubble the revert reason is using memory via assembly\\n\\n                // solhint-disable-next-line no-inline-assembly\\n                assembly {\\n                    let returndata_size := mload(returndata)\\n                    revert(add(32, returndata), returndata_size)\\n                }\\n            } else {\\n                revert(errorMessage);\\n            }\\n        }\\n    }\\n}\\n\\nabstract contract IERC20Internal {\\n    function _transfer(\\n        address sender,\\n        address recipient,\\n        uint256 amount\\n    ) internal virtual;\\n\\n    function _transferFrom(\\n        address sender,\\n        address recipient,\\n        uint256 amount\\n    ) internal virtual;\\n\\n    function _approve(\\n        address owner,\\n        address spender,\\n        uint256 amount\\n    ) internal virtual;\\n\\n    function _increaseAllowance(\\n        address owner,\\n        address spender,\\n        uint256 increment\\n    ) internal virtual;\\n\\n    function _decreaseAllowance(\\n        address owner,\\n        address spender,\\n        uint256 decrement\\n    ) internal virtual;\\n\\n    function _mint(address account, uint256 amount) internal virtual;\\n\\n    function _burn(address account, uint256 amount) internal virtual;\\n}\\n\\ncontract ERC20 is Context, IERC20, IERC20Internal {\\n    using SafeMath for uint256;\\n    using Address for address;\\n\\n    mapping(address => uint256) private _balances;\\n\\n    mapping(address => mapping(address => uint256)) private _allowances;\\n\\n    uint256 private _totalSupply;\\n\\n    string private _name;\\n    string private _symbol;\\n    uint8 private _decimals;\\n\\n    /**\\n     * @dev Sets the values for {name} and {symbol}, initializes {decimals} with\\n     * a default value of 18.\\n     *\\n     * To select a different value for {decimals}, use {_setupDecimals}.\\n     *\\n     * All three of these values are immutable: they can only be set once during\\n     * construction.\\n     */\\n    constructor(string memory name, string memory symbol) public {\\n        _name = name;\\n        _symbol = symbol;\\n        _decimals = 18;\\n    }\\n\\n    /**\\n     * @dev Returns the name of the token.\\n     */\\n    function name() external view returns (string memory) {\\n        return _name;\\n    }\\n\\n    function _setName(string memory newName) internal {\\n        _name = newName;\\n    }\\n\\n    /**\\n     * @dev Returns the symbol of the token, usually a shorter version of the\\n     * name.\\n     */\\n    function symbol() external view returns (string memory) {\\n        return _symbol;\\n    }\\n\\n    function _setSymbol(string memory newSymbol) internal {\\n        _symbol = newSymbol;\\n    }\\n\\n    /**\\n     * @dev Returns the number of decimals used to get its user representation.\\n     * For example, if `decimals` equals `2`, a balance of `505` tokens should\\n     * be displayed to a user as `5,05` (`505 / 10 ** 2`).\\n     *\\n     * Tokens usually opt for a value of 18, imitating the relationship between\\n     * Ether and Wei. This is the value {ERC20} uses, unless {_setupDecimals} is\\n     * called.\\n     *\\n     * NOTE: This information is only used for _display_ purposes: it in\\n     * no way affects any of the arithmetic of the contract, including\\n     * {IERC20-balanceOf} and {IERC20-transfer}.\\n     */\\n    function decimals() external view returns (uint8) {\\n        return _decimals;\\n    }\\n\\n    function _setDecimals(uint8 newDecimals) internal {\\n        _decimals = newDecimals;\\n    }\\n\\n    /**\\n     * @dev See {IERC20-totalSupply}.\\n     */\\n    function totalSupply() external view override returns (uint256) {\\n        return _totalSupply;\\n    }\\n\\n    /**\\n     * @dev See {IERC20-balanceOf}.\\n     */\\n    function balanceOf(address account)\\n        external\\n        view\\n        override\\n        returns (uint256)\\n    {\\n        return _balances[account];\\n    }\\n\\n    /**\\n     * @dev See {IERC20-transfer}.\\n     *\\n     * Requirements:\\n     *\\n     * - `recipient` cannot be the zero address.\\n     * - the caller must have a balance of at least `amount`.\\n     */\\n    function transfer(address recipient, uint256 amount)\\n        external\\n        virtual\\n        override\\n        returns (bool)\\n    {\\n        _transfer(_msgSender(), recipient, amount);\\n        return true;\\n    }\\n\\n    /**\\n     * @dev See {IERC20-allowance}.\\n     */\\n    function allowance(address owner, address spender)\\n        external\\n        view\\n        virtual\\n        override\\n        returns (uint256)\\n    {\\n        return _allowances[owner][spender];\\n    }\\n\\n    /**\\n     * @dev See {IERC20-approve}.\\n     *\\n     * Requirements:\\n     *\\n     * - `spender` cannot be the zero address.\\n     */\\n    function approve(address spender, uint256 amount)\\n        external\\n        virtual\\n        override\\n        returns (bool)\\n    {\\n        _approve(_msgSender(), spender, amount);\\n        return true;\\n    }\\n\\n    /**\\n     * @dev See {IERC20-transferFrom}.\\n     *\\n     * Emits an {Approval} event indicating the updated allowance. This is not\\n     * required by the EIP. See the note at the beginning of {ERC20};\\n     *\\n     * Requirements:\\n     * - `sender` and `recipient` cannot be the zero address.\\n     * - `sender` must have a balance of at least `amount`.\\n     * - the caller must have allowance for ``sender``'s tokens of at least\\n     * `amount`.\\n     */\\n    function transferFrom(\\n        address sender,\\n        address recipient,\\n        uint256 amount\\n    ) external virtual override returns (bool) {\\n        _transferFrom(sender, recipient, amount);\\n        return true;\\n    }\\n\\n    /**\\n     * @dev Atomically increases the allowance granted to `spender` by the caller.\\n     *\\n     * This is an alternative to {approve} that can be used as a mitigation for\\n     * problems described in {IERC20-approve}.\\n     *\\n     * Emits an {Approval} event indicating the updated allowance.\\n     *\\n     * Requirements:\\n     *\\n     * - `spender` cannot be the zero address.\\n     */\\n    function increaseAllowance(address spender, uint256 addedValue)\\n        external\\n        virtual\\n        returns (bool)\\n    {\\n        _increaseAllowance(_msgSender(), spender, addedValue);\\n        return true;\\n    }\\n\\n    /**\\n     * @dev Atomically decreases the allowance granted to `spender` by the caller.\\n     *\\n     * This is an alternative to {approve} that can be used as a mitigation for\\n     * problems described in {IERC20-approve}.\\n     *\\n     * Emits an {Approval} event indicating the updated allowance.\\n     *\\n     * Requirements:\\n     *\\n     * - `spender` cannot be the zero address.\\n     * - `spender` must have allowance for the caller of at least\\n     * `subtractedValue`.\\n     */\\n    function decreaseAllowance(address spender, uint256 subtractedValue)\\n        external\\n        virtual\\n        returns (bool)\\n    {\\n        _decreaseAllowance(_msgSender(), spender, subtractedValue);\\n        return true;\\n    }\\n\\n    /**\\n     * @dev Moves tokens `amount` from `sender` to `recipient`.\\n     *\\n     * This is internal function is equivalent to {transfer}, and can be used to\\n     * e.g. implement automatic token fees, slashing mechanisms, etc.\\n     *\\n     * Emits a {Transfer} event.\\n     *\\n     * Requirements:\\n     *\\n     * - `sender` cannot be the zero address.\\n     * - `recipient` cannot be the zero address.\\n     * - `sender` must have a balance of at least `amount`.\\n     */\\n    function _transfer(\\n        address sender,\\n        address recipient,\\n        uint256 amount\\n    ) internal virtual override {\\n        require(sender != address(0), \\\"ERC20: transfer from the zero address\\\");\\n        require(recipient != address(0), \\\"ERC20: transfer to the zero address\\\");\\n\\n        _beforeTokenTransfer(sender, recipient, amount);\\n\\n        _balances[sender] = _balances[sender].sub(\\n            amount,\\n            \\\"ERC20: transfer amount exceeds balance\\\"\\n        );\\n        _balances[recipient] = _balances[recipient].add(amount);\\n        emit Transfer(sender, recipient, amount);\\n    }\\n\\n    /** @dev Creates `amount` tokens and assigns them to `account`, increasing\\n     * the total supply.\\n     *\\n     * Emits a {Transfer} event with `from` set to the zero address.\\n     *\\n     * Requirements\\n     *\\n     * - `to` cannot be the zero address.\\n     */\\n    function _mint(address account, uint256 amount) internal virtual override {\\n        require(account != address(0), \\\"ERC20: mint to the zero address\\\");\\n\\n        _beforeTokenTransfer(address(0), account, amount);\\n\\n        _totalSupply = _totalSupply.add(amount);\\n        _balances[account] = _balances[account].add(amount);\\n        emit Transfer(address(0), account, amount);\\n    }\\n\\n    /**\\n     * @dev Destroys `amount` tokens from `account`, reducing the\\n     * total supply.\\n     *\\n     * Emits a {Transfer} event with `to` set to the zero address.\\n     *\\n     * Requirements\\n     *\\n     * - `account` cannot be the zero address.\\n     * - `account` must have at least `amount` tokens.\\n     */\\n    function _burn(address account, uint256 amount) internal virtual override {\\n        require(account != address(0), \\\"ERC20: burn from the zero address\\\");\\n\\n        _beforeTokenTransfer(account, address(0), amount);\\n\\n        _balances[account] = _balances[account].sub(\\n            amount,\\n            \\\"ERC20: burn amount exceeds balance\\\"\\n        );\\n        _totalSupply = _totalSupply.sub(amount);\\n        emit Transfer(account, address(0), amount);\\n    }\\n\\n    /**\\n     * @dev Sets `amount` as the allowance of `spender` over the `owner`s tokens.\\n     *\\n     * This is internal function is equivalent to `approve`, and can be used to\\n     * e.g. set automatic allowances for certain subsystems, etc.\\n     *\\n     * Emits an {Approval} event.\\n     *\\n     * Requirements:\\n     *\\n     * - `owner` cannot be the zero address.\\n     * - `spender` cannot be the zero address.\\n     */\\n    function _approve(\\n        address owner,\\n        address spender,\\n        uint256 amount\\n    ) internal virtual override {\\n        require(owner != address(0), \\\"ERC20: approve from the zero address\\\");\\n        require(spender != address(0), \\\"ERC20: approve to the zero address\\\");\\n\\n        _allowances[owner][spender] = amount;\\n        emit Approval(owner, spender, amount);\\n    }\\n\\n    /**\\n     * @dev Sets {decimals} to a value other than the default one of 18.\\n     *\\n     * WARNING: This function should only be called from the constructor. Most\\n     * applications that interact with token contracts will not expect\\n     * {decimals} to ever change, and may work incorrectly if it does.\\n     */\\n    function _setupDecimals(uint8 decimals_) internal {\\n        _decimals = decimals_;\\n    }\\n\\n    /**\\n     * @dev Hook that is called before any transfer of tokens. This includes\\n     * minting and burning.\\n     *\\n     * Calling conditions:\\n     *\\n     * - when `from` and `to` are both non-zero, `amount` of ``from``'s tokens\\n     * will be to transferred to `to`.\\n     * - when `from` is zero, `amount` tokens will be minted for `to`.\\n     * - when `to` is zero, `amount` of ``from``'s tokens will be burned.\\n     * - `from` and `to` are never both zero.\\n     *\\n     * To learn more about hooks, head to xref:ROOT:extending-contracts.adoc#using-hooks[Using Hooks].\\n     */\\n    function _beforeTokenTransfer(\\n        address from,\\n        address to,\\n        uint256 amount\\n    ) internal virtual {}\\n\\n    function _transferFrom(\\n        address sender,\\n        address recipient,\\n        uint256 amount\\n    ) internal virtual override {\\n        _transfer(sender, recipient, amount);\\n        _approve(\\n            sender,\\n            _msgSender(),\\n            _allowances[sender][_msgSender()].sub(\\n                amount,\\n                \\\"ERC20: transfer amount exceeds allowance\\\"\\n            )\\n        );\\n    }\\n\\n    function _increaseAllowance(\\n        address owner,\\n        address spender,\\n        uint256 addedValue\\n    ) internal virtual override {\\n        _approve(owner, spender, _allowances[owner][spender].add(addedValue));\\n    }\\n\\n    function _decreaseAllowance(\\n        address owner,\\n        address spender,\\n        uint256 subtractedValue\\n    ) internal virtual override {\\n        _approve(\\n            owner,\\n            spender,\\n            _allowances[owner][spender].sub(\\n                subtractedValue,\\n                \\\"ERC20: decreased allowance below zero\\\"\\n            )\\n        );\\n    }\\n}\\n\\nlibrary EnumerableSet {\\n    // To implement this library for multiple types with as little code\\n    // repetition as possible, we write it in terms of a generic Set type with\\n    // bytes32 values.\\n    // The Set implementation uses private functions, and user-facing\\n    // implementations (such as AddressSet) are just wrappers around the\\n    // underlying Set.\\n    // This means that we can only create new EnumerableSets for types that fit\\n    // in bytes32.\\n\\n    struct Set {\\n        // Storage of set values\\n        bytes32[] _values;\\n        // Position of the value in the `values` array, plus 1 because index 0\\n        // means a value is not in the set.\\n        mapping(bytes32 => uint256) _indexes;\\n    }\\n\\n    /**\\n     * @dev Add a value to a set. O(1).\\n     *\\n     * Returns true if the value was added to the set, that is if it was not\\n     * already present.\\n     */\\n    function _add(Set storage set, bytes32 value) private returns (bool) {\\n        if (!_contains(set, value)) {\\n            set._values.push(value);\\n            // The value is stored at length-1, but we add 1 to all indexes\\n            // and use 0 as a sentinel value\\n            set._indexes[value] = set._values.length;\\n            return true;\\n        } else {\\n            return false;\\n        }\\n    }\\n\\n    /**\\n     * @dev Removes a value from a set. O(1).\\n     *\\n     * Returns true if the value was removed from the set, that is if it was\\n     * present.\\n     */\\n    function _remove(Set storage set, bytes32 value) private returns (bool) {\\n        // We read and store the value's index to prevent multiple reads from the same storage slot\\n        uint256 valueIndex = set._indexes[value];\\n\\n        if (valueIndex != 0) {\\n            // Equivalent to contains(set, value)\\n            // To delete an element from the _values array in O(1), we swap the element to delete with the last one in\\n            // the array, and then remove the last element (sometimes called as 'swap and pop').\\n            // This modifies the order of the array, as noted in {at}.\\n\\n            uint256 toDeleteIndex = valueIndex - 1;\\n            uint256 lastIndex = set._values.length - 1;\\n\\n            // When the value to delete is the last one, the swap operation is unnecessary. However, since this occurs\\n            // so rarely, we still do the swap anyway to avoid the gas cost of adding an 'if' statement.\\n\\n            bytes32 lastvalue = set._values[lastIndex];\\n\\n            // Move the last value to the index where the value to delete is\\n            set._values[toDeleteIndex] = lastvalue;\\n            // Update the index for the moved value\\n            set._indexes[lastvalue] = toDeleteIndex + 1; // All indexes are 1-based\\n\\n            // Delete the slot where the moved value was stored\\n            set._values.pop();\\n\\n            // Delete the index for the deleted slot\\n            delete set._indexes[value];\\n\\n            return true;\\n        } else {\\n            return false;\\n        }\\n    }\\n\\n    /**\\n     * @dev Returns true if the value is in the set. O(1).\\n     */\\n    function _contains(Set storage set, bytes32 value)\\n        private\\n        view\\n        returns (bool)\\n    {\\n        return set._indexes[value] != 0;\\n    }\\n\\n    /**\\n     * @dev Returns the number of values on the set. O(1).\\n     */\\n    function _length(Set storage set) private view returns (uint256) {\\n        return set._values.length;\\n    }\\n\\n    /**\\n     * @dev Returns the value stored at position `index` in the set. O(1).\\n     *\\n     * Note that there are no guarantees on the ordering of values inside the\\n     * array, and it may change when more values are added or removed.\\n     *\\n     * Requirements:\\n     *\\n     * - `index` must be strictly less than {length}.\\n     */\\n    function _at(Set storage set, uint256 index)\\n        private\\n        view\\n        returns (bytes32)\\n    {\\n        require(\\n            set._values.length > index,\\n            \\\"EnumerableSet: index out of bounds\\\"\\n        );\\n        return set._values[index];\\n    }\\n\\n    // AddressSet\\n\\n    struct AddressSet {\\n        Set _inner;\\n    }\\n\\n    /**\\n     * @dev Add a value to a set. O(1).\\n     *\\n     * Returns true if the value was added to the set, that is if it was not\\n     * already present.\\n     */\\n    function add(AddressSet storage set, address value)\\n        internal\\n        returns (bool)\\n    {\\n        return _add(set._inner, bytes32(uint256(value)));\\n    }\\n\\n    /**\\n     * @dev Removes a value from a set. O(1).\\n     *\\n     * Returns true if the value was removed from the set, that is if it was\\n     * present.\\n     */\\n    function remove(AddressSet storage set, address value)\\n        internal\\n        returns (bool)\\n    {\\n        return _remove(set._inner, bytes32(uint256(value)));\\n    }\\n\\n    /**\\n     * @dev Returns true if the value is in the set. O(1).\\n     */\\n    function contains(AddressSet storage set, address value)\\n        internal\\n        view\\n        returns (bool)\\n    {\\n        return _contains(set._inner, bytes32(uint256(value)));\\n    }\\n\\n    /**\\n     * @dev Returns the number of values in the set. O(1).\\n     */\\n    function length(AddressSet storage set) internal view returns (uint256) {\\n        return _length(set._inner);\\n    }\\n\\n    /**\\n     * @dev Returns the value stored at position `index` in the set. O(1).\\n     *\\n     * Note that there are no guarantees on the ordering of values inside the\\n     * array, and it may change when more values are added or removed.\\n     *\\n     * Requirements:\\n     *\\n     * - `index` must be strictly less than {length}.\\n     */\\n    function at(AddressSet storage set, uint256 index)\\n        internal\\n        view\\n        returns (address)\\n    {\\n        return address(uint256(_at(set._inner, index)));\\n    }\\n\\n    // UintSet\\n\\n    struct UintSet {\\n        Set _inner;\\n    }\\n\\n    /**\\n     * @dev Add a value to a set. O(1).\\n     *\\n     * Returns true if the value was added to the set, that is if it was not\\n     * already present.\\n     */\\n    function add(UintSet storage set, uint256 value) internal returns (bool) {\\n        return _add(set._inner, bytes32(value));\\n    }\\n\\n    /**\\n     * @dev Removes a value from a set. O(1).\\n     *\\n     * Returns true if the value was removed from the set, that is if it was\\n     * present.\\n     */\\n    function remove(UintSet storage set, uint256 value)\\n        internal\\n        returns (bool)\\n    {\\n        return _remove(set._inner, bytes32(value));\\n    }\\n\\n    /**\\n     * @dev Returns true if the value is in the set. O(1).\\n     */\\n    function contains(UintSet storage set, uint256 value)\\n        internal\\n        view\\n        returns (bool)\\n    {\\n        return _contains(set._inner, bytes32(value));\\n    }\\n\\n    /**\\n     * @dev Returns the number of values on the set. O(1).\\n     */\\n    function length(UintSet storage set) internal view returns (uint256) {\\n        return _length(set._inner);\\n    }\\n\\n    /**\\n     * @dev Returns the value stored at position `index` in the set. O(1).\\n     *\\n     * Note that there are no guarantees on the ordering of values inside the\\n     * array, and it may change when more values are added or removed.\\n     *\\n     * Requirements:\\n     *\\n     * - `index` must be strictly less than {length}.\\n     */\\n    function at(UintSet storage set, uint256 index)\\n        internal\\n        view\\n        returns (uint256)\\n    {\\n        return uint256(_at(set._inner, index));\\n    }\\n}\\n\\nabstract contract AccessControl is Context {\\n    using EnumerableSet for EnumerableSet.AddressSet;\\n    using Address for address;\\n\\n    struct RoleData {\\n        EnumerableSet.AddressSet members;\\n        bytes32 adminRole;\\n    }\\n\\n    mapping(bytes32 => RoleData) private _roles;\\n\\n    bytes32 public constant DEFAULT_ADMIN_ROLE = 0x00;\\n\\n    /**\\n     * @dev Emitted when `newAdminRole` is set as ``role``'s admin role, replacing `previousAdminRole`\\n     *\\n     * `DEFAULT_ADMIN_ROLE` is the starting admin for all roles, despite\\n     * {RoleAdminChanged} not being emitted signaling this.\\n     *\\n     * _Available since v3.1._\\n     */\\n    event RoleAdminChanged(\\n        bytes32 indexed role,\\n        bytes32 indexed previousAdminRole,\\n        bytes32 indexed newAdminRole\\n    );\\n\\n    /**\\n     * @dev Emitted when `account` is granted `role`.\\n     *\\n     * `sender` is the account that originated the contract call, an admin role\\n     * bearer except when using {_setupRole}.\\n     */\\n    event RoleGranted(\\n        bytes32 indexed role,\\n        address indexed account,\\n        address indexed sender\\n    );\\n\\n    /**\\n     * @dev Emitted when `account` is revoked `role`.\\n     *\\n     * `sender` is the account that originated the contract call:\\n     *   - if using `revokeRole`, it is the admin role bearer\\n     *   - if using `renounceRole`, it is the role bearer (i.e. `account`)\\n     */\\n    event RoleRevoked(\\n        bytes32 indexed role,\\n        address indexed account,\\n        address indexed sender\\n    );\\n\\n    /**\\n     * @dev Returns `true` if `account` has been granted `role`.\\n     */\\n    function hasRole(bytes32 role, address account) public view returns (bool) {\\n        return _roles[role].members.contains(account);\\n    }\\n\\n    /**\\n     * @dev Returns the number of accounts that have `role`. Can be used\\n     * together with {getRoleMember} to enumerate all bearers of a role.\\n     */\\n    function getRoleMemberCount(bytes32 role) public view returns (uint256) {\\n        return _roles[role].members.length();\\n    }\\n\\n    /**\\n     * @dev Returns one of the accounts that have `role`. `index` must be a\\n     * value between 0 and {getRoleMemberCount}, non-inclusive.\\n     *\\n     * Role bearers are not sorted in any particular way, and their ordering may\\n     * change at any point.\\n     *\\n     * WARNING: When using {getRoleMember} and {getRoleMemberCount}, make sure\\n     * you perform all queries on the same block. See the following\\n     * https://forum.openzeppelin.com/t/iterating-over-elements-on-enumerableset-in-openzeppelin-contracts/2296[forum post]\\n     * for more information.\\n     */\\n    function getRoleMember(bytes32 role, uint256 index)\\n        public\\n        view\\n        returns (address)\\n    {\\n        return _roles[role].members.at(index);\\n    }\\n\\n    /**\\n     * @dev Returns the admin role that controls `role`. See {grantRole} and\\n     * {revokeRole}.\\n     *\\n     * To change a role's admin, use {_setRoleAdmin}.\\n     */\\n    function getRoleAdmin(bytes32 role) public view returns (bytes32) {\\n        return _roles[role].adminRole;\\n    }\\n\\n    /**\\n     * @dev Grants `role` to `account`.\\n     *\\n     * If `account` had not been already granted `role`, emits a {RoleGranted}\\n     * event.\\n     *\\n     * Requirements:\\n     *\\n     * - the caller must have ``role``'s admin role.\\n     */\\n    function grantRole(bytes32 role, address account) public virtual {\\n        require(\\n            hasRole(_roles[role].adminRole, _msgSender()),\\n            \\\"AccessControl: sender must be an admin to grant\\\"\\n        );\\n\\n        _grantRole(role, account);\\n    }\\n\\n    /**\\n     * @dev Revokes `role` from `account`.\\n     *\\n     * If `account` had been granted `role`, emits a {RoleRevoked} event.\\n     *\\n     * Requirements:\\n     *\\n     * - the caller must have ``role``'s admin role.\\n     */\\n    function revokeRole(bytes32 role, address account) public virtual {\\n        require(\\n            hasRole(_roles[role].adminRole, _msgSender()),\\n            \\\"AccessControl: sender must be an admin to revoke\\\"\\n        );\\n\\n        _revokeRole(role, account);\\n    }\\n\\n    /**\\n     * @dev Revokes `role` from the calling account.\\n     *\\n     * Roles are often managed via {grantRole} and {revokeRole}: this function's\\n     * purpose is to provide a mechanism for accounts to lose their privileges\\n     * if they are compromised (such as when a trusted device is misplaced).\\n     *\\n     * If the calling account had been granted `role`, emits a {RoleRevoked}\\n     * event.\\n     *\\n     * Requirements:\\n     *\\n     * - the caller must be `account`.\\n     */\\n    function renounceRole(bytes32 role, address account) public virtual {\\n        require(\\n            account == _msgSender(),\\n            \\\"AccessControl: can only renounce roles for self\\\"\\n        );\\n\\n        _revokeRole(role, account);\\n    }\\n\\n    /**\\n     * @dev Grants `role` to `account`.\\n     *\\n     * If `account` had not been already granted `role`, emits a {RoleGranted}\\n     * event. Note that unlike {grantRole}, this function doesn't perform any\\n     * checks on the calling account.\\n     *\\n     * [WARNING]\\n     * ====\\n     * This function should only be called from the constructor when setting\\n     * up the initial roles for the system.\\n     *\\n     * Using this function in any other way is effectively circumventing the admin\\n     * system imposed by {AccessControl}.\\n     * ====\\n     */\\n    function _setupRole(bytes32 role, address account) internal virtual {\\n        _grantRole(role, account);\\n    }\\n\\n    /**\\n     * @dev Sets `adminRole` as ``role``'s admin role.\\n     *\\n     * Emits a {RoleAdminChanged} event.\\n     */\\n    function _setRoleAdmin(bytes32 role, bytes32 adminRole) internal virtual {\\n        emit RoleAdminChanged(role, _roles[role].adminRole, adminRole);\\n        _roles[role].adminRole = adminRole;\\n    }\\n\\n    function _grantRole(bytes32 role, address account) private {\\n        if (_roles[role].members.add(account)) {\\n            emit RoleGranted(role, account, _msgSender());\\n        }\\n    }\\n\\n    function _revokeRole(bytes32 role, address account) private {\\n        if (_roles[role].members.remove(account)) {\\n            emit RoleRevoked(role, account, _msgSender());\\n        }\\n    }\\n}\\n\\ncontract AccessControlMixin is AccessControl {\\n    string private _revertMsg;\\n\\n    function _setupContractId(string memory contractId) internal {\\n        _revertMsg = string(\\n            abi.encodePacked(contractId, \\\": INSUFFICIENT_PERMISSIONS\\\")\\n        );\\n    }\\n\\n    modifier only(bytes32 role) {\\n        require(hasRole(role, _msgSender()), _revertMsg);\\n        _;\\n    }\\n}\\n\\ninterface IChildToken {\\n    function deposit(address user, bytes calldata depositData) external;\\n}\\n\\ncontract Initializable {\\n    bool private _initialized = false;\\n\\n    modifier initializer() {\\n        // solhint-disable-next-line reason-string\\n        require(!_initialized);\\n        _;\\n        _initialized = true;\\n    }\\n\\n    function initialized() external view returns (bool) {\\n        return _initialized;\\n    }\\n}\\n\\nlibrary ECRecover {\\n    /**\\n     * @notice Recover signer's address from a signed message\\n     * @dev Adapted from: https://github.com/OpenZeppelin/openzeppelin-contracts/blob/65e4ffde586ec89af3b7e9140bdc9235d1254853/contracts/cryptography/ECDSA.sol\\n     * Modifications: Accept v, r, and s as separate arguments\\n     * @param digest    Keccak-256 hash digest of the signed message\\n     * @param v         v of the signature\\n     * @param r         r of the signature\\n     * @param s         s of the signature\\n     * @return Signer address\\n     */\\n    function recover(\\n        bytes32 digest,\\n        uint8 v,\\n        bytes32 r,\\n        bytes32 s\\n    ) internal pure returns (address) {\\n        // EIP-2 still allows signature malleability for ecrecover(). Remove this possibility and make the signature\\n        // unique. Appendix F in the Ethereum Yellow paper (https://ethereum.github.io/yellowpaper/paper.pdf), defines\\n        // the valid range for s in (281): 0 < s < secp256k1n \\u00f7 2 + 1, and for v in (282): v \\u2208 {27, 28}. Most\\n        // signatures from current libraries generate a unique signature with an s-value in the lower half order.\\n        //\\n        // If your library generates malleable signatures, such as s-values in the upper range, calculate a new s-value\\n        // with 0xFFFFFFFFFFFFFFFFFFFFFFFFFFFFFFFEBAAEDCE6AF48A03BBFD25E8CD0364141 - s1 and flip v from 27 to 28 or\\n        // vice versa. If your library also generates signatures with 0/1 for v instead 27/28, add 27 to v to accept\\n        // these malleable signatures as well.\\n        if (\\n            uint256(s) >\\n            0x7FFFFFFFFFFFFFFFFFFFFFFFFFFFFFFF5D576E7357A4501DDFE92F46681B20A0\\n        ) {\\n            revert(\\\"ECRecover: invalid signature 's' value\\\");\\n        }\\n\\n        if (v != 27 && v != 28) {\\n            revert(\\\"ECRecover: invalid signature 'v' value\\\");\\n        }\\n\\n        // If the signature is valid (and not malleable), return the signer address\\n        address signer = ecrecover(digest, v, r, s);\\n        require(signer != address(0), \\\"ECRecover: invalid signature\\\");\\n\\n        return signer;\\n    }\\n}\\n\\nlibrary EIP712 {\\n    // keccak256(\\\"EIP712Domain(string name,string version,address verifyingContract,bytes32 salt)\\\")\\n    bytes32 public constant EIP712_DOMAIN_TYPEHASH =\\n        0x36c25de3e541d5d970f66e4210d728721220fff5c077cc6cd008b3a0c62adab7;\\n\\n    /**\\n     * @notice Make EIP712 domain separator\\n     * @param name      Contract name\\n     * @param version   Contract version\\n     * @return Domain separator\\n     */\\n    function makeDomainSeparator(string memory name, string memory version)\\n        internal\\n        view\\n        returns (bytes32)\\n    {\\n        uint256 chainId;\\n        assembly {\\n            chainId := chainid()\\n        }\\n        \\n        return\\n            keccak256(\\n                abi.encode(\\n                    EIP712_DOMAIN_TYPEHASH,\\n                    keccak256(bytes(name)),\\n                    keccak256(bytes(version)),\\n                    address(this),\\n                    bytes32(chainId)\\n                )\\n            );\\n    }\\n\\n    /**\\n     * @notice Recover signer's address from a EIP712 signature\\n     * @param domainSeparator   Domain separator\\n     * @param v                 v of the signature\\n     * @param r                 r of the signature\\n     * @param s                 s of the signature\\n     * @param typeHashAndData   Type hash concatenated with data\\n     * @return Signer's address\\n     */\\n    function recover(\\n        bytes32 domainSeparator,\\n        uint8 v,\\n        bytes32 r,\\n        bytes32 s,\\n        bytes memory typeHashAndData\\n    ) internal pure returns (address) {\\n        bytes32 digest = keccak256(\\n            abi.encodePacked(\\n                \\\"\\\\x19\\\\x01\\\",\\n                domainSeparator,\\n                keccak256(typeHashAndData)\\n            )\\n        );\\n        return ECRecover.recover(digest, v, r, s);\\n    }\\n}\\n\\nabstract contract EIP712Domain {\\n    bytes32 public DOMAIN_SEPARATOR;\\n\\n    function _setDomainSeparator(string memory name, string memory version)\\n        internal\\n    {\\n        DOMAIN_SEPARATOR = EIP712.makeDomainSeparator(name, version);\\n    }\\n}\\n\\nabstract contract Nonces {\\n    mapping(address => uint256) internal _nonces;\\n\\n    /**\\n     * @notice Nonces for permit / meta-transactions\\n     * @param owner Token owner's address\\n     * @return Next nonce\\n     */\\n    function nonces(address owner) external view returns (uint256) {\\n        return _nonces[owner];\\n    }\\n}\\n\\nabstract contract NativeMetaTransaction is EIP712Domain, Nonces {\\n    // keccak256(\\\"MetaTransaction(uint256 nonce,address from,bytes functionSignature)\\\")\\n    bytes32 public constant META_TRANSACTION_TYPEHASH =\\n        0x23d10def3caacba2e4042e0c75d44a42d2558aabcf5ce951d0642a8032e1e653;\\n\\n    event MetaTransactionExecuted(\\n        address userAddress,\\n        address payable relayerAddress,\\n        bytes functionSignature\\n    );\\n\\n    /*\\n     * Meta transaction structure.\\n     * No point of including value field here as if user is doing value transfer then he has the funds to pay for gas\\n     * He should call the desired function directly in that case.\\n     */\\n    struct MetaTransaction {\\n        uint256 nonce;\\n        address from;\\n        bytes functionSignature;\\n    }\\n\\n    function executeMetaTransaction(\\n        address userAddress,\\n        bytes memory functionSignature,\\n        bytes32 sigR,\\n        bytes32 sigS,\\n        uint8 sigV\\n    ) external payable returns (bytes memory) {\\n        MetaTransaction memory metaTx = MetaTransaction({\\n            nonce: _nonces[userAddress]++,\\n            from: userAddress,\\n            functionSignature: functionSignature\\n        });\\n        \\n        require(\\n            _verify(userAddress, metaTx, sigR, sigS, sigV),\\n            \\\"Signer and signature do not match\\\"\\n        );\\n\\n        emit MetaTransactionExecuted(\\n            userAddress,\\n            msg.sender,\\n            functionSignature\\n        );\\n\\n        // Append userAddress and relayer address at the end to extract it from calling context\\n        // solhint-disable-next-line avoid-low-level-calls\\n        (bool success, bytes memory returnData) = address(this).call(\\n            abi.encodePacked(functionSignature, userAddress)\\n        );\\n        require(success, \\\"Function call not successful\\\");\\n\\n        return returnData;\\n    }\\n\\n    function _verify(\\n        address signer,\\n        MetaTransaction memory metaTx,\\n        bytes32 sigR,\\n        bytes32 sigS,\\n        uint8 sigV\\n    ) internal view returns (bool) {\\n        require(signer != address(0), \\\"NativeMetaTransaction: INVALID_SIGNER\\\");\\n\\n        bytes memory data = abi.encode(\\n            META_TRANSACTION_TYPEHASH,\\n            metaTx.nonce,\\n            metaTx.from,\\n            keccak256(metaTx.functionSignature)\\n        );\\n\\n        return\\n            EIP712.recover(DOMAIN_SEPARATOR, sigV, sigR, sigS, data) == signer;\\n    }\\n}\\n\\nabstract contract ContextMixin {\\n    function msgSender() internal view returns (address payable sender) {\\n        if (msg.sender == address(this)) {\\n            bytes memory array = msg.data;\\n            uint256 index = msg.data.length;\\n            assembly {\\n                // Load the 32 bytes word from memory with the address on the lower 20 bytes, and mask those.\\n                sender := and(\\n                    mload(add(array, index)),\\n                    0xffffffffffffffffffffffffffffffffffffffff\\n                )\\n            }\\n        } else {\\n            sender = msg.sender;\\n        }\\n        return sender;\\n    }\\n}\\n\\nabstract contract Permit is IERC20Internal, EIP712Domain, Nonces {\\n    // = keccak256(\\\"Permit(address owner,address spender,uint256 value,uint256 nonce,uint256 deadline)\\\")\\n    bytes32 public constant PERMIT_TYPEHASH =\\n        0x6e71edae12b1b97f4d1f60370fef10105fa2faae0126114a169c64845d6126c9;\\n\\n    /**\\n     * @notice Verify a signed approval permit and execute if valid\\n     * @param owner     Token owner's address (Authorizer)\\n     * @param spender   Spender's address\\n     * @param value     Amount of allowance\\n     * @param deadline  The time at which this expires (unix time)\\n     * @param v         v of the signature\\n     * @param r         r of the signature\\n     * @param s         s of the signature\\n     */\\n    function _permit(\\n        address owner,\\n        address spender,\\n        uint256 value,\\n        uint256 deadline,\\n        uint8 v,\\n        bytes32 r,\\n        bytes32 s\\n    ) internal {\\n        require(msg.sender != address(this), \\\"Caller is this contract\\\");\\n        require(deadline >= now, \\\"Permit: permit is expired\\\");\\n\\n        bytes memory data = abi.encode(\\n            PERMIT_TYPEHASH,\\n            owner,\\n            spender,\\n            value,\\n            _nonces[owner]++,\\n            deadline\\n        );\\n        require(\\n            EIP712.recover(DOMAIN_SEPARATOR, v, r, s, data) == owner,\\n            \\\"Permit: invalid signature\\\"\\n        );\\n\\n        _approve(owner, spender, value);\\n    }\\n}\\n\\nabstract contract GasAbstraction is IERC20Internal, EIP712Domain {\\n    bytes32 public constant TRANSFER_WITH_AUTHORIZATION_TYPEHASH =\\n        0x7c7c6cdb67a18743f49ec6fa9b35f50d52ed05cbed4cc592e13b44501c1a2267;\\n    // = keccak256(\\\"TransferWithAuthorization(address from,address to,uint256 value,uint256 validAfter,uint256 validBefore,bytes32 nonce)\\\")\\n    bytes32 public constant APPROVE_WITH_AUTHORIZATION_TYPEHASH =\\n        0x808c10407a796f3ef2c7ea38c0638ea9d2b8a1c63e3ca9e1f56ce84ae59df73c;\\n    // = keccak256(\\\"ApproveWithAuthorization(address owner,address spender,uint256 value,uint256 validAfter,uint256 validBefore,bytes32 nonce)\\\")\\n    bytes32 public constant INCREASE_ALLOWANCE_WITH_AUTHORIZATION_TYPEHASH =\\n        0x424222bb050a1f7f14017232a5671f2680a2d3420f504bd565cf03035c53198a;\\n    // = keccak256(\\\"IncreaseAllowanceWithAuthorization(address owner,address spender,uint256 increment,uint256 validAfter,uint256 validBefore,bytes32 nonce)\\\")\\n    bytes32 public constant DECREASE_ALLOWANCE_WITH_AUTHORIZATION_TYPEHASH =\\n        0xb70559e94cbda91958ebec07f9b65b3b490097c8d25c8dacd71105df1015b6d8;\\n    // = keccak256(\\\"DecreaseAllowanceWithAuthorization(address owner,address spender,uint256 decrement,uint256 validAfter,uint256 validBefore,bytes32 nonce)\\\")\\n    bytes32 public constant CANCEL_AUTHORIZATION_TYPEHASH =\\n        0x158b0a9edf7a828aad02f63cd515c68ef2f50ba807396f6d12842833a1597429;\\n    // = keccak256(\\\"CancelAuthorization(address authorizer,bytes32 nonce)\\\")\\n\\n    enum AuthorizationState {\\n        Unused,\\n        Used,\\n        Canceled\\n    }\\n\\n    /**\\n     * @dev authorizer address => nonce => authorization state\\n     */\\n    mapping(address => mapping(bytes32 => AuthorizationState))\\n        private _authorizationStates;\\n\\n    event AuthorizationUsed(address indexed authorizer, bytes32 indexed nonce);\\n    event AuthorizationCanceled(\\n        address indexed authorizer,\\n        bytes32 indexed nonce\\n    );\\n\\n    /**\\n     * @notice Returns the state of an authorization\\n     * @param authorizer    Authorizer's address\\n     * @param nonce         Nonce of the authorization\\n     * @return Authorization state\\n     */\\n    function authorizationState(address authorizer, bytes32 nonce)\\n        external\\n        view\\n        returns (AuthorizationState)\\n    {\\n        return _authorizationStates[authorizer][nonce];\\n    }\\n\\n    /**\\n     * @notice Verify a signed transfer authorization and execute if valid\\n     * @param from          Payer's address (Authorizer)\\n     * @param to            Payee's address\\n     * @param value         Amount to be transferred\\n     * @param validAfter    The time after which this is valid (unix time)\\n     * @param validBefore   The time before which this is valid (unix time)\\n     * @param nonce         Unique nonce\\n     * @param v             v of the signature\\n     * @param r             r of the signature\\n     * @param s             s of the signature\\n     */\\n    function _transferWithAuthorization(\\n        address from,\\n        address to,\\n        uint256 value,\\n        uint256 validAfter,\\n        uint256 validBefore,\\n        bytes32 nonce,\\n        uint8 v,\\n        bytes32 r,\\n        bytes32 s\\n    ) internal {\\n        _requireValidAuthorization(from, nonce, validAfter, validBefore);\\n\\n        bytes memory data = abi.encode(\\n            TRANSFER_WITH_AUTHORIZATION_TYPEHASH,\\n            from,\\n            to,\\n            value,\\n            validAfter,\\n            validBefore,\\n            nonce\\n        );\\n        require(\\n            EIP712.recover(DOMAIN_SEPARATOR, v, r, s, data) == from,\\n            \\\"GasAbstraction: invalid signature\\\"\\n        );\\n\\n        _markAuthorizationAsUsed(from, nonce);\\n        _transfer(from, to, value);\\n    }\\n\\n    /**\\n     * @notice Verify a signed authorization for an increase in the allowance\\n     * granted to the spender and execute if valid\\n     * @param owner         Token owner's address (Authorizer)\\n     * @param spender       Spender's address\\n     * @param increment     Amount of increase in allowance\\n     * @param validAfter    The time after which this is valid (unix time)\\n     * @param validBefore   The time before which this is valid (unix time)\\n     * @param nonce         Unique nonce\\n     * @param v             v of the signature\\n     * @param r             r of the signature\\n     * @param s             s of the signature\\n     */\\n    function _increaseAllowanceWithAuthorization(\\n        address owner,\\n        address spender,\\n        uint256 increment,\\n        uint256 validAfter,\\n        uint256 validBefore,\\n        bytes32 nonce,\\n        uint8 v,\\n        bytes32 r,\\n        bytes32 s\\n    ) internal {\\n        _requireValidAuthorization(owner, nonce, validAfter, validBefore);\\n\\n        bytes memory data = abi.encode(\\n            INCREASE_ALLOWANCE_WITH_AUTHORIZATION_TYPEHASH,\\n            owner,\\n            spender,\\n            increment,\\n            validAfter,\\n            validBefore,\\n            nonce\\n        );\\n        require(\\n            EIP712.recover(DOMAIN_SEPARATOR, v, r, s, data) == owner,\\n            \\\"GasAbstraction: invalid signature\\\"\\n        );\\n\\n        _markAuthorizationAsUsed(owner, nonce);\\n        _increaseAllowance(owner, spender, increment);\\n    }\\n\\n    /**\\n     * @notice Verify a signed authorization for a decrease in the allowance\\n     * granted to the spender and execute if valid\\n     * @param owner         Token owner's address (Authorizer)\\n     * @param spender       Spender's address\\n     * @param decrement     Amount of decrease in allowance\\n     * @param validAfter    The time after which this is valid (unix time)\\n     * @param validBefore   The time before which this is valid (unix time)\\n     * @param nonce         Unique nonce\\n     * @param v             v of the signature\\n     * @param r             r of the signature\\n     * @param s             s of the signature\\n     */\\n    function _decreaseAllowanceWithAuthorization(\\n        address owner,\\n        address spender,\\n        uint256 decrement,\\n        uint256 validAfter,\\n        uint256 validBefore,\\n        bytes32 nonce,\\n        uint8 v,\\n        bytes32 r,\\n        bytes32 s\\n    ) internal {\\n        _requireValidAuthorization(owner, nonce, validAfter, validBefore);\\n\\n        bytes memory data = abi.encode(\\n            DECREASE_ALLOWANCE_WITH_AUTHORIZATION_TYPEHASH,\\n            owner,\\n            spender,\\n            decrement,\\n            validAfter,\\n            validBefore,\\n            nonce\\n        );\\n        require(\\n            EIP712.recover(DOMAIN_SEPARATOR, v, r, s, data) == owner,\\n            \\\"GasAbstraction: invalid signature\\\"\\n        );\\n\\n        _markAuthorizationAsUsed(owner, nonce);\\n        _decreaseAllowance(owner, spender, decrement);\\n    }\\n\\n    /**\\n     * @notice Verify a signed approval authorization and execute if valid\\n     * @param owner         Token owner's address (Authorizer)\\n     * @param spender       Spender's address\\n     * @param value         Amount of allowance\\n     * @param validAfter    The time after which this is valid (unix time)\\n     * @param validBefore   The time before which this is valid (unix time)\\n     * @param nonce         Unique nonce\\n     * @param v             v of the signature\\n     * @param r             r of the signature\\n     * @param s             s of the signature\\n     */\\n    function _approveWithAuthorization(\\n        address owner,\\n        address spender,\\n        uint256 value,\\n        uint256 validAfter,\\n        uint256 validBefore,\\n        bytes32 nonce,\\n        uint8 v,\\n        bytes32 r,\\n        bytes32 s\\n    ) internal {\\n        _requireValidAuthorization(owner, nonce, validAfter, validBefore);\\n\\n        bytes memory data = abi.encode(\\n            APPROVE_WITH_AUTHORIZATION_TYPEHASH,\\n            owner,\\n            spender,\\n            value,\\n            validAfter,\\n            validBefore,\\n            nonce\\n        );\\n        require(\\n            EIP712.recover(DOMAIN_SEPARATOR, v, r, s, data) == owner,\\n            \\\"GasAbstraction: invalid signature\\\"\\n        );\\n\\n        _markAuthorizationAsUsed(owner, nonce);\\n        _approve(owner, spender, value);\\n    }\\n\\n    /**\\n     * @notice Attempt to cancel an authorization\\n     * @param authorizer    Authorizer's address\\n     * @param nonce         Nonce of the authorization\\n     * @param v             v of the signature\\n     * @param r             r of the signature\\n     * @param s             s of the signature\\n     */\\n    function _cancelAuthorization(\\n        address authorizer,\\n        bytes32 nonce,\\n        uint8 v,\\n        bytes32 r,\\n        bytes32 s\\n    ) internal {\\n        _requireUnusedAuthorization(authorizer, nonce);\\n\\n        bytes memory data = abi.encode(\\n            CANCEL_AUTHORIZATION_TYPEHASH,\\n            authorizer,\\n            nonce\\n        );\\n        require(\\n            EIP712.recover(DOMAIN_SEPARATOR, v, r, s, data) == authorizer,\\n            \\\"GasAbstraction: invalid signature\\\"\\n        );\\n\\n        _authorizationStates[authorizer][nonce] = AuthorizationState.Canceled;\\n        emit AuthorizationCanceled(authorizer, nonce);\\n    }\\n\\n    /**\\n     * @notice Check that an authorization is unused\\n     * @param authorizer    Authorizer's address\\n     * @param nonce         Nonce of the authorization\\n     */\\n    function _requireUnusedAuthorization(address authorizer, bytes32 nonce)\\n        private\\n        view\\n    {\\n        require(\\n            _authorizationStates[authorizer][nonce] ==\\n                AuthorizationState.Unused,\\n            \\\"GasAbstraction: authorization is used or canceled\\\"\\n        );\\n    }\\n\\n    /**\\n     * @notice Check that authorization is valid\\n     * @param authorizer    Authorizer's address\\n     * @param nonce         Nonce of the authorization\\n     * @param validAfter    The time after which this is valid (unix time)\\n     * @param validBefore   The time before which this is valid (unix time)\\n     */\\n    function _requireValidAuthorization(\\n        address authorizer,\\n        bytes32 nonce,\\n        uint256 validAfter,\\n        uint256 validBefore\\n    ) internal view {\\n        require(\\n            now > validAfter,\\n            \\\"GasAbstraction: authorization is not yet valid\\\"\\n        );\\n        require(now < validBefore, \\\"GasAbstraction: authorization is expired\\\");\\n        _requireUnusedAuthorization(authorizer, nonce);\\n    }\\n\\n    /**\\n     * @notice Mark an authorization as used\\n     * @param authorizer    Authorizer's address\\n     * @param nonce         Nonce of the authorization\\n     */\\n    function _markAuthorizationAsUsed(address authorizer, bytes32 nonce)\\n        internal\\n    {\\n        _authorizationStates[authorizer][nonce] = AuthorizationState.Used;\\n        emit AuthorizationUsed(authorizer, nonce);\\n    }\\n}\\n\\nabstract contract MaticGasAbstraction is GasAbstraction {\\n    // keccak256(\\\"WithdrawWithAuthorization(address owner,uint256 value,uint256 validAfter,uint256 validBefore,bytes32 nonce)\\\")\\n    bytes32 public constant WITHDRAW_WITH_AUTHORIZATION_TYPEHASH =\\n        0x6c8f8f5f82f0c140edd12e80d10ff715a36d6e5f73e406394862b5f1eb44c4f9;\\n\\n    function _withdrawWithAuthorization(\\n        address owner,\\n        uint256 value,\\n        uint256 validAfter,\\n        uint256 validBefore,\\n        bytes32 nonce,\\n        uint8 v,\\n        bytes32 r,\\n        bytes32 s\\n    ) internal {\\n        _requireValidAuthorization(owner, nonce, validAfter, validBefore);\\n\\n        bytes memory data = abi.encode(\\n            WITHDRAW_WITH_AUTHORIZATION_TYPEHASH,\\n            owner,\\n            value,\\n            validAfter,\\n            validBefore,\\n            nonce\\n        );\\n        require(\\n            EIP712.recover(DOMAIN_SEPARATOR, v, r, s, data) == owner,\\n            \\\"GasAbstraction: invalid signature\\\"\\n        );\\n\\n        _markAuthorizationAsUsed(owner, nonce);\\n        _burn(owner, value);\\n    }\\n}\\n\\ncontract UChildERC20 is\\n    ERC20,\\n    IChildToken,\\n    AccessControlMixin,\\n    Initializable,\\n    NativeMetaTransaction,\\n    ContextMixin,\\n    Permit,\\n    MaticGasAbstraction\\n{\\n    bytes32 public constant DEPOSITOR_ROLE = keccak256(\\\"DEPOSITOR_ROLE\\\");\\n    string public constant EIP712_VERSION = \\\"1\\\";\\n\\n    constructor() public ERC20(\\\"\\\", \\\"\\\") {}\\n\\n    /**\\n     * @notice Initialize the contract after it has been proxified\\n     * @dev meant to be called once immediately after deployment\\n     */\\n    function initialize(\\n        string calldata newName,\\n        string calldata newSymbol,\\n        uint8 newDecimals,\\n        address childChainManager\\n    ) external initializer {\\n        _setName(newName);\\n        _setSymbol(newSymbol);\\n        _setDecimals(newDecimals);\\n        _setupContractId(string(abi.encodePacked(\\\"Child\\\", newSymbol)));\\n        _setupRole(DEFAULT_ADMIN_ROLE, _msgSender());\\n        _setupRole(DEPOSITOR_ROLE, childChainManager);\\n        _setDomainSeparator(newName, EIP712_VERSION);\\n    }\\n\\n    // This is to support Native meta transactions\\n    // never use msg.sender directly, use _msgSender() instead\\n    function _msgSender()\\n        internal\\n        view\\n        virtual\\n        override\\n        returns (address payable sender)\\n    {\\n        return ContextMixin.msgSender();\\n    }\\n\\n    function updateMetadata(string calldata newName, string calldata newSymbol)\\n        external\\n        only(DEFAULT_ADMIN_ROLE)\\n    {\\n        _setName(newName);\\n        _setSymbol(newSymbol);\\n        _setDomainSeparator(newName, EIP712_VERSION);\\n    }\\n\\n    /**\\n     * @notice called when token is deposited on root chain\\n     * @dev Should be callable only by ChildChainManager\\n     * Should handle deposit by minting the required amount for user\\n     * Make sure minting is done only by this function\\n     * @param user user address for whom deposit is being done\\n     * @param depositData abi encoded amount\\n     */\\n    function deposit(address user, bytes calldata depositData)\\n        external\\n        override\\n        only(DEPOSITOR_ROLE)\\n    {\\n        uint256 amount = abi.decode(depositData, (uint256));\\n        _mint(user, amount);\\n    }\\n\\n    /**\\n     * @notice called when user wants to withdraw tokens back to root chain\\n     * @dev Should burn user's tokens. This transaction will be verified when exiting on root chain\\n     * @param amount amount of tokens to withdraw\\n     */\\n    function withdraw(uint256 amount) external virtual {\\n        _burn(_msgSender(), amount);\\n    }\\n\\n    /**\\n     * @notice Update allowance with a signed permit\\n     * @param owner       Token owner's address (Authorizer)\\n     * @param spender     Spender's address\\n     * @param value       Amount of allowance\\n     * @param deadline    Expiration time, seconds since the epoch\\n     * @param v           v of the signature\\n     * @param r           r of the signature\\n     * @param s           s of the signature\\n     */\\n    function permit(\\n        address owner,\\n        address spender,\\n        uint256 value,\\n        uint256 deadline,\\n        uint8 v,\\n        bytes32 r,\\n        bytes32 s\\n    ) external virtual {\\n        _permit(owner, spender, value, deadline, v, r, s);\\n    }\\n\\n    /**\\n     * @notice Execute a transfer with a signed authorization\\n     * @param from          Payer's address (Authorizer)\\n     * @param to            Payee's address\\n     * @param value         Amount to be transferred\\n     * @param validAfter    The time after which this is valid (unix time)\\n     * @param validBefore   The time before which this is valid (unix time)\\n     * @param nonce         Unique nonce\\n     * @param v             v of the signature\\n     * @param r             r of the signature\\n     * @param s             s of the signature\\n     */\\n    function transferWithAuthorization(\\n        address from,\\n        address to,\\n        uint256 value,\\n        uint256 validAfter,\\n        uint256 validBefore,\\n        bytes32 nonce,\\n        uint8 v,\\n        bytes32 r,\\n        bytes32 s\\n    ) external virtual {\\n        _transferWithAuthorization(\\n            from,\\n            to,\\n            value,\\n            validAfter,\\n            validBefore,\\n            nonce,\\n            v,\\n            r,\\n            s\\n        );\\n    }\\n\\n    /**\\n     * @notice Update allowance with a signed authorization\\n     * @param owner         Token owner's address (Authorizer)\\n     * @param spender       Spender's address\\n     * @param value         Amount of allowance\\n     * @param validAfter    The time after which this is valid (unix time)\\n     * @param validBefore   The time before which this is valid (unix time)\\n     * @param nonce         Unique nonce\\n     * @param v             v of the signature\\n     * @param r             r of the signature\\n     * @param s             s of the signature\\n     */\\n    function approveWithAuthorization(\\n        address owner,\\n        address spender,\\n        uint256 value,\\n        uint256 validAfter,\\n        uint256 validBefore,\\n        bytes32 nonce,\\n        uint8 v,\\n        bytes32 r,\\n        bytes32 s\\n    ) external virtual {\\n        _approveWithAuthorization(\\n            owner,\\n            spender,\\n            value,\\n            validAfter,\\n            validBefore,\\n            nonce,\\n            v,\\n            r,\\n            s\\n        );\\n    }\\n\\n    /**\\n     * @notice Increase allowance with a signed authorization\\n     * @param owner         Token owner's address (Authorizer)\\n     * @param spender       Spender's address\\n     * @param increment     Amount of increase in allowance\\n     * @param validAfter    The time after which this is valid (unix time)\\n     * @param validBefore   The time before which this is valid (unix time)\\n     * @param nonce         Unique nonce\\n     * @param v             v of the signature\\n     * @param r             r of the signature\\n     * @param s             s of the signature\\n     */\\n    function increaseAllowanceWithAuthorization(\\n        address owner,\\n        address spender,\\n        uint256 increment,\\n        uint256 validAfter,\\n        uint256 validBefore,\\n        bytes32 nonce,\\n        uint8 v,\\n        bytes32 r,\\n        bytes32 s\\n    ) external virtual {\\n        _increaseAllowanceWithAuthorization(\\n            owner,\\n            spender,\\n            increment,\\n            validAfter,\\n            validBefore,\\n            nonce,\\n            v,\\n            r,\\n            s\\n        );\\n    }\\n\\n    /**\\n     * @notice Decrease allowance with a signed authorization\\n     * @param owner         Token owner's address (Authorizer)\\n     * @param spender       Spender's address\\n     * @param decrement     Amount of decrease in allowance\\n     * @param validAfter    The time after which this is valid (unix time)\\n     * @param validBefore   The time before which this is valid (unix time)\\n     * @param nonce         Unique nonce\\n     * @param v             v of the signature\\n     * @param r             r of the signature\\n     * @param s             s of the signature\\n     */\\n    function decreaseAllowanceWithAuthorization(\\n        address owner,\\n        address spender,\\n        uint256 decrement,\\n        uint256 validAfter,\\n        uint256 validBefore,\\n        bytes32 nonce,\\n        uint8 v,\\n        bytes32 r,\\n        bytes32 s\\n    ) external virtual {\\n        _decreaseAllowanceWithAuthorization(\\n            owner,\\n            spender,\\n            decrement,\\n            validAfter,\\n            validBefore,\\n            nonce,\\n            v,\\n            r,\\n            s\\n        );\\n    }\\n\\n    /**\\n     * @notice Execute a withdrawal with a signed authorization. This is used to\\n     * transfer tokens back to the root chain.\\n     * @param owner         Token owner's address (Authorizer)\\n     * @param value         Amount to be withdrawn\\n     * @param validAfter    The time after which this is valid (unix time)\\n     * @param validBefore   The time before which this is valid (unix time)\\n     * @param nonce         Unique nonce\\n     * @param v             v of the signature\\n     * @param r             r of the signature\\n     * @param s             s of the signature\\n     */\\n    function withdrawWithAuthorization(\\n        address owner,\\n        uint256 value,\\n        uint256 validAfter,\\n        uint256 validBefore,\\n        bytes32 nonce,\\n        uint8 v,\\n        bytes32 r,\\n        bytes32 s\\n    ) external virtual {\\n        _withdrawWithAuthorization(\\n            owner,\\n            value,\\n            validAfter,\\n            validBefore,\\n            nonce,\\n            v,\\n            r,\\n            s\\n        );\\n    }\\n\\n    /**\\n     * @notice Attempt to cancel an authorization\\n     * @dev Works only if the authorization is not yet used.\\n     * @param authorizer    Authorizer's address\\n     * @param nonce         Nonce of the authorization\\n     * @param v             v of the signature\\n     * @param r             r of the signature\\n     * @param s             s of the signature\\n     */\\n    function cancelAuthorization(\\n        address authorizer,\\n        bytes32 nonce,\\n        uint8 v,\\n        bytes32 r,\\n        bytes32 s\\n    ) external virtual {\\n        _cancelAuthorization(authorizer, nonce, v, r, s);\\n    }\\n}\\n\\nabstract contract Blacklistable is AccessControlMixin {\\n    bytes32 public constant BLACKLISTER_ROLE = keccak256(\\\"BLACKLISTER_ROLE\\\");\\n\\n    mapping(address => bool) internal _blacklisted;\\n\\n    event Blacklisted(address indexed account);\\n    event UnBlacklisted(address indexed account);\\n\\n    /**\\n     * @dev Throws if the given account is blacklisted\\n     * @param account The address to check\\n     */\\n    modifier notBlacklisted(address account) {\\n        require(\\n            !_blacklisted[account],\\n            \\\"Blacklistable: account is blacklisted\\\"\\n        );\\n        _;\\n    }\\n\\n    /**\\n     * @notice Return the members of the blacklister role\\n     * @return Addresses\\n     */\\n    function blacklisters() external view returns (address[] memory) {\\n        uint256 count = getRoleMemberCount(BLACKLISTER_ROLE);\\n        address[] memory list = new address[](count);\\n\\n        for (uint256 i = 0; i < count; i++) {\\n            list[i] = getRoleMember(BLACKLISTER_ROLE, i);\\n        }\\n\\n        return list;\\n    }\\n\\n    /**\\n     * @dev Checks if an account is blacklisted\\n     * @param account The address to check\\n     */\\n    function isBlacklisted(address account) external view returns (bool) {\\n        return _blacklisted[account];\\n    }\\n\\n    /**\\n     * @dev Adds an account to the blacklist\\n     * @param account The address to blacklist\\n     */\\n    function blacklist(address account) external only(BLACKLISTER_ROLE) {\\n        _blacklisted[account] = true;\\n        emit Blacklisted(account);\\n    }\\n\\n    /**\\n     * @notice Removes an account from the blacklist\\n     * @param account The address to remove from the blacklist\\n     */\\n    function unBlacklist(address account) external only(BLACKLISTER_ROLE) {\\n        _blacklisted[account] = false;\\n        emit UnBlacklisted(account);\\n    }\\n}\\n\\nabstract contract Pausable is AccessControlMixin {\\n    bytes32 public constant PAUSER_ROLE = keccak256(\\\"PAUSER_ROLE\\\");\\n\\n    event Pause();\\n    event Unpause();\\n\\n    bool internal _paused = false;\\n\\n    /**\\n     * @notice Throws if this contract is paused\\n     */\\n    modifier whenNotPaused() {\\n        require(!_paused, \\\"Pausable: paused\\\");\\n        _;\\n    }\\n\\n    /**\\n     * @notice Return the members of the pauser role\\n     * @return Addresses\\n     */\\n    function pausers() external view returns (address[] memory) {\\n        uint256 count = getRoleMemberCount(PAUSER_ROLE);\\n        address[] memory list = new address[](count);\\n\\n        for (uint256 i = 0; i < count; i++) {\\n            list[i] = getRoleMember(PAUSER_ROLE, i);\\n        }\\n\\n        return list;\\n    }\\n\\n    /**\\n     * @notice Returns whether this contract is paused\\n     * @return True if paused\\n     */\\n    function paused() external view returns (bool) {\\n        return _paused;\\n    }\\n\\n    /**\\n     * @notice Pause this contract\\n     */\\n    function pause() external only(PAUSER_ROLE) {\\n        _paused = true;\\n        emit Pause();\\n    }\\n\\n    /**\\n     * @notice Unpause this contract\\n     */\\n    function unpause() external only(PAUSER_ROLE) {\\n        _paused = false;\\n        emit Unpause();\\n    }\\n}\\n\\nlibrary SafeERC20 {\\n    using SafeMath for uint256;\\n    using Address for address;\\n\\n    function safeTransfer(\\n        IERC20 token,\\n        address to,\\n        uint256 value\\n    ) internal {\\n        _callOptionalReturn(\\n            token,\\n            abi.encodeWithSelector(token.transfer.selector, to, value)\\n        );\\n    }\\n\\n    function safeTransferFrom(\\n        IERC20 token,\\n        address from,\\n        address to,\\n        uint256 value\\n    ) internal {\\n        _callOptionalReturn(\\n            token,\\n            abi.encodeWithSelector(token.transferFrom.selector, from, to, value)\\n        );\\n    }\\n\\n    /**\\n     * @dev Deprecated. This function has issues similar to the ones found in\\n     * {IERC20-approve}, and its usage is discouraged.\\n     *\\n     * Whenever possible, use {safeIncreaseAllowance} and\\n     * {safeDecreaseAllowance} instead.\\n     */\\n    function safeApprove(\\n        IERC20 token,\\n        address spender,\\n        uint256 value\\n    ) internal {\\n        // safeApprove should only be called when setting an initial allowance,\\n        // or when resetting it to zero. To increase and decrease it, use\\n        // 'safeIncreaseAllowance' and 'safeDecreaseAllowance'\\n        // solhint-disable-next-line max-line-length\\n        require(\\n            (value == 0) || (token.allowance(address(this), spender) == 0),\\n            \\\"SafeERC20: approve from non-zero to non-zero allowance\\\"\\n        );\\n        _callOptionalReturn(\\n            token,\\n            abi.encodeWithSelector(token.approve.selector, spender, value)\\n        );\\n    }\\n\\n    function safeIncreaseAllowance(\\n        IERC20 token,\\n        address spender,\\n        uint256 value\\n    ) internal {\\n        uint256 newAllowance = token.allowance(address(this), spender).add(\\n            value\\n        );\\n        _callOptionalReturn(\\n            token,\\n            abi.encodeWithSelector(\\n                token.approve.selector,\\n                spender,\\n                newAllowance\\n            )\\n        );\\n    }\\n\\n    function safeDecreaseAllowance(\\n        IERC20 token,\\n        address spender,\\n        uint256 value\\n    ) internal {\\n        uint256 newAllowance = token.allowance(address(this), spender).sub(\\n            value,\\n            \\\"SafeERC20: decreased allowance below zero\\\"\\n        );\\n        _callOptionalReturn(\\n            token,\\n            abi.encodeWithSelector(\\n                token.approve.selector,\\n                spender,\\n                newAllowance\\n            )\\n        );\\n    }\\n\\n    /**\\n     * @dev Imitates a Solidity high-level call (i.e. a regular function call to a contract), relaxing the requirement\\n     * on the return value: the return value is optional (but if data is returned, it must not be false).\\n     * @param token The token targeted by the call.\\n     * @param data The call data (encoded using abi.encode or one of its variants).\\n     */\\n    function _callOptionalReturn(IERC20 token, bytes memory data) private {\\n        // We need to perform a low level call here, to bypass Solidity's return data size checking mechanism, since\\n        // we're implementing it ourselves. We use {Address.functionCall} to perform this call, which verifies that\\n        // the target address contains contract code and also asserts for success in the low-level call.\\n\\n        bytes memory returndata = address(token).functionCall(\\n            data,\\n            \\\"SafeERC20: low-level call failed\\\"\\n        );\\n        if (returndata.length > 0) {\\n            // Return data is optional\\n            // solhint-disable-next-line max-line-length\\n            require(\\n                abi.decode(returndata, (bool)),\\n                \\\"SafeERC20: ERC20 operation did not succeed\\\"\\n            );\\n        }\\n    }\\n}\\n\\nabstract contract Rescuable is AccessControlMixin {\\n    using SafeERC20 for IERC20;\\n\\n    bytes32 public constant RESCUER_ROLE = keccak256(\\\"RESCUER_ROLE\\\");\\n\\n    event RescuerChanged(address indexed newRescuer);\\n\\n    /**\\n     * @notice Return the members of the rescuer role\\n     * @return Addresses\\n     */\\n    function rescuers() external view returns (address[] memory) {\\n        uint256 count = getRoleMemberCount(RESCUER_ROLE);\\n        address[] memory list = new address[](count);\\n\\n        for (uint256 i = 0; i < count; i++) {\\n            list[i] = getRoleMember(RESCUER_ROLE, i);\\n        }\\n\\n        return list;\\n    }\\n\\n    /**\\n     * @notice Rescue ERC20 tokens locked up in this contract.\\n     * @param tokenContract ERC20 token contract address\\n     * @param to        Recipient address\\n     * @param amount    Amount to withdraw\\n     */\\n    function rescueERC20(\\n        IERC20 tokenContract,\\n        address to,\\n        uint256 amount\\n    ) external only(RESCUER_ROLE) {\\n        tokenContract.safeTransfer(to, amount);\\n    }\\n}\\n\\ncontract UChildAdministrableERC20 is\\n    UChildERC20,\\n    Blacklistable,\\n    Pausable,\\n    Rescuable\\n{\\n    function _msgSender()\\n        internal\\n        view\\n        override(Context, UChildERC20)\\n        returns (address payable sender)\\n    {\\n        return ContextMixin.msgSender();\\n    }\\n\\n    function mint(address _to, uint256 _amount) external {\\n        _mint(_to, _amount);\\n    }\\n\\n    function withdraw(uint256 amount)\\n        external\\n        override\\n        notBlacklisted(_msgSender())\\n    {\\n        _burn(_msgSender(), amount);\\n    }\\n\\n    function transfer(address recipient, uint256 amount)\\n        external\\n        override\\n        whenNotPaused\\n        notBlacklisted(_msgSender())\\n        notBlacklisted(recipient)\\n        returns (bool)\\n    {\\n        _transfer(_msgSender(), recipient, amount);\\n        return true;\\n    }\\n\\n    function approve(address spender, uint256 amount)\\n        external\\n        override\\n        whenNotPaused\\n        notBlacklisted(_msgSender())\\n        notBlacklisted(spender)\\n        returns (bool)\\n    {\\n        _approve(_msgSender(), spender, amount);\\n        return true;\\n    }\\n\\n    function transferFrom(\\n        address sender,\\n        address recipient,\\n        uint256 amount\\n    )\\n        external\\n        override\\n        whenNotPaused\\n        notBlacklisted(_msgSender())\\n        notBlacklisted(sender)\\n        notBlacklisted(recipient)\\n        returns (bool)\\n    {\\n        _transferFrom(sender, recipient, amount);\\n        return true;\\n    }\\n\\n    function increaseAllowance(address spender, uint256 addedValue)\\n        external\\n        override\\n        whenNotPaused\\n        notBlacklisted(_msgSender())\\n        notBlacklisted(spender)\\n        returns (bool)\\n    {\\n        _increaseAllowance(_msgSender(), spender, addedValue);\\n        return true;\\n    }\\n\\n    function decreaseAllowance(address spender, uint256 subtractedValue)\\n        external\\n        override\\n        whenNotPaused\\n        notBlacklisted(_msgSender())\\n        notBlacklisted(spender)\\n        returns (bool)\\n    {\\n        _decreaseAllowance(_msgSender(), spender, subtractedValue);\\n        return true;\\n    }\\n\\n    function permit(\\n        address owner,\\n        address spender,\\n        uint256 value,\\n        uint256 deadline,\\n        uint8 v,\\n        bytes32 r,\\n        bytes32 s\\n    )\\n        external\\n        override\\n        whenNotPaused\\n        notBlacklisted(owner)\\n        notBlacklisted(spender)\\n    {\\n        _permit(owner, spender, value, deadline, v, r, s);\\n    }\\n\\n    function transferWithAuthorization(\\n        address from,\\n        address to,\\n        uint256 value,\\n        uint256 validAfter,\\n        uint256 validBefore,\\n        bytes32 nonce,\\n        uint8 v,\\n        bytes32 r,\\n        bytes32 s\\n    ) external override whenNotPaused notBlacklisted(from) notBlacklisted(to) {\\n        _transferWithAuthorization(\\n            from,\\n            to,\\n            value,\\n            validAfter,\\n            validBefore,\\n            nonce,\\n            v,\\n            r,\\n            s\\n        );\\n    }\\n\\n    function approveWithAuthorization(\\n        address owner,\\n        address spender,\\n        uint256 value,\\n        uint256 validAfter,\\n        uint256 validBefore,\\n        bytes32 nonce,\\n        uint8 v,\\n        bytes32 r,\\n        bytes32 s\\n    )\\n        external\\n        override\\n        whenNotPaused\\n        notBlacklisted(owner)\\n        notBlacklisted(spender)\\n    {\\n        _approveWithAuthorization(\\n            owner,\\n            spender,\\n            value,\\n            validAfter,\\n            validBefore,\\n            nonce,\\n            v,\\n            r,\\n            s\\n        );\\n    }\\n\\n    function increaseAllowanceWithAuthorization(\\n        address owner,\\n        address spender,\\n        uint256 increment,\\n        uint256 validAfter,\\n        uint256 validBefore,\\n        bytes32 nonce,\\n        uint8 v,\\n        bytes32 r,\\n        bytes32 s\\n    )\\n        external\\n        override\\n        whenNotPaused\\n        notBlacklisted(owner)\\n        notBlacklisted(spender)\\n    {\\n        _increaseAllowanceWithAuthorization(\\n            owner,\\n            spender,\\n            increment,\\n            validAfter,\\n            validBefore,\\n            nonce,\\n            v,\\n            r,\\n            s\\n        );\\n    }\\n\\n    function decreaseAllowanceWithAuthorization(\\n        address owner,\\n        address spender,\\n        uint256 decrement,\\n        uint256 validAfter,\\n        uint256 validBefore,\\n        bytes32 nonce,\\n        uint8 v,\\n        bytes32 r,\\n        bytes32 s\\n    )\\n        external\\n        override\\n        whenNotPaused\\n        notBlacklisted(owner)\\n        notBlacklisted(spender)\\n    {\\n        _decreaseAllowanceWithAuthorization(\\n            owner,\\n            spender,\\n            decrement,\\n            validAfter,\\n            validBefore,\\n            nonce,\\n            v,\\n            r,\\n            s\\n        );\\n    }\\n\\n    function withdrawWithAuthorization(\\n        address owner,\\n        uint256 value,\\n        uint256 validAfter,\\n        uint256 validBefore,\\n        bytes32 nonce,\\n        uint8 v,\\n        bytes32 r,\\n        bytes32 s\\n    ) external override whenNotPaused notBlacklisted(owner) {\\n        _withdrawWithAuthorization(\\n            owner,\\n            value,\\n            validAfter,\\n            validBefore,\\n            nonce,\\n            v,\\n            r,\\n            s\\n        );\\n    }\\n\\n    function cancelAuthorization(\\n        address authorizer,\\n        bytes32 nonce,\\n        uint8 v,\\n        bytes32 r,\\n        bytes32 s\\n    ) external override whenNotPaused {\\n        _cancelAuthorization(authorizer, nonce, v, r, s);\\n    }\\n\\n    function getChainId() public view returns (uint256 chainId) {\\n        assembly {\\n            chainId := chainid()\\n        }\\n    } \\n}\\n\",\"keccak256\":\"0x30fd7814010ae1a346b114628b43ab9eb67e6de0a63625ba5134d4b50387ab45\",\"license\":\"MIT\"}},\"version\":1}",
  "bytecode": "0x60806040526008805460ff19908116909155600d805490911690553480156200002757600080fd5b5060408051602080820180845260008084528451928301909452928152815191929091620000589160039162000084565b5080516200006e90600490602084019062000084565b50506005805460ff191660121790555062000120565b828054600181600116156101000203166002900490600052602060002090601f016020900481019282601f10620000c757805160ff1916838001178555620000f7565b82800160010185558215620000f7579182015b82811115620000f7578251825591602001919060010190620000da565b506200010592915062000109565b5090565b5b808211156200010557600081556001016200010a565b614ba180620001306000396000f3fe6080604052600436106102a75760003560e01c806306fdde03146102ac578063095ea7b3146103365780630c53c51c14610383578063100a15601461044557806310c8b404146104aa578063158ef93e146104d157806318160ddd146104e65780631a895266146104fb5780632004d2911461053057806323b872dd14610545578063248a9ca3146105885780632e1a7d4d146105b25780632f2ff15d146105dc57806330adf81f14610615578063313ce5671461062a5780633408e470146106555780633644e5151461066a57806336568abe1461067f57806339509351146106b85780633f4ba83a146106f157806340c10f19146107065780634b71f5c31461073f57806356ce0e6c146107545780635a049a701461081f5780635c975abb1461086d57806370a082311461088257806371372544146108b55780637b766e5f146108ca5780637cfa1cfa1461092b5780637ecebe00146109405780638456cb59146109735780639010d07c1461098857806391d14854146109d457806395d89b4114610a0d578063a0cc6a6814610a22578063a217fddf14610a37578063a3b0b5a314610a4c578063a457c2d714610a61578063a9059cbb14610a9a578063b008609514610ad3578063b2118a8d14610b3f578063c237108f14610b82578063c7b84f8d14610bee578063ca15c87314610c03578063cf2c52cb14610c2d578063d505accf14610cb8578063d547741f14610d16578063d916948714610d4f578063dd62ed3e14610d64578063de7ea79d14610d9f578063e1560fd314610e7c578063e3ee160e14610ee8578063e63ab1e914610f54578063e8d6fc4714610f69578063e94a010214610f7e578063eccec5a814610fd8578063f515e6f214610fed578063f9f92be414611002578063fa2c322d14611035578063fe575a871461104a575b600080fd5b3480156102b857600080fd5b506102c161107d565b6040805160208082528351818301528351919283929083019185019080838360005b838110156102fb5781810151838201526020016102e3565b50505050905090810190601f1680156103285780820380516001836020036101000a031916815260200191505b509250505060405180910390f35b34801561034257600080fd5b5061036f6004803603604081101561035957600080fd5b506001600160a01b038135169060200135611114565b604080519115158252519081900360200190f35b6102c1600480360360a081101561039957600080fd5b6001600160a01b038235169190810190604081016020820135600160201b8111156103c357600080fd5b8201836020820111156103d557600080fd5b803590602001918460018302840111600160201b831117156103f657600080fd5b91908080601f016020809104026020016040519081016040528093929190818152602001838380828437600092019190915250929550508235935050506020810135906040013560ff16611234565b34801561045157600080fd5b5061045a6114fb565b60408051602080825283518183015283519192839290830191858101910280838360005b8381101561049657818101518382015260200161047e565b505050509050019250505060405180910390f35b3480156104b657600080fd5b506104bf6115b3565b60408051918252519081900360200190f35b3480156104dd57600080fd5b5061036f6115c5565b3480156104f257600080fd5b506104bf6115ce565b34801561050757600080fd5b5061052e6004803603602081101561051e57600080fd5b50356001600160a01b03166115d4565b005b34801561053c57600080fd5b506104bf6116df565b34801561055157600080fd5b5061036f6004803603606081101561056857600080fd5b506001600160a01b038135811691602081013590911690604001356116f1565b34801561059457600080fd5b506104bf600480360360208110156105ab57600080fd5b5035611866565b3480156105be57600080fd5b5061052e600480360360208110156105d557600080fd5b503561187b565b3480156105e857600080fd5b5061052e600480360360408110156105ff57600080fd5b50803590602001356001600160a01b03166118f0565b34801561062157600080fd5b506104bf611953565b34801561063657600080fd5b5061063f611965565b6040805160ff9092168252519081900360200190f35b34801561066157600080fd5b506104bf61196e565b34801561067657600080fd5b506104bf611972565b34801561068b57600080fd5b5061052e600480360360408110156106a257600080fd5b50803590602001356001600160a01b0316611978565b3480156106c457600080fd5b5061036f600480360360408110156106db57600080fd5b506001600160a01b0381351690602001356119d9565b3480156106fd57600080fd5b5061052e611aee565b34801561071257600080fd5b5061052e6004803603604081101561072957600080fd5b506001600160a01b038135169060200135611ba6565b34801561074b57600080fd5b506104bf611bb0565b34801561076057600080fd5b5061052e6004803603604081101561077757600080fd5b810190602081018135600160201b81111561079157600080fd5b8201836020820111156107a357600080fd5b803590602001918460018302840111600160201b831117156107c457600080fd5b919390929091602081019035600160201b8111156107e157600080fd5b8201836020820111156107f357600080fd5b803590602001918460018302840111600160201b8311171561081457600080fd5b509092509050611bc2565b34801561082b57600080fd5b5061052e600480360360a081101561084257600080fd5b506001600160a01b038135169060208101359060ff6040820135169060608101359060800135611d14565b34801561087957600080fd5b5061036f611d67565b34801561088e57600080fd5b506104bf600480360360208110156108a557600080fd5b50356001600160a01b0316611d70565b3480156108c157600080fd5b506104bf611d8b565b3480156108d657600080fd5b5061052e60048036036101008110156108ee57600080fd5b506001600160a01b038135169060208101359060408101359060608101359060808101359060ff60a0820135169060c08101359060e00135611d9d565b34801561093757600080fd5b5061045a611e58565b34801561094c57600080fd5b506104bf6004803603602081101561096357600080fd5b50356001600160a01b0316611f09565b34801561097f57600080fd5b5061052e611f24565b34801561099457600080fd5b506109b8600480360360408110156109ab57600080fd5b5080359060200135611fdf565b604080516001600160a01b039092168252519081900360200190f35b3480156109e057600080fd5b5061036f600480360360408110156109f757600080fd5b50803590602001356001600160a01b0316612000565b348015610a1957600080fd5b506102c1612018565b348015610a2e57600080fd5b506104bf612079565b348015610a4357600080fd5b506104bf61208b565b348015610a5857600080fd5b506104bf612090565b348015610a6d57600080fd5b5061036f60048036036040811015610a8457600080fd5b506001600160a01b0381351690602001356120a2565b348015610aa657600080fd5b5061036f60048036036040811015610abd57600080fd5b506001600160a01b0381351690602001356121b7565b348015610adf57600080fd5b5061052e6004803603610120811015610af757600080fd5b506001600160a01b03813581169160208101359091169060408101359060608101359060808101359060a08101359060ff60c0820135169060e08101359061010001356122cc565b348015610b4b57600080fd5b5061052e60048036036060811015610b6257600080fd5b506001600160a01b038135811691602081013590911690604001356123e4565b348015610b8e57600080fd5b5061052e6004803603610120811015610ba657600080fd5b506001600160a01b03813581169160208101359091169060408101359060608101359060808101359060a08101359060ff60c0820135169060e0810135906101000135612480565b348015610bfa57600080fd5b506104bf61258b565b348015610c0f57600080fd5b506104bf60048036036020811015610c2657600080fd5b503561259d565b348015610c3957600080fd5b5061052e60048036036040811015610c5057600080fd5b6001600160a01b038235169190810190604081016020820135600160201b811115610c7a57600080fd5b820183602082011115610c8c57600080fd5b803590602001918460018302840111600160201b83111715610cad57600080fd5b5090925090506125b4565b348015610cc457600080fd5b5061052e600480360360e0811015610cdb57600080fd5b506001600160a01b03813581169160208101359091169060408101359060608101359060ff6080820135169060a08101359060c00135612656565b348015610d2257600080fd5b5061052e60048036036040811015610d3957600080fd5b50803590602001356001600160a01b031661275f565b348015610d5b57600080fd5b506104bf6127b8565b348015610d7057600080fd5b506104bf60048036036040811015610d8757600080fd5b506001600160a01b03813581169160200135166127ca565b348015610dab57600080fd5b5061052e60048036036080811015610dc257600080fd5b810190602081018135600160201b811115610ddc57600080fd5b820183602082011115610dee57600080fd5b803590602001918460018302840111600160201b83111715610e0f57600080fd5b919390929091602081019035600160201b811115610e2c57600080fd5b820183602082011115610e3e57600080fd5b803590602001918460018302840111600160201b83111715610e5f57600080fd5b9193509150803560ff1690602001356001600160a01b03166127f5565b348015610e8857600080fd5b5061052e6004803603610120811015610ea057600080fd5b506001600160a01b03813581169160208101359091169060408101359060608101359060808101359060a08101359060ff60c0820135169060e0810135906101000135612964565b348015610ef457600080fd5b5061052e6004803603610120811015610f0c57600080fd5b506001600160a01b03813581169160208101359091169060408101359060608101359060808101359060a08101359060ff60c0820135169060e0810135906101000135612a6f565b348015610f6057600080fd5b506104bf612b7a565b348015610f7557600080fd5b5061045a612b8c565b348015610f8a57600080fd5b50610fb760048036036040811015610fa157600080fd5b506001600160a01b038135169060200135612c3d565b60405180826002811115610fc757fe5b815260200191505060405180910390f35b348015610fe457600080fd5b506102c1612c68565b348015610ff957600080fd5b506104bf612c85565b34801561100e57600080fd5b5061052e6004803603602081101561102557600080fd5b50356001600160a01b0316612c97565b34801561104157600080fd5b506104bf612d66565b34801561105657600080fd5b5061036f6004803603602081101561106d57600080fd5b50356001600160a01b0316612d78565b60038054604080516020601f60026000196101006001881615020190951694909404938401819004810282018101909252828152606093909290918301828280156111095780601f106110de57610100808354040283529160200191611109565b820191906000526020600020905b8154815290600101906020018083116110ec57829003601f168201915b505050505090505b90565b600d5460009060ff161561115d576040805162461bcd60e51b81526020600482015260106024820152600080516020614a3a833981519152604482015290519081900360640190fd5b611165612d96565b6001600160a01b0381166000908152600c602052604090205460ff16156111bd5760405162461bcd60e51b8152600401808060200182810382526025815260200180614b1c6025913960400191505060405180910390fd5b6001600160a01b0384166000908152600c6020526040902054849060ff16156112175760405162461bcd60e51b8152600401808060200182810382526025815260200180614b1c6025913960400191505060405180910390fd5b611229611222612d96565b8686612da5565b506001949350505050565b606061123e61459a565b50604080516060810182526001600160a01b0388166000818152600a60209081529084902080546001810190915583528201529081018690526112848782878787612e91565b6112bf5760405162461bcd60e51b81526004018080602001828103825260218152602001806149736021913960400191505060405180910390fd5b7f5845892132946850460bff5a0083f71031bc5bf9aadcd40f1de79423eac9b10b87338860405180846001600160a01b03168152602001836001600160a01b0316815260200180602001828103825283818151815260200191508051906020019080838360005b8381101561133e578181015183820152602001611326565b50505050905090810190601f16801561136b5780820380516001836020036101000a031916815260200191505b5094505050505060405180910390a160006060306001600160a01b0316888a6040516020018083805190602001908083835b602083106113bc5780518252601f19909201916020918201910161139d565b6001836020036101000a038019825116818451168082178552505050505050905001826001600160a01b031660601b8152601401925050506040516020818303038152906040526040518082805190602001908083835b602083106114325780518252601f199092019160209182019101611413565b6001836020036101000a0380198251168184511680821785525050505050509050019150506000604051808303816000865af19150503d8060008114611494576040519150601f19603f3d011682016040523d82523d6000602084013e611499565b606091505b5091509150816114ef576040805162461bcd60e51b815260206004820152601c60248201527b119d5b98dd1a5bdb8818d85b1b081b9bdd081cdd58d8d95cdcd99d5b60221b604482015290519081900360640190fd5b98975050505050505050565b6060600061151660008051602061469d83398151915261259d565b90506060816001600160401b038111801561153057600080fd5b5060405190808252806020026020018201604052801561155a578160200160208202803683370190505b50905060005b828110156115ac5761158060008051602061469d83398151915282611fdf565b82828151811061158c57fe5b6001600160a01b0390921660209283029190910190910152600101611560565b5091505090565b6000805160206147cd83398151915281565b60085460ff1690565b60025490565b6000805160206149948339815191526115f4816115ef612d96565b612000565b6007906116945760405162461bcd60e51b81526020600482019081528254600260001961010060018416150201909116046024830181905290918291604490910190849080156116855780601f1061165a57610100808354040283529160200191611685565b820191906000526020600020905b81548152906001019060200180831161166857829003601f168201915b50509250505060405180910390fd5b506001600160a01b0382166000818152600c6020526040808220805460ff19169055517f117e3210bb9aa7d9baff172026820255c6f6c30ba8999d1c2fd88e2848137c4e9190a25050565b600080516020614ad283398151915281565b600d5460009060ff161561173a576040805162461bcd60e51b81526020600482015260106024820152600080516020614a3a833981519152604482015290519081900360640190fd5b611742612d96565b6001600160a01b0381166000908152600c602052604090205460ff161561179a5760405162461bcd60e51b8152600401808060200182810382526025815260200180614b1c6025913960400191505060405180910390fd5b6001600160a01b0385166000908152600c6020526040902054859060ff16156117f45760405162461bcd60e51b8152600401808060200182810382526025815260200180614b1c6025913960400191505060405180910390fd5b6001600160a01b0385166000908152600c6020526040902054859060ff161561184e5760405162461bcd60e51b8152600401808060200182810382526025815260200180614b1c6025913960400191505060405180910390fd5b611859878787612f6f565b5060019695505050505050565b60009081526006602052604090206002015490565b611883612d96565b6001600160a01b0381166000908152600c602052604090205460ff16156118db5760405162461bcd60e51b8152600401808060200182810382526025815260200180614b1c6025913960400191505060405180910390fd5b6118ec6118e6612d96565b83612fef565b5050565b60008281526006602052604090206002015461190e906115ef612d96565b6119495760405162461bcd60e51b815260040180806020018281038252602f8152602001806146bd602f913960400191505060405180910390fd5b6118ec82826130d9565b6000805160206149f583398151915281565b60055460ff1690565b4690565b60095481565b611980612d96565b6001600160a01b0316816001600160a01b0316146119cf5760405162461bcd60e51b815260040180806020018281038252602f815260200180614b66602f913960400191505060405180910390fd5b6118ec8282613142565b600d5460009060ff1615611a22576040805162461bcd60e51b81526020600482015260106024820152600080516020614a3a833981519152604482015290519081900360640190fd5b611a2a612d96565b6001600160a01b0381166000908152600c602052604090205460ff1615611a825760405162461bcd60e51b8152600401808060200182810382526025815260200180614b1c6025913960400191505060405180910390fd5b6001600160a01b0384166000908152600c6020526040902054849060ff1615611adc5760405162461bcd60e51b8152600401808060200182810382526025815260200180614b1c6025913960400191505060405180910390fd5b611229611ae7612d96565b86866131ab565b600080516020614953833981519152611b09816115ef612d96565b600790611b6f5760405162461bcd60e51b81526020600482019081528254600260001961010060018416150201909116046024830181905290918291604490910190849080156116855780601f1061165a57610100808354040283529160200191611685565b50600d805460ff191690556040517f7805862f689e2f13df9f062ff482ad3ad112aca9e0847911ed832e158c525b3390600090a150565b6118ec82826131e3565b60008051602061488a83398151915281565b6000611bd0816115ef612d96565b600790611c365760405162461bcd60e51b81526020600482019081528254600260001961010060018416150201909116046024830181905290918291604490910190849080156116855780601f1061165a57610100808354040283529160200191611685565b50611c7685858080601f0160208091040260200160405190810160405280939291908181526020018383808284376000920191909152506132c192505050565b611cb583838080601f0160208091040260200160405190810160405280939291908181526020018383808284376000920191909152506132d492505050565b611d0d85858080601f016020809104026020016040519081016040528093929190818152602001838380828437600092019190915250506040805180820190915260018152603160f81b602082015291506132e79050565b5050505050565b600d5460ff1615611d5a576040805162461bcd60e51b81526020600482015260106024820152600080516020614a3a833981519152604482015290519081900360640190fd5b611d0d85858585856132f8565b600d5460ff1690565b6001600160a01b031660009081526020819052604090205490565b60008051602061469d83398151915281565b600d5460ff1615611de3576040805162461bcd60e51b81526020600482015260106024820152600080516020614a3a833981519152604482015290519081900360640190fd5b6001600160a01b0388166000908152600c6020526040902054889060ff1615611e3d5760405162461bcd60e51b8152600401808060200182810382526025815260200180614b1c6025913960400191505060405180910390fd5b611e4d89898989898989896133fa565b505050505050505050565b60606000611e7360008051602061499483398151915261259d565b90506060816001600160401b0381118015611e8d57600080fd5b50604051908082528060200260200182016040528015611eb7578160200160208202803683370190505b50905060005b828110156115ac57611edd60008051602061499483398151915282611fdf565b828281518110611ee957fe5b6001600160a01b0390921660209283029190910190910152600101611ebd565b6001600160a01b03166000908152600a602052604090205490565b600080516020614953833981519152611f3f816115ef612d96565b600790611fa55760405162461bcd60e51b81526020600482019081528254600260001961010060018416150201909116046024830181905290918291604490910190849080156116855780601f1061165a57610100808354040283529160200191611685565b50600d805460ff191660011790556040517f6985a02210a168e66602d3235cb6db0e70f92b3ba4d376a33c0f3d9434bff62590600090a150565b6000828152600660205260408120611ff790836134c9565b90505b92915050565b6000828152600660205260408120611ff790836134d5565b60048054604080516020601f60026000196101006001881615020190951694909404938401819004810282018101909252828152606093909290918301828280156111095780601f106110de57610100808354040283529160200191611109565b60008051602061473483398151915281565b600081565b6000805160206148ca83398151915281565b600d5460009060ff16156120eb576040805162461bcd60e51b81526020600482015260106024820152600080516020614a3a833981519152604482015290519081900360640190fd5b6120f3612d96565b6001600160a01b0381166000908152600c602052604090205460ff161561214b5760405162461bcd60e51b8152600401808060200182810382526025815260200180614b1c6025913960400191505060405180910390fd5b6001600160a01b0384166000908152600c6020526040902054849060ff16156121a55760405162461bcd60e51b8152600401808060200182810382526025815260200180614b1c6025913960400191505060405180910390fd5b6112296121b0612d96565b86866134ea565b600d5460009060ff1615612200576040805162461bcd60e51b81526020600482015260106024820152600080516020614a3a833981519152604482015290519081900360640190fd5b612208612d96565b6001600160a01b0381166000908152600c602052604090205460ff16156122605760405162461bcd60e51b8152600401808060200182810382526025815260200180614b1c6025913960400191505060405180910390fd5b6001600160a01b0384166000908152600c6020526040902054849060ff16156122ba5760405162461bcd60e51b8152600401808060200182810382526025815260200180614b1c6025913960400191505060405180910390fd5b6112296122c5612d96565b8686613539565b600d5460ff1615612312576040805162461bcd60e51b81526020600482015260106024820152600080516020614a3a833981519152604482015290519081900360640190fd5b6001600160a01b0389166000908152600c6020526040902054899060ff161561236c5760405162461bcd60e51b8152600401808060200182810382526025815260200180614b1c6025913960400191505060405180910390fd5b6001600160a01b0389166000908152600c6020526040902054899060ff16156123c65760405162461bcd60e51b8152600401808060200182810382526025815260200180614b1c6025913960400191505060405180910390fd5b6123d78b8b8b8b8b8b8b8b8b613682565b5050505050505050505050565b60008051602061469d8339815191526123ff816115ef612d96565b6007906124655760405162461bcd60e51b81526020600482019081528254600260001961010060018416150201909116046024830181905290918291604490910190849080156116855780601f1061165a57610100808354040283529160200191611685565b5061247a6001600160a01b0385168484613768565b50505050565b600d5460ff16156124c6576040805162461bcd60e51b81526020600482015260106024820152600080516020614a3a833981519152604482015290519081900360640190fd5b6001600160a01b0389166000908152600c6020526040902054899060ff16156125205760405162461bcd60e51b8152600401808060200182810382526025815260200180614b1c6025913960400191505060405180910390fd5b6001600160a01b0389166000908152600c6020526040902054899060ff161561257a5760405162461bcd60e51b8152600401808060200182810382526025815260200180614b1c6025913960400191505060405180910390fd5b6123d78b8b8b8b8b8b8b8b8b6137ba565b6000805160206148aa83398151915281565b6000818152600660205260408120611ffa90613894565b6000805160206148ca8339815191526125cf816115ef612d96565b6007906126355760405162461bcd60e51b81526020600482019081528254600260001961010060018416150201909116046024830181905290918291604490910190849080156116855780601f1061165a57610100808354040283529160200191611685565b5060008383602081101561264857600080fd5b50359050611d0d85826131e3565b600d5460ff161561269c576040805162461bcd60e51b81526020600482015260106024820152600080516020614a3a833981519152604482015290519081900360640190fd5b6001600160a01b0387166000908152600c6020526040902054879060ff16156126f65760405162461bcd60e51b8152600401808060200182810382526025815260200180614b1c6025913960400191505060405180910390fd5b6001600160a01b0387166000908152600c6020526040902054879060ff16156127505760405162461bcd60e51b8152600401808060200182810382526025815260200180614b1c6025913960400191505060405180910390fd5b611e4d8989898989898961389f565b60008281526006602052604090206002015461277d906115ef612d96565b6119cf5760405162461bcd60e51b81526004018080602001828103825260308152602001806148356030913960400191505060405180910390fd5b6000805160206147ed83398151915281565b6001600160a01b03918216600090815260016020908152604080832093909416825291909152205490565b60085460ff161561280557600080fd5b61284486868080601f0160208091040260200160405190810160405280939291908181526020018383808284376000920191909152506132c192505050565b61288384848080601f0160208091040260200160405190810160405280939291908181526020018383808284376000920191909152506132d492505050565b61288c82613a2f565b6128cd848460405160200180806410da1a5b1960da1b8152506005018383808284378083019250505092505050604051602081830303815290604052613a45565b6128df60006128da612d96565b611949565b6128f76000805160206148ca83398151915282611949565b61294f86868080601f016020809104026020016040519081016040528093929190818152602001838380828437600092019190915250506040805180820190915260018152603160f81b602082015291506132e79050565b50506008805460ff1916600117905550505050565b600d5460ff16156129aa576040805162461bcd60e51b81526020600482015260106024820152600080516020614a3a833981519152604482015290519081900360640190fd5b6001600160a01b0389166000908152600c6020526040902054899060ff1615612a045760405162461bcd60e51b8152600401808060200182810382526025815260200180614b1c6025913960400191505060405180910390fd5b6001600160a01b0389166000908152600c6020526040902054899060ff1615612a5e5760405162461bcd60e51b8152600401808060200182810382526025815260200180614b1c6025913960400191505060405180910390fd5b6123d78b8b8b8b8b8b8b8b8b613ae0565b600d5460ff1615612ab5576040805162461bcd60e51b81526020600482015260106024820152600080516020614a3a833981519152604482015290519081900360640190fd5b6001600160a01b0389166000908152600c6020526040902054899060ff1615612b0f5760405162461bcd60e51b8152600401808060200182810382526025815260200180614b1c6025913960400191505060405180910390fd5b6001600160a01b0389166000908152600c6020526040902054899060ff1615612b695760405162461bcd60e51b8152600401808060200182810382526025815260200180614b1c6025913960400191505060405180910390fd5b6123d78b8b8b8b8b8b8b8b8b613bba565b60008051602061495383398151915281565b60606000612ba760008051602061495383398151915261259d565b90506060816001600160401b0381118015612bc157600080fd5b50604051908082528060200260200182016040528015612beb578160200160208202803683370190505b50905060005b828110156115ac57612c1160008051602061495383398151915282611fdf565b828281518110612c1d57fe5b6001600160a01b0390921660209283029190910190910152600101612bf1565b6001600160a01b03919091166000908152600b60209081526040808320938352929052205460ff1690565b604051806040016040528060018152602001603160f81b81525081565b60008051602061499483398151915281565b600080516020614994833981519152612cb2816115ef612d96565b600790612d185760405162461bcd60e51b81526020600482019081528254600260001961010060018416150201909116046024830181905290918291604490910190849080156116855780601f1061165a57610100808354040283529160200191611685565b506001600160a01b0382166000818152600c6020526040808220805460ff19166001179055517fffa4e6181777692565cf28528fc88fd1516ea86b56da075235fa575af6a4b8559190a25050565b60008051602061490b83398151915281565b6001600160a01b03166000908152600c602052604090205460ff1690565b6000612da0613c94565b905090565b6001600160a01b038316612dea5760405162461bcd60e51b8152600401808060200182810382526024815260200180614a886024913960400191505060405180910390fd5b6001600160a01b038216612e2f5760405162461bcd60e51b81526004018080602001828103825260228152602001806147546022913960400191505060405180910390fd5b6001600160a01b03808416600081815260016020908152604080832094871680845294825291829020859055815185815291517f8c5be1e5ebec7d5bd14f71427d1e84f3dd0314c0f7b2291e5b200ac8c7c3b9259281900390910190a3505050565b60006001600160a01b038616612ed85760405162461bcd60e51b81526004018080602001828103825260258152602001806148656025913960400191505060405180910390fd5b606060008051602061490b83398151915260001b8660000151876020015188604001518051906020012060405160200180858152602001848152602001836001600160a01b031681526020018281526020019450505050506040516020818303038152906040529050866001600160a01b0316612f5a60095485888886613cf1565b6001600160a01b031614979650505050505050565b612f7a838383613539565b612fea83612f86612d96565b612fe58460405180606001604052806028815260200161492b602891396001600160a01b038916600090815260016020526040812090612fc4612d96565b6001600160a01b031681526020810191909152604001600020549190613d48565b612da5565b505050565b6001600160a01b0382166130345760405162461bcd60e51b81526004018080602001828103825260218152602001806149d46021913960400191505060405180910390fd5b61304082600083612fea565b61307d816040518060600160405280602281526020016146ec602291396001600160a01b0385166000908152602081905260409020549190613d48565b6001600160a01b0383166000908152602081905260409020556002546130a39082613ddf565b6002556040805182815290516000916001600160a01b038516916000805160206149b48339815191529181900360200190a35050565b60008281526006602052604090206130f19082613e21565b156118ec576130fe612d96565b6001600160a01b0316816001600160a01b0316837f2f8788117e7eff1d82e926ec794901d17c78024a50270940304540a733656f0d60405160405180910390a45050565b600082815260066020526040902061315a9082613e36565b156118ec57613167612d96565b6001600160a01b0316816001600160a01b0316837ff6391f5c32d9c69d2a47ea670b442974b53935d1edc7fd64eb21e047a839171b60405160405180910390a45050565b6001600160a01b03808416600090815260016020908152604080832093861683529290522054612fea9084908490612fe59085613e4b565b6001600160a01b03821661323e576040805162461bcd60e51b815260206004820152601f60248201527f45524332303a206d696e7420746f20746865207a65726f206164647265737300604482015290519081900360640190fd5b61324a60008383612fea565b6002546132579082613e4b565b6002556001600160a01b03821660009081526020819052604090205461327d9082613e4b565b6001600160a01b0383166000818152602081815260408083209490945583518581529351929391926000805160206149b48339815191529281900390910190a35050565b80516118ec9060039060208401906145c4565b80516118ec9060049060208401906145c4565b6132f18282613ea3565b6009555050565b6133028585613f15565b604080516000805160206147ed83398151915260208201526001600160a01b03871681830181905260608281018890528351808403909101815260809092019092526009549091906133579086868686613cf1565b6001600160a01b03161461339c5760405162461bcd60e51b81526004018080602001828103825260218152602001806148ea6021913960400191505060405180910390fd5b6001600160a01b0386166000818152600b60209081526040808320898452909152808220805460ff19166002179055518792917f1cdd46ff242716cdaa72d159d339a485b3438398348d68f09d7c8c0a59353d8191a3505050505050565b61340688858888613f83565b60408051600080516020614ad283398151915260208201526001600160a01b038a16818301819052606082018a90526080820189905260a0820188905260c08083018890528351808403909101815260e09092019092526009549091906134709086868686613cf1565b6001600160a01b0316146134b55760405162461bcd60e51b81526004018080602001828103825260218152602001806148ea6021913960400191505060405180910390fd5b6134bf8986614009565b611e4d8989612fef565b6000611ff78383614063565b6000611ff7836001600160a01b0384166140c7565b612fea8383612fe584604051806060016040528060258152602001614b41602591396001600160a01b03808a166000908152600160209081526040808320938c16835292905220549190613d48565b6001600160a01b03831661357e5760405162461bcd60e51b8152600401808060200182810382526025815260200180614a156025913960400191505060405180910390fd5b6001600160a01b0382166135c35760405162461bcd60e51b815260040180806020018281038252602381526020018061467a6023913960400191505060405180910390fd5b6135ce838383612fea565b61360b816040518060600160405280602681526020016147a7602691396001600160a01b0386166000908152602081905260409020549190613d48565b6001600160a01b03808516600090815260208190526040808220939093559084168152205461363a9082613e4b565b6001600160a01b038084166000818152602081815260409182902094909455805185815290519193928716926000805160206149b483398151915292918290030190a3505050565b61368e89858888613f83565b6040805160008051602061488a83398151915260208201526001600160a01b03808c16828401819052908b166060830152608082018a905260a0820189905260c0820188905260e0808301889052835180840390910181526101009092019092526009549091906137029086868686613cf1565b6001600160a01b0316146137475760405162461bcd60e51b81526004018080602001828103825260218152602001806148ea6021913960400191505060405180910390fd5b6137518a86614009565b61375c8a8a8a6134ea565b50505050505050505050565b604080516001600160a01b038416602482015260448082018490528251808303909101815260649091019091526020810180516001600160e01b031663a9059cbb60e01b179052612fea9084906140df565b6137c689858888613f83565b604080516000805160206148aa83398151915260208201526001600160a01b03808c16828401819052908b166060830152608082018a905260a0820189905260c0820188905260e08083018890528351808403909101815261010090920190925260095490919061383a9086868686613cf1565b6001600160a01b03161461387f5760405162461bcd60e51b81526004018080602001828103825260218152602001806148ea6021913960400191505060405180910390fd5b6138898a86614009565b61375c8a8a8a6131ab565b6000611ffa82614190565b333014156138ee576040805162461bcd60e51b815260206004820152601760248201527610d85b1b195c881a5cc81d1a1a5cc818dbdb9d1c9858dd604a1b604482015290519081900360640190fd5b4284101561393f576040805162461bcd60e51b815260206004820152601960248201527814195c9b5a5d0e881c195c9b5a5d081a5cc8195e1c1a5c9959603a1b604482015290519081900360640190fd5b6001600160a01b038088166000818152600a602090815260409182902080546001810190915582516000805160206149f583398151915292810192909252818301849052938a1660608201526080810189905260a081019390935260c08084018890528151808503909101815260e090930190526009546139c39086868686613cf1565b6001600160a01b031614613a1a576040805162461bcd60e51b81526020600482015260196024820152785065726d69743a20696e76616c6964207369676e617475726560381b604482015290519081900360640190fd5b613a25888888612da5565b5050505050505050565b6005805460ff191660ff92909216919091179055565b806040516020018082805190602001908083835b60208310613a785780518252601f199092019160209182019101613a59565b51815160209384036101000a6000190180199092169116179052793a20494e53554646494349454e545f5045524d495353494f4e5360301b9190930190815260408051808303600519018152601a909201905280516118ec95506007945092019190506145c4565b613aec89858888613f83565b604080516000805160206147cd83398151915260208201526001600160a01b03808c16828401819052908b166060830152608082018a905260a0820189905260c0820188905260e080830188905283518084039091018152610100909201909252600954909190613b609086868686613cf1565b6001600160a01b031614613ba55760405162461bcd60e51b81526004018080602001828103825260218152602001806148ea6021913960400191505060405180910390fd5b613baf8a86614009565b61375c8a8a8a612da5565b613bc689858888613f83565b6040805160008051602061473483398151915260208201526001600160a01b03808c16828401819052908b166060830152608082018a905260a0820189905260c0820188905260e080830188905283518084039091018152610100909201909252600954909190613c3a9086868686613cf1565b6001600160a01b031614613c7f5760405162461bcd60e51b81526004018080602001828103825260218152602001806148ea6021913960400191505060405180910390fd5b613c898a86614009565b61375c8a8a8a613539565b600033301415613cec5760606000368080601f0160208091040260200160405190810160405280939291908181526020018383808284376000920191909152505050503601516001600160a01b031691506111119050565b503390565b80516020808301919091206040805161190160f01b81850152602281018990526042808201939093528151808203909301835260620190528051910120600090613d3d81878787614194565b979650505050505050565b60008184841115613dd75760405162461bcd60e51b81526004018080602001828103825283818151815260200191508051906020019080838360005b83811015613d9c578181015183820152602001613d84565b50505050905090810190601f168015613dc95780820380516001836020036101000a031916815260200191505b509250505060405180910390fd5b505050900390565b6000611ff783836040518060400160405280601e81526020017f536166654d6174683a207375627472616374696f6e206f766572666c6f770000815250613d48565b6000611ff7836001600160a01b03841661430d565b6000611ff7836001600160a01b038416614357565b600082820183811015611ff7576040805162461bcd60e51b815260206004820152601b60248201527a536166654d6174683a206164646974696f6e206f766572666c6f7760281b604482015290519081900360640190fd5b8151602092830120815191830191909120604080517f36c25de3e541d5d970f66e4210d728721220fff5c077cc6cd008b3a0c62adab7818601528082019390935260608301919091523060808301524660a0808401919091528151808403909101815260c09092019052805191012090565b6001600160a01b0382166000908152600b6020908152604080832084845290915281205460ff166002811115613f4757fe5b146118ec5760405162461bcd60e51b81526004018080602001828103825260318152602001806147766031913960400191505060405180910390fd5b814211613fc15760405162461bcd60e51b815260040180806020018281038252602e815260200180614a5a602e913960400191505060405180910390fd5b804210613fff5760405162461bcd60e51b815260040180806020018281038252602881526020018061480d6028913960400191505060405180910390fd5b61247a8484613f15565b6001600160a01b0382166000818152600b60209081526040808320858452909152808220805460ff19166001179055518392917f98de503528ee59b575ef0c0a2576a82497bfc029a5685b209e9ec333479b10a591a35050565b815460009082106140a55760405162461bcd60e51b81526004018080602001828103825260228152602001806146586022913960400191505060405180910390fd5b8260000182815481106140b457fe5b9060005260206000200154905092915050565b60009081526001919091016020526040902054151590565b6060614134826040518060400160405280602081526020017f5361666545524332303a206c6f772d6c6576656c2063616c6c206661696c6564815250856001600160a01b031661441d9092919063ffffffff16565b805190915015612fea5780806020019051602081101561415357600080fd5b5051612fea5760405162461bcd60e51b815260040180806020018281038252602a815260200180614af2602a913960400191505060405180910390fd5b5490565b60006fa2a8918ca85bafe22016d0b997e4df60600160ff1b038211156141eb5760405162461bcd60e51b8152600401808060200182810382526026815260200180614aac6026913960400191505060405180910390fd5b8360ff16601b1415801561420357508360ff16601c14155b1561423f5760405162461bcd60e51b815260040180806020018281038252602681526020018061470e6026913960400191505060405180910390fd5b600060018686868660405160008152602001604052604051808581526020018460ff1681526020018381526020018281526020019450505050506020604051602081039080840390855afa15801561429b573d6000803e3d6000fd5b5050604051601f1901519150506001600160a01b038116614302576040805162461bcd60e51b815260206004820152601c60248201527b45435265636f7665723a20696e76616c6964207369676e617475726560201b604482015290519081900360640190fd5b90505b949350505050565b600061431983836140c7565b61434f57508154600181810184556000848152602080822090930184905584548482528286019093526040902091909155611ffa565b506000611ffa565b60008181526001830160205260408120548015614413578354600019808301919081019060009087908390811061438a57fe5b90600052602060002001549050808760000184815481106143a757fe5b6000918252602080832090910192909255828152600189810190925260409020908401905586548790806143d757fe5b60019003818190600052602060002001600090559055866001016000878152602001908152602001600020600090556001945050505050611ffa565b6000915050611ffa565b60606143058484600085606061443285614594565b614483576040805162461bcd60e51b815260206004820152601d60248201527f416464726573733a2063616c6c20746f206e6f6e2d636f6e7472616374000000604482015290519081900360640190fd5b60006060866001600160a01b031685876040518082805190602001908083835b602083106144c25780518252601f1990920191602091820191016144a3565b6001836020036101000a03801982511681845116808217855250505050505090500191505060006040518083038185875af1925050503d8060008114614524576040519150601f19603f3d011682016040523d82523d6000602084013e614529565b606091505b5091509150811561453d5791506143059050565b80511561454d5780518082602001fd5b60405162461bcd60e51b8152602060048201818152865160248401528651879391928392604401919085019080838360008315613d9c578181015183820152602001613d84565b3b151590565b60405180606001604052806000815260200160006001600160a01b03168152602001606081525090565b828054600181600116156101000203166002900490600052602060002090601f016020900481019282601f1061460557805160ff1916838001178555614632565b82800160010185558215614632579182015b82811115614632578251825591602001919060010190614617565b5061463e929150614642565b5090565b5b8082111561463e576000815560010161464356fe456e756d657261626c655365743a20696e646578206f7574206f6620626f756e647345524332303a207472616e7366657220746f20746865207a65726f2061646472657373cf6f9f892731e14b8859835f2ff35575f447fb501f46243c4eb8bac19e31a050416363657373436f6e74726f6c3a2073656e646572206d75737420626520616e2061646d696e20746f206772616e7445524332303a206275726e20616d6f756e7420657863656564732062616c616e636545435265636f7665723a20696e76616c6964207369676e6174757265202776272076616c75657c7c6cdb67a18743f49ec6fa9b35f50d52ed05cbed4cc592e13b44501c1a226745524332303a20617070726f766520746f20746865207a65726f20616464726573734761734162737472616374696f6e3a20617574686f72697a6174696f6e2069732075736564206f722063616e63656c656445524332303a207472616e7366657220616d6f756e7420657863656564732062616c616e6365808c10407a796f3ef2c7ea38c0638ea9d2b8a1c63e3ca9e1f56ce84ae59df73c158b0a9edf7a828aad02f63cd515c68ef2f50ba807396f6d12842833a15974294761734162737472616374696f6e3a20617574686f72697a6174696f6e2069732065787069726564416363657373436f6e74726f6c3a2073656e646572206d75737420626520616e2061646d696e20746f207265766f6b654e61746976654d6574615472616e73616374696f6e3a20494e56414c49445f5349474e4552b70559e94cbda91958ebec07f9b65b3b490097c8d25c8dacd71105df1015b6d8424222bb050a1f7f14017232a5671f2680a2d3420f504bd565cf03035c53198a8f4f2da22e8ac8f11e15f9fc141cddbb5deea8800186560abb6e68c5496619a94761734162737472616374696f6e3a20696e76616c6964207369676e617475726523d10def3caacba2e4042e0c75d44a42d2558aabcf5ce951d0642a8032e1e65345524332303a207472616e7366657220616d6f756e74206578636565647320616c6c6f77616e636565d7a28e3265b37a6474929f336521b332c1681b933f6cb9f3376673440d862a5369676e657220616e64207369676e617475726520646f206e6f74206d6174636898db8a220cd0f09badce9f22d0ba7e93edb3d404448cc3560d391ab096ad16e9ddf252ad1be2c89b69c2b068fc378daa952ba7f163c4a11628f55a4df523b3ef45524332303a206275726e2066726f6d20746865207a65726f20616464726573736e71edae12b1b97f4d1f60370fef10105fa2faae0126114a169c64845d6126c945524332303a207472616e736665722066726f6d20746865207a65726f20616464726573735061757361626c653a20706175736564000000000000000000000000000000004761734162737472616374696f6e3a20617574686f72697a6174696f6e206973206e6f74207965742076616c696445524332303a20617070726f76652066726f6d20746865207a65726f206164647265737345435265636f7665723a20696e76616c6964207369676e6174757265202773272076616c75656c8f8f5f82f0c140edd12e80d10ff715a36d6e5f73e406394862b5f1eb44c4f95361666545524332303a204552433230206f7065726174696f6e20646964206e6f742073756363656564426c61636b6c69737461626c653a206163636f756e7420697320626c61636b6c697374656445524332303a2064656372656173656420616c6c6f77616e63652062656c6f77207a65726f416363657373436f6e74726f6c3a2063616e206f6e6c792072656e6f756e636520726f6c657320666f722073656c66a164736f6c634300060c000a",
  "deployedBytecode": "0x6080604052600436106102a75760003560e01c806306fdde03146102ac578063095ea7b3146103365780630c53c51c14610383578063100a15601461044557806310c8b404146104aa578063158ef93e146104d157806318160ddd146104e65780631a895266146104fb5780632004d2911461053057806323b872dd14610545578063248a9ca3146105885780632e1a7d4d146105b25780632f2ff15d146105dc57806330adf81f14610615578063313ce5671461062a5780633408e470146106555780633644e5151461066a57806336568abe1461067f57806339509351146106b85780633f4ba83a146106f157806340c10f19146107065780634b71f5c31461073f57806356ce0e6c146107545780635a049a701461081f5780635c975abb1461086d57806370a082311461088257806371372544146108b55780637b766e5f146108ca5780637cfa1cfa1461092b5780637ecebe00146109405780638456cb59146109735780639010d07c1461098857806391d14854146109d457806395d89b4114610a0d578063a0cc6a6814610a22578063a217fddf14610a37578063a3b0b5a314610a4c578063a457c2d714610a61578063a9059cbb14610a9a578063b008609514610ad3578063b2118a8d14610b3f578063c237108f14610b82578063c7b84f8d14610bee578063ca15c87314610c03578063cf2c52cb14610c2d578063d505accf14610cb8578063d547741f14610d16578063d916948714610d4f578063dd62ed3e14610d64578063de7ea79d14610d9f578063e1560fd314610e7c578063e3ee160e14610ee8578063e63ab1e914610f54578063e8d6fc4714610f69578063e94a010214610f7e578063eccec5a814610fd8578063f515e6f214610fed578063f9f92be414611002578063fa2c322d14611035578063fe575a871461104a575b600080fd5b3480156102b857600080fd5b506102c161107d565b6040805160208082528351818301528351919283929083019185019080838360005b838110156102fb5781810151838201526020016102e3565b50505050905090810190601f1680156103285780820380516001836020036101000a031916815260200191505b509250505060405180910390f35b34801561034257600080fd5b5061036f6004803603604081101561035957600080fd5b506001600160a01b038135169060200135611114565b604080519115158252519081900360200190f35b6102c1600480360360a081101561039957600080fd5b6001600160a01b038235169190810190604081016020820135600160201b8111156103c357600080fd5b8201836020820111156103d557600080fd5b803590602001918460018302840111600160201b831117156103f657600080fd5b91908080601f016020809104026020016040519081016040528093929190818152602001838380828437600092019190915250929550508235935050506020810135906040013560ff16611234565b34801561045157600080fd5b5061045a6114fb565b60408051602080825283518183015283519192839290830191858101910280838360005b8381101561049657818101518382015260200161047e565b505050509050019250505060405180910390f35b3480156104b657600080fd5b506104bf6115b3565b60408051918252519081900360200190f35b3480156104dd57600080fd5b5061036f6115c5565b3480156104f257600080fd5b506104bf6115ce565b34801561050757600080fd5b5061052e6004803603602081101561051e57600080fd5b50356001600160a01b03166115d4565b005b34801561053c57600080fd5b506104bf6116df565b34801561055157600080fd5b5061036f6004803603606081101561056857600080fd5b506001600160a01b038135811691602081013590911690604001356116f1565b34801561059457600080fd5b506104bf600480360360208110156105ab57600080fd5b5035611866565b3480156105be57600080fd5b5061052e600480360360208110156105d557600080fd5b503561187b565b3480156105e857600080fd5b5061052e600480360360408110156105ff57600080fd5b50803590602001356001600160a01b03166118f0565b34801561062157600080fd5b506104bf611953565b34801561063657600080fd5b5061063f611965565b6040805160ff9092168252519081900360200190f35b34801561066157600080fd5b506104bf61196e565b34801561067657600080fd5b506104bf611972565b34801561068b57600080fd5b5061052e600480360360408110156106a257600080fd5b50803590602001356001600160a01b0316611978565b3480156106c457600080fd5b5061036f600480360360408110156106db57600080fd5b506001600160a01b0381351690602001356119d9565b3480156106fd57600080fd5b5061052e611aee565b34801561071257600080fd5b5061052e6004803603604081101561072957600080fd5b506001600160a01b038135169060200135611ba6565b34801561074b57600080fd5b506104bf611bb0565b34801561076057600080fd5b5061052e6004803603604081101561077757600080fd5b810190602081018135600160201b81111561079157600080fd5b8201836020820111156107a357600080fd5b803590602001918460018302840111600160201b831117156107c457600080fd5b919390929091602081019035600160201b8111156107e157600080fd5b8201836020820111156107f357600080fd5b803590602001918460018302840111600160201b8311171561081457600080fd5b509092509050611bc2565b34801561082b57600080fd5b5061052e600480360360a081101561084257600080fd5b506001600160a01b038135169060208101359060ff6040820135169060608101359060800135611d14565b34801561087957600080fd5b5061036f611d67565b34801561088e57600080fd5b506104bf600480360360208110156108a557600080fd5b50356001600160a01b0316611d70565b3480156108c157600080fd5b506104bf611d8b565b3480156108d657600080fd5b5061052e60048036036101008110156108ee57600080fd5b506001600160a01b038135169060208101359060408101359060608101359060808101359060ff60a0820135169060c08101359060e00135611d9d565b34801561093757600080fd5b5061045a611e58565b34801561094c57600080fd5b506104bf6004803603602081101561096357600080fd5b50356001600160a01b0316611f09565b34801561097f57600080fd5b5061052e611f24565b34801561099457600080fd5b506109b8600480360360408110156109ab57600080fd5b5080359060200135611fdf565b604080516001600160a01b039092168252519081900360200190f35b3480156109e057600080fd5b5061036f600480360360408110156109f757600080fd5b50803590602001356001600160a01b0316612000565b348015610a1957600080fd5b506102c1612018565b348015610a2e57600080fd5b506104bf612079565b348015610a4357600080fd5b506104bf61208b565b348015610a5857600080fd5b506104bf612090565b348015610a6d57600080fd5b5061036f60048036036040811015610a8457600080fd5b506001600160a01b0381351690602001356120a2565b348015610aa657600080fd5b5061036f60048036036040811015610abd57600080fd5b506001600160a01b0381351690602001356121b7565b348015610adf57600080fd5b5061052e6004803603610120811015610af757600080fd5b506001600160a01b03813581169160208101359091169060408101359060608101359060808101359060a08101359060ff60c0820135169060e08101359061010001356122cc565b348015610b4b57600080fd5b5061052e60048036036060811015610b6257600080fd5b506001600160a01b038135811691602081013590911690604001356123e4565b348015610b8e57600080fd5b5061052e6004803603610120811015610ba657600080fd5b506001600160a01b03813581169160208101359091169060408101359060608101359060808101359060a08101359060ff60c0820135169060e0810135906101000135612480565b348015610bfa57600080fd5b506104bf61258b565b348015610c0f57600080fd5b506104bf60048036036020811015610c2657600080fd5b503561259d565b348015610c3957600080fd5b5061052e60048036036040811015610c5057600080fd5b6001600160a01b038235169190810190604081016020820135600160201b811115610c7a57600080fd5b820183602082011115610c8c57600080fd5b803590602001918460018302840111600160201b83111715610cad57600080fd5b5090925090506125b4565b348015610cc457600080fd5b5061052e600480360360e0811015610cdb57600080fd5b506001600160a01b03813581169160208101359091169060408101359060608101359060ff6080820135169060a08101359060c00135612656565b348015610d2257600080fd5b5061052e60048036036040811015610d3957600080fd5b50803590602001356001600160a01b031661275f565b348015610d5b57600080fd5b506104bf6127b8565b348015610d7057600080fd5b506104bf60048036036040811015610d8757600080fd5b506001600160a01b03813581169160200135166127ca565b348015610dab57600080fd5b5061052e60048036036080811015610dc257600080fd5b810190602081018135600160201b811115610ddc57600080fd5b820183602082011115610dee57600080fd5b803590602001918460018302840111600160201b83111715610e0f57600080fd5b919390929091602081019035600160201b811115610e2c57600080fd5b820183602082011115610e3e57600080fd5b803590602001918460018302840111600160201b83111715610e5f57600080fd5b9193509150803560ff1690602001356001600160a01b03166127f5565b348015610e8857600080fd5b5061052e6004803603610120811015610ea057600080fd5b506001600160a01b03813581169160208101359091169060408101359060608101359060808101359060a08101359060ff60c0820135169060e0810135906101000135612964565b348015610ef457600080fd5b5061052e6004803603610120811015610f0c57600080fd5b506001600160a01b03813581169160208101359091169060408101359060608101359060808101359060a08101359060ff60c0820135169060e0810135906101000135612a6f565b348015610f6057600080fd5b506104bf612b7a565b348015610f7557600080fd5b5061045a612b8c565b348015610f8a57600080fd5b50610fb760048036036040811015610fa157600080fd5b506001600160a01b038135169060200135612c3d565b60405180826002811115610fc757fe5b815260200191505060405180910390f35b348015610fe457600080fd5b506102c1612c68565b348015610ff957600080fd5b506104bf612c85565b34801561100e57600080fd5b5061052e6004803603602081101561102557600080fd5b50356001600160a01b0316612c97565b34801561104157600080fd5b506104bf612d66565b34801561105657600080fd5b5061036f6004803603602081101561106d57600080fd5b50356001600160a01b0316612d78565b60038054604080516020601f60026000196101006001881615020190951694909404938401819004810282018101909252828152606093909290918301828280156111095780601f106110de57610100808354040283529160200191611109565b820191906000526020600020905b8154815290600101906020018083116110ec57829003601f168201915b505050505090505b90565b600d5460009060ff161561115d576040805162461bcd60e51b81526020600482015260106024820152600080516020614a3a833981519152604482015290519081900360640190fd5b611165612d96565b6001600160a01b0381166000908152600c602052604090205460ff16156111bd5760405162461bcd60e51b8152600401808060200182810382526025815260200180614b1c6025913960400191505060405180910390fd5b6001600160a01b0384166000908152600c6020526040902054849060ff16156112175760405162461bcd60e51b8152600401808060200182810382526025815260200180614b1c6025913960400191505060405180910390fd5b611229611222612d96565b8686612da5565b506001949350505050565b606061123e61459a565b50604080516060810182526001600160a01b0388166000818152600a60209081529084902080546001810190915583528201529081018690526112848782878787612e91565b6112bf5760405162461bcd60e51b81526004018080602001828103825260218152602001806149736021913960400191505060405180910390fd5b7f5845892132946850460bff5a0083f71031bc5bf9aadcd40f1de79423eac9b10b87338860405180846001600160a01b03168152602001836001600160a01b0316815260200180602001828103825283818151815260200191508051906020019080838360005b8381101561133e578181015183820152602001611326565b50505050905090810190601f16801561136b5780820380516001836020036101000a031916815260200191505b5094505050505060405180910390a160006060306001600160a01b0316888a6040516020018083805190602001908083835b602083106113bc5780518252601f19909201916020918201910161139d565b6001836020036101000a038019825116818451168082178552505050505050905001826001600160a01b031660601b8152601401925050506040516020818303038152906040526040518082805190602001908083835b602083106114325780518252601f199092019160209182019101611413565b6001836020036101000a0380198251168184511680821785525050505050509050019150506000604051808303816000865af19150503d8060008114611494576040519150601f19603f3d011682016040523d82523d6000602084013e611499565b606091505b5091509150816114ef576040805162461bcd60e51b815260206004820152601c60248201527b119d5b98dd1a5bdb8818d85b1b081b9bdd081cdd58d8d95cdcd99d5b60221b604482015290519081900360640190fd5b98975050505050505050565b6060600061151660008051602061469d83398151915261259d565b90506060816001600160401b038111801561153057600080fd5b5060405190808252806020026020018201604052801561155a578160200160208202803683370190505b50905060005b828110156115ac5761158060008051602061469d83398151915282611fdf565b82828151811061158c57fe5b6001600160a01b0390921660209283029190910190910152600101611560565b5091505090565b6000805160206147cd83398151915281565b60085460ff1690565b60025490565b6000805160206149948339815191526115f4816115ef612d96565b612000565b6007906116945760405162461bcd60e51b81526020600482019081528254600260001961010060018416150201909116046024830181905290918291604490910190849080156116855780601f1061165a57610100808354040283529160200191611685565b820191906000526020600020905b81548152906001019060200180831161166857829003601f168201915b50509250505060405180910390fd5b506001600160a01b0382166000818152600c6020526040808220805460ff19169055517f117e3210bb9aa7d9baff172026820255c6f6c30ba8999d1c2fd88e2848137c4e9190a25050565b600080516020614ad283398151915281565b600d5460009060ff161561173a576040805162461bcd60e51b81526020600482015260106024820152600080516020614a3a833981519152604482015290519081900360640190fd5b611742612d96565b6001600160a01b0381166000908152600c602052604090205460ff161561179a5760405162461bcd60e51b8152600401808060200182810382526025815260200180614b1c6025913960400191505060405180910390fd5b6001600160a01b0385166000908152600c6020526040902054859060ff16156117f45760405162461bcd60e51b8152600401808060200182810382526025815260200180614b1c6025913960400191505060405180910390fd5b6001600160a01b0385166000908152600c6020526040902054859060ff161561184e5760405162461bcd60e51b8152600401808060200182810382526025815260200180614b1c6025913960400191505060405180910390fd5b611859878787612f6f565b5060019695505050505050565b60009081526006602052604090206002015490565b611883612d96565b6001600160a01b0381166000908152600c602052604090205460ff16156118db5760405162461bcd60e51b8152600401808060200182810382526025815260200180614b1c6025913960400191505060405180910390fd5b6118ec6118e6612d96565b83612fef565b5050565b60008281526006602052604090206002015461190e906115ef612d96565b6119495760405162461bcd60e51b815260040180806020018281038252602f8152602001806146bd602f913960400191505060405180910390fd5b6118ec82826130d9565b6000805160206149f583398151915281565b60055460ff1690565b4690565b60095481565b611980612d96565b6001600160a01b0316816001600160a01b0316146119cf5760405162461bcd60e51b815260040180806020018281038252602f815260200180614b66602f913960400191505060405180910390fd5b6118ec8282613142565b600d5460009060ff1615611a22576040805162461bcd60e51b81526020600482015260106024820152600080516020614a3a833981519152604482015290519081900360640190fd5b611a2a612d96565b6001600160a01b0381166000908152600c602052604090205460ff1615611a825760405162461bcd60e51b8152600401808060200182810382526025815260200180614b1c6025913960400191505060405180910390fd5b6001600160a01b0384166000908152600c6020526040902054849060ff1615611adc5760405162461bcd60e51b8152600401808060200182810382526025815260200180614b1c6025913960400191505060405180910390fd5b611229611ae7612d96565b86866131ab565b600080516020614953833981519152611b09816115ef612d96565b600790611b6f5760405162461bcd60e51b81526020600482019081528254600260001961010060018416150201909116046024830181905290918291604490910190849080156116855780601f1061165a57610100808354040283529160200191611685565b50600d805460ff191690556040517f7805862f689e2f13df9f062ff482ad3ad112aca9e0847911ed832e158c525b3390600090a150565b6118ec82826131e3565b60008051602061488a83398151915281565b6000611bd0816115ef612d96565b600790611c365760405162461bcd60e51b81526020600482019081528254600260001961010060018416150201909116046024830181905290918291604490910190849080156116855780601f1061165a57610100808354040283529160200191611685565b50611c7685858080601f0160208091040260200160405190810160405280939291908181526020018383808284376000920191909152506132c192505050565b611cb583838080601f0160208091040260200160405190810160405280939291908181526020018383808284376000920191909152506132d492505050565b611d0d85858080601f016020809104026020016040519081016040528093929190818152602001838380828437600092019190915250506040805180820190915260018152603160f81b602082015291506132e79050565b5050505050565b600d5460ff1615611d5a576040805162461bcd60e51b81526020600482015260106024820152600080516020614a3a833981519152604482015290519081900360640190fd5b611d0d85858585856132f8565b600d5460ff1690565b6001600160a01b031660009081526020819052604090205490565b60008051602061469d83398151915281565b600d5460ff1615611de3576040805162461bcd60e51b81526020600482015260106024820152600080516020614a3a833981519152604482015290519081900360640190fd5b6001600160a01b0388166000908152600c6020526040902054889060ff1615611e3d5760405162461bcd60e51b8152600401808060200182810382526025815260200180614b1c6025913960400191505060405180910390fd5b611e4d89898989898989896133fa565b505050505050505050565b60606000611e7360008051602061499483398151915261259d565b90506060816001600160401b0381118015611e8d57600080fd5b50604051908082528060200260200182016040528015611eb7578160200160208202803683370190505b50905060005b828110156115ac57611edd60008051602061499483398151915282611fdf565b828281518110611ee957fe5b6001600160a01b0390921660209283029190910190910152600101611ebd565b6001600160a01b03166000908152600a602052604090205490565b600080516020614953833981519152611f3f816115ef612d96565b600790611fa55760405162461bcd60e51b81526020600482019081528254600260001961010060018416150201909116046024830181905290918291604490910190849080156116855780601f1061165a57610100808354040283529160200191611685565b50600d805460ff191660011790556040517f6985a02210a168e66602d3235cb6db0e70f92b3ba4d376a33c0f3d9434bff62590600090a150565b6000828152600660205260408120611ff790836134c9565b90505b92915050565b6000828152600660205260408120611ff790836134d5565b60048054604080516020601f60026000196101006001881615020190951694909404938401819004810282018101909252828152606093909290918301828280156111095780601f106110de57610100808354040283529160200191611109565b60008051602061473483398151915281565b600081565b6000805160206148ca83398151915281565b600d5460009060ff16156120eb576040805162461bcd60e51b81526020600482015260106024820152600080516020614a3a833981519152604482015290519081900360640190fd5b6120f3612d96565b6001600160a01b0381166000908152600c602052604090205460ff161561214b5760405162461bcd60e51b8152600401808060200182810382526025815260200180614b1c6025913960400191505060405180910390fd5b6001600160a01b0384166000908152600c6020526040902054849060ff16156121a55760405162461bcd60e51b8152600401808060200182810382526025815260200180614b1c6025913960400191505060405180910390fd5b6112296121b0612d96565b86866134ea565b600d5460009060ff1615612200576040805162461bcd60e51b81526020600482015260106024820152600080516020614a3a833981519152604482015290519081900360640190fd5b612208612d96565b6001600160a01b0381166000908152600c602052604090205460ff16156122605760405162461bcd60e51b8152600401808060200182810382526025815260200180614b1c6025913960400191505060405180910390fd5b6001600160a01b0384166000908152600c6020526040902054849060ff16156122ba5760405162461bcd60e51b8152600401808060200182810382526025815260200180614b1c6025913960400191505060405180910390fd5b6112296122c5612d96565b8686613539565b600d5460ff1615612312576040805162461bcd60e51b81526020600482015260106024820152600080516020614a3a833981519152604482015290519081900360640190fd5b6001600160a01b0389166000908152600c6020526040902054899060ff161561236c5760405162461bcd60e51b8152600401808060200182810382526025815260200180614b1c6025913960400191505060405180910390fd5b6001600160a01b0389166000908152600c6020526040902054899060ff16156123c65760405162461bcd60e51b8152600401808060200182810382526025815260200180614b1c6025913960400191505060405180910390fd5b6123d78b8b8b8b8b8b8b8b8b613682565b5050505050505050505050565b60008051602061469d8339815191526123ff816115ef612d96565b6007906124655760405162461bcd60e51b81526020600482019081528254600260001961010060018416150201909116046024830181905290918291604490910190849080156116855780601f1061165a57610100808354040283529160200191611685565b5061247a6001600160a01b0385168484613768565b50505050565b600d5460ff16156124c6576040805162461bcd60e51b81526020600482015260106024820152600080516020614a3a833981519152604482015290519081900360640190fd5b6001600160a01b0389166000908152600c6020526040902054899060ff16156125205760405162461bcd60e51b8152600401808060200182810382526025815260200180614b1c6025913960400191505060405180910390fd5b6001600160a01b0389166000908152600c6020526040902054899060ff161561257a5760405162461bcd60e51b8152600401808060200182810382526025815260200180614b1c6025913960400191505060405180910390fd5b6123d78b8b8b8b8b8b8b8b8b6137ba565b6000805160206148aa83398151915281565b6000818152600660205260408120611ffa90613894565b6000805160206148ca8339815191526125cf816115ef612d96565b6007906126355760405162461bcd60e51b81526020600482019081528254600260001961010060018416150201909116046024830181905290918291604490910190849080156116855780601f1061165a57610100808354040283529160200191611685565b5060008383602081101561264857600080fd5b50359050611d0d85826131e3565b600d5460ff161561269c576040805162461bcd60e51b81526020600482015260106024820152600080516020614a3a833981519152604482015290519081900360640190fd5b6001600160a01b0387166000908152600c6020526040902054879060ff16156126f65760405162461bcd60e51b8152600401808060200182810382526025815260200180614b1c6025913960400191505060405180910390fd5b6001600160a01b0387166000908152600c6020526040902054879060ff16156127505760405162461bcd60e51b8152600401808060200182810382526025815260200180614b1c6025913960400191505060405180910390fd5b611e4d8989898989898961389f565b60008281526006602052604090206002015461277d906115ef612d96565b6119cf5760405162461bcd60e51b81526004018080602001828103825260308152602001806148356030913960400191505060405180910390fd5b6000805160206147ed83398151915281565b6001600160a01b03918216600090815260016020908152604080832093909416825291909152205490565b60085460ff161561280557600080fd5b61284486868080601f0160208091040260200160405190810160405280939291908181526020018383808284376000920191909152506132c192505050565b61288384848080601f0160208091040260200160405190810160405280939291908181526020018383808284376000920191909152506132d492505050565b61288c82613a2f565b6128cd848460405160200180806410da1a5b1960da1b8152506005018383808284378083019250505092505050604051602081830303815290604052613a45565b6128df60006128da612d96565b611949565b6128f76000805160206148ca83398151915282611949565b61294f86868080601f016020809104026020016040519081016040528093929190818152602001838380828437600092019190915250506040805180820190915260018152603160f81b602082015291506132e79050565b50506008805460ff1916600117905550505050565b600d5460ff16156129aa576040805162461bcd60e51b81526020600482015260106024820152600080516020614a3a833981519152604482015290519081900360640190fd5b6001600160a01b0389166000908152600c6020526040902054899060ff1615612a045760405162461bcd60e51b8152600401808060200182810382526025815260200180614b1c6025913960400191505060405180910390fd5b6001600160a01b0389166000908152600c6020526040902054899060ff1615612a5e5760405162461bcd60e51b8152600401808060200182810382526025815260200180614b1c6025913960400191505060405180910390fd5b6123d78b8b8b8b8b8b8b8b8b613ae0565b600d5460ff1615612ab5576040805162461bcd60e51b81526020600482015260106024820152600080516020614a3a833981519152604482015290519081900360640190fd5b6001600160a01b0389166000908152600c6020526040902054899060ff1615612b0f5760405162461bcd60e51b8152600401808060200182810382526025815260200180614b1c6025913960400191505060405180910390fd5b6001600160a01b0389166000908152600c6020526040902054899060ff1615612b695760405162461bcd60e51b8152600401808060200182810382526025815260200180614b1c6025913960400191505060405180910390fd5b6123d78b8b8b8b8b8b8b8b8b613bba565b60008051602061495383398151915281565b60606000612ba760008051602061495383398151915261259d565b90506060816001600160401b0381118015612bc157600080fd5b50604051908082528060200260200182016040528015612beb578160200160208202803683370190505b50905060005b828110156115ac57612c1160008051602061495383398151915282611fdf565b828281518110612c1d57fe5b6001600160a01b0390921660209283029190910190910152600101612bf1565b6001600160a01b03919091166000908152600b60209081526040808320938352929052205460ff1690565b604051806040016040528060018152602001603160f81b81525081565b60008051602061499483398151915281565b600080516020614994833981519152612cb2816115ef612d96565b600790612d185760405162461bcd60e51b81526020600482019081528254600260001961010060018416150201909116046024830181905290918291604490910190849080156116855780601f1061165a57610100808354040283529160200191611685565b506001600160a01b0382166000818152600c6020526040808220805460ff19166001179055517fffa4e6181777692565cf28528fc88fd1516ea86b56da075235fa575af6a4b8559190a25050565b60008051602061490b83398151915281565b6001600160a01b03166000908152600c602052604090205460ff1690565b6000612da0613c94565b905090565b6001600160a01b038316612dea5760405162461bcd60e51b8152600401808060200182810382526024815260200180614a886024913960400191505060405180910390fd5b6001600160a01b038216612e2f5760405162461bcd60e51b81526004018080602001828103825260228152602001806147546022913960400191505060405180910390fd5b6001600160a01b03808416600081815260016020908152604080832094871680845294825291829020859055815185815291517f8c5be1e5ebec7d5bd14f71427d1e84f3dd0314c0f7b2291e5b200ac8c7c3b9259281900390910190a3505050565b60006001600160a01b038616612ed85760405162461bcd60e51b81526004018080602001828103825260258152602001806148656025913960400191505060405180910390fd5b606060008051602061490b83398151915260001b8660000151876020015188604001518051906020012060405160200180858152602001848152602001836001600160a01b031681526020018281526020019450505050506040516020818303038152906040529050866001600160a01b0316612f5a60095485888886613cf1565b6001600160a01b031614979650505050505050565b612f7a838383613539565b612fea83612f86612d96565b612fe58460405180606001604052806028815260200161492b602891396001600160a01b038916600090815260016020526040812090612fc4612d96565b6001600160a01b031681526020810191909152604001600020549190613d48565b612da5565b505050565b6001600160a01b0382166130345760405162461bcd60e51b81526004018080602001828103825260218152602001806149d46021913960400191505060405180910390fd5b61304082600083612fea565b61307d816040518060600160405280602281526020016146ec602291396001600160a01b0385166000908152602081905260409020549190613d48565b6001600160a01b0383166000908152602081905260409020556002546130a39082613ddf565b6002556040805182815290516000916001600160a01b038516916000805160206149b48339815191529181900360200190a35050565b60008281526006602052604090206130f19082613e21565b156118ec576130fe612d96565b6001600160a01b0316816001600160a01b0316837f2f8788117e7eff1d82e926ec794901d17c78024a50270940304540a733656f0d60405160405180910390a45050565b600082815260066020526040902061315a9082613e36565b156118ec57613167612d96565b6001600160a01b0316816001600160a01b0316837ff6391f5c32d9c69d2a47ea670b442974b53935d1edc7fd64eb21e047a839171b60405160405180910390a45050565b6001600160a01b03808416600090815260016020908152604080832093861683529290522054612fea9084908490612fe59085613e4b565b6001600160a01b03821661323e576040805162461bcd60e51b815260206004820152601f60248201527f45524332303a206d696e7420746f20746865207a65726f206164647265737300604482015290519081900360640190fd5b61324a60008383612fea565b6002546132579082613e4b565b6002556001600160a01b03821660009081526020819052604090205461327d9082613e4b565b6001600160a01b0383166000818152602081815260408083209490945583518581529351929391926000805160206149b48339815191529281900390910190a35050565b80516118ec9060039060208401906145c4565b80516118ec9060049060208401906145c4565b6132f18282613ea3565b6009555050565b6133028585613f15565b604080516000805160206147ed83398151915260208201526001600160a01b03871681830181905260608281018890528351808403909101815260809092019092526009549091906133579086868686613cf1565b6001600160a01b03161461339c5760405162461bcd60e51b81526004018080602001828103825260218152602001806148ea6021913960400191505060405180910390fd5b6001600160a01b0386166000818152600b60209081526040808320898452909152808220805460ff19166002179055518792917f1cdd46ff242716cdaa72d159d339a485b3438398348d68f09d7c8c0a59353d8191a3505050505050565b61340688858888613f83565b60408051600080516020614ad283398151915260208201526001600160a01b038a16818301819052606082018a90526080820189905260a0820188905260c08083018890528351808403909101815260e09092019092526009549091906134709086868686613cf1565b6001600160a01b0316146134b55760405162461bcd60e51b81526004018080602001828103825260218152602001806148ea6021913960400191505060405180910390fd5b6134bf8986614009565b611e4d8989612fef565b6000611ff78383614063565b6000611ff7836001600160a01b0384166140c7565b612fea8383612fe584604051806060016040528060258152602001614b41602591396001600160a01b03808a166000908152600160209081526040808320938c16835292905220549190613d48565b6001600160a01b03831661357e5760405162461bcd60e51b8152600401808060200182810382526025815260200180614a156025913960400191505060405180910390fd5b6001600160a01b0382166135c35760405162461bcd60e51b815260040180806020018281038252602381526020018061467a6023913960400191505060405180910390fd5b6135ce838383612fea565b61360b816040518060600160405280602681526020016147a7602691396001600160a01b0386166000908152602081905260409020549190613d48565b6001600160a01b03808516600090815260208190526040808220939093559084168152205461363a9082613e4b565b6001600160a01b038084166000818152602081815260409182902094909455805185815290519193928716926000805160206149b483398151915292918290030190a3505050565b61368e89858888613f83565b6040805160008051602061488a83398151915260208201526001600160a01b03808c16828401819052908b166060830152608082018a905260a0820189905260c0820188905260e0808301889052835180840390910181526101009092019092526009549091906137029086868686613cf1565b6001600160a01b0316146137475760405162461bcd60e51b81526004018080602001828103825260218152602001806148ea6021913960400191505060405180910390fd5b6137518a86614009565b61375c8a8a8a6134ea565b50505050505050505050565b604080516001600160a01b038416602482015260448082018490528251808303909101815260649091019091526020810180516001600160e01b031663a9059cbb60e01b179052612fea9084906140df565b6137c689858888613f83565b604080516000805160206148aa83398151915260208201526001600160a01b03808c16828401819052908b166060830152608082018a905260a0820189905260c0820188905260e08083018890528351808403909101815261010090920190925260095490919061383a9086868686613cf1565b6001600160a01b03161461387f5760405162461bcd60e51b81526004018080602001828103825260218152602001806148ea6021913960400191505060405180910390fd5b6138898a86614009565b61375c8a8a8a6131ab565b6000611ffa82614190565b333014156138ee576040805162461bcd60e51b815260206004820152601760248201527610d85b1b195c881a5cc81d1a1a5cc818dbdb9d1c9858dd604a1b604482015290519081900360640190fd5b4284101561393f576040805162461bcd60e51b815260206004820152601960248201527814195c9b5a5d0e881c195c9b5a5d081a5cc8195e1c1a5c9959603a1b604482015290519081900360640190fd5b6001600160a01b038088166000818152600a602090815260409182902080546001810190915582516000805160206149f583398151915292810192909252818301849052938a1660608201526080810189905260a081019390935260c08084018890528151808503909101815260e090930190526009546139c39086868686613cf1565b6001600160a01b031614613a1a576040805162461bcd60e51b81526020600482015260196024820152785065726d69743a20696e76616c6964207369676e617475726560381b604482015290519081900360640190fd5b613a25888888612da5565b5050505050505050565b6005805460ff191660ff92909216919091179055565b806040516020018082805190602001908083835b60208310613a785780518252601f199092019160209182019101613a59565b51815160209384036101000a6000190180199092169116179052793a20494e53554646494349454e545f5045524d495353494f4e5360301b9190930190815260408051808303600519018152601a909201905280516118ec95506007945092019190506145c4565b613aec89858888613f83565b604080516000805160206147cd83398151915260208201526001600160a01b03808c16828401819052908b166060830152608082018a905260a0820189905260c0820188905260e080830188905283518084039091018152610100909201909252600954909190613b609086868686613cf1565b6001600160a01b031614613ba55760405162461bcd60e51b81526004018080602001828103825260218152602001806148ea6021913960400191505060405180910390fd5b613baf8a86614009565b61375c8a8a8a612da5565b613bc689858888613f83565b6040805160008051602061473483398151915260208201526001600160a01b03808c16828401819052908b166060830152608082018a905260a0820189905260c0820188905260e080830188905283518084039091018152610100909201909252600954909190613c3a9086868686613cf1565b6001600160a01b031614613c7f5760405162461bcd60e51b81526004018080602001828103825260218152602001806148ea6021913960400191505060405180910390fd5b613c898a86614009565b61375c8a8a8a613539565b600033301415613cec5760606000368080601f0160208091040260200160405190810160405280939291908181526020018383808284376000920191909152505050503601516001600160a01b031691506111119050565b503390565b80516020808301919091206040805161190160f01b81850152602281018990526042808201939093528151808203909301835260620190528051910120600090613d3d81878787614194565b979650505050505050565b60008184841115613dd75760405162461bcd60e51b81526004018080602001828103825283818151815260200191508051906020019080838360005b83811015613d9c578181015183820152602001613d84565b50505050905090810190601f168015613dc95780820380516001836020036101000a031916815260200191505b509250505060405180910390fd5b505050900390565b6000611ff783836040518060400160405280601e81526020017f536166654d6174683a207375627472616374696f6e206f766572666c6f770000815250613d48565b6000611ff7836001600160a01b03841661430d565b6000611ff7836001600160a01b038416614357565b600082820183811015611ff7576040805162461bcd60e51b815260206004820152601b60248201527a536166654d6174683a206164646974696f6e206f766572666c6f7760281b604482015290519081900360640190fd5b8151602092830120815191830191909120604080517f36c25de3e541d5d970f66e4210d728721220fff5c077cc6cd008b3a0c62adab7818601528082019390935260608301919091523060808301524660a0808401919091528151808403909101815260c09092019052805191012090565b6001600160a01b0382166000908152600b6020908152604080832084845290915281205460ff166002811115613f4757fe5b146118ec5760405162461bcd60e51b81526004018080602001828103825260318152602001806147766031913960400191505060405180910390fd5b814211613fc15760405162461bcd60e51b815260040180806020018281038252602e815260200180614a5a602e913960400191505060405180910390fd5b804210613fff5760405162461bcd60e51b815260040180806020018281038252602881526020018061480d6028913960400191505060405180910390fd5b61247a8484613f15565b6001600160a01b0382166000818152600b60209081526040808320858452909152808220805460ff19166001179055518392917f98de503528ee59b575ef0c0a2576a82497bfc029a5685b209e9ec333479b10a591a35050565b815460009082106140a55760405162461bcd60e51b81526004018080602001828103825260228152602001806146586022913960400191505060405180910390fd5b8260000182815481106140b457fe5b9060005260206000200154905092915050565b60009081526001919091016020526040902054151590565b6060614134826040518060400160405280602081526020017f5361666545524332303a206c6f772d6c6576656c2063616c6c206661696c6564815250856001600160a01b031661441d9092919063ffffffff16565b805190915015612fea5780806020019051602081101561415357600080fd5b5051612fea5760405162461bcd60e51b815260040180806020018281038252602a815260200180614af2602a913960400191505060405180910390fd5b5490565b60006fa2a8918ca85bafe22016d0b997e4df60600160ff1b038211156141eb5760405162461bcd60e51b8152600401808060200182810382526026815260200180614aac6026913960400191505060405180910390fd5b8360ff16601b1415801561420357508360ff16601c14155b1561423f5760405162461bcd60e51b815260040180806020018281038252602681526020018061470e6026913960400191505060405180910390fd5b600060018686868660405160008152602001604052604051808581526020018460ff1681526020018381526020018281526020019450505050506020604051602081039080840390855afa15801561429b573d6000803e3d6000fd5b5050604051601f1901519150506001600160a01b038116614302576040805162461bcd60e51b815260206004820152601c60248201527b45435265636f7665723a20696e76616c6964207369676e617475726560201b604482015290519081900360640190fd5b90505b949350505050565b600061431983836140c7565b61434f57508154600181810184556000848152602080822090930184905584548482528286019093526040902091909155611ffa565b506000611ffa565b60008181526001830160205260408120548015614413578354600019808301919081019060009087908390811061438a57fe5b90600052602060002001549050808760000184815481106143a757fe5b6000918252602080832090910192909255828152600189810190925260409020908401905586548790806143d757fe5b60019003818190600052602060002001600090559055866001016000878152602001908152602001600020600090556001945050505050611ffa565b6000915050611ffa565b60606143058484600085606061443285614594565b614483576040805162461bcd60e51b815260206004820152601d60248201527f416464726573733a2063616c6c20746f206e6f6e2d636f6e7472616374000000604482015290519081900360640190fd5b60006060866001600160a01b031685876040518082805190602001908083835b602083106144c25780518252601f1990920191602091820191016144a3565b6001836020036101000a03801982511681845116808217855250505050505090500191505060006040518083038185875af1925050503d8060008114614524576040519150601f19603f3d011682016040523d82523d6000602084013e614529565b606091505b5091509150811561453d5791506143059050565b80511561454d5780518082602001fd5b60405162461bcd60e51b8152602060048201818152865160248401528651879391928392604401919085019080838360008315613d9c578181015183820152602001613d84565b3b151590565b60405180606001604052806000815260200160006001600160a01b03168152602001606081525090565b828054600181600116156101000203166002900490600052602060002090601f016020900481019282601f1061460557805160ff1916838001178555614632565b82800160010185558215614632579182015b82811115614632578251825591602001919060010190614617565b5061463e929150614642565b5090565b5b8082111561463e576000815560010161464356fe456e756d657261626c655365743a20696e646578206f7574206f6620626f756e647345524332303a207472616e7366657220746f20746865207a65726f2061646472657373cf6f9f892731e14b8859835f2ff35575f447fb501f46243c4eb8bac19e31a050416363657373436f6e74726f6c3a2073656e646572206d75737420626520616e2061646d696e20746f206772616e7445524332303a206275726e20616d6f756e7420657863656564732062616c616e636545435265636f7665723a20696e76616c6964207369676e6174757265202776272076616c75657c7c6cdb67a18743f49ec6fa9b35f50d52ed05cbed4cc592e13b44501c1a226745524332303a20617070726f766520746f20746865207a65726f20616464726573734761734162737472616374696f6e3a20617574686f72697a6174696f6e2069732075736564206f722063616e63656c656445524332303a207472616e7366657220616d6f756e7420657863656564732062616c616e6365808c10407a796f3ef2c7ea38c0638ea9d2b8a1c63e3ca9e1f56ce84ae59df73c158b0a9edf7a828aad02f63cd515c68ef2f50ba807396f6d12842833a15974294761734162737472616374696f6e3a20617574686f72697a6174696f6e2069732065787069726564416363657373436f6e74726f6c3a2073656e646572206d75737420626520616e2061646d696e20746f207265766f6b654e61746976654d6574615472616e73616374696f6e3a20494e56414c49445f5349474e4552b70559e94cbda91958ebec07f9b65b3b490097c8d25c8dacd71105df1015b6d8424222bb050a1f7f14017232a5671f2680a2d3420f504bd565cf03035c53198a8f4f2da22e8ac8f11e15f9fc141cddbb5deea8800186560abb6e68c5496619a94761734162737472616374696f6e3a20696e76616c6964207369676e617475726523d10def3caacba2e4042e0c75d44a42d2558aabcf5ce951d0642a8032e1e65345524332303a207472616e7366657220616d6f756e74206578636565647320616c6c6f77616e636565d7a28e3265b37a6474929f336521b332c1681b933f6cb9f3376673440d862a5369676e657220616e64207369676e617475726520646f206e6f74206d6174636898db8a220cd0f09badce9f22d0ba7e93edb3d404448cc3560d391ab096ad16e9ddf252ad1be2c89b69c2b068fc378daa952ba7f163c4a11628f55a4df523b3ef45524332303a206275726e2066726f6d20746865207a65726f20616464726573736e71edae12b1b97f4d1f60370fef10105fa2faae0126114a169c64845d6126c945524332303a207472616e736665722066726f6d20746865207a65726f20616464726573735061757361626c653a20706175736564000000000000000000000000000000004761734162737472616374696f6e3a20617574686f72697a6174696f6e206973206e6f74207965742076616c696445524332303a20617070726f76652066726f6d20746865207a65726f206164647265737345435265636f7665723a20696e76616c6964207369676e6174757265202773272076616c75656c8f8f5f82f0c140edd12e80d10ff715a36d6e5f73e406394862b5f1eb44c4f95361666545524332303a204552433230206f7065726174696f6e20646964206e6f742073756363656564426c61636b6c69737461626c653a206163636f756e7420697320626c61636b6c697374656445524332303a2064656372656173656420616c6c6f77616e63652062656c6f77207a65726f416363657373436f6e74726f6c3a2063616e206f6e6c792072656e6f756e636520726f6c657320666f722073656c66a164736f6c634300060c000a",
  "devdoc": {
    "kind": "dev",
    "methods": {
      "allowance(address,address)": {
        "details": "See {IERC20-allowance}."
      },
      "approve(address,uint256)": {
        "details": "See {IERC20-approve}. Requirements: - `spender` cannot be the zero address."
      },
      "approveWithAuthorization(address,address,uint256,uint256,uint256,bytes32,uint8,bytes32,bytes32)": {
        "params": {
          "nonce": "Unique nonce",
          "owner": "Token owner's address (Authorizer)",
          "r": "r of the signature",
          "s": "s of the signature",
          "spender": "Spender's address",
          "v": "v of the signature",
          "validAfter": "The time after which this is valid (unix time)",
          "validBefore": "The time before which this is valid (unix time)",
          "value": "Amount of allowance"
        }
      },
      "authorizationState(address,bytes32)": {
        "params": {
          "authorizer": "Authorizer's address",
          "nonce": "Nonce of the authorization"
        },
        "returns": {
          "_0": "Authorization state"
        }
      },
      "balanceOf(address)": {
        "details": "See {IERC20-balanceOf}."
      },
      "blacklist(address)": {
        "details": "Adds an account to the blacklist",
        "params": {
          "account": "The address to blacklist"
        }
      },
      "blacklisters()": {
        "returns": {
          "_0": "Addresses"
        }
      },
      "cancelAuthorization(address,bytes32,uint8,bytes32,bytes32)": {
        "details": "Works only if the authorization is not yet used.",
        "params": {
          "authorizer": "Authorizer's address",
          "nonce": "Nonce of the authorization",
          "r": "r of the signature",
          "s": "s of the signature",
          "v": "v of the signature"
        }
      },
      "decimals()": {
        "details": "Returns the number of decimals used to get its user representation. For example, if `decimals` equals `2`, a balance of `505` tokens should be displayed to a user as `5,05` (`505 / 10 ** 2`). Tokens usually opt for a value of 18, imitating the relationship between Ether and Wei. This is the value {ERC20} uses, unless {_setupDecimals} is called. NOTE: This information is only used for _display_ purposes: it in no way affects any of the arithmetic of the contract, including {IERC20-balanceOf} and {IERC20-transfer}."
      },
      "decreaseAllowance(address,uint256)": {
        "details": "Atomically decreases the allowance granted to `spender` by the caller. This is an alternative to {approve} that can be used as a mitigation for problems described in {IERC20-approve}. Emits an {Approval} event indicating the updated allowance. Requirements: - `spender` cannot be the zero address. - `spender` must have allowance for the caller of at least `subtractedValue`."
      },
      "decreaseAllowanceWithAuthorization(address,address,uint256,uint256,uint256,bytes32,uint8,bytes32,bytes32)": {
        "params": {
          "decrement": "Amount of decrease in allowance",
          "nonce": "Unique nonce",
          "owner": "Token owner's address (Authorizer)",
          "r": "r of the signature",
          "s": "s of the signature",
          "spender": "Spender's address",
          "v": "v of the signature",
          "validAfter": "The time after which this is valid (unix time)",
          "validBefore": "The time before which this is valid (unix time)"
        }
      },
      "deposit(address,bytes)": {
        "details": "Should be callable only by ChildChainManager Should handle deposit by minting the required amount for user Make sure minting is done only by this function",
        "params": {
          "depositData": "abi encoded amount",
          "user": "user address for whom deposit is being done"
        }
      },
      "getRoleAdmin(bytes32)": {
        "details": "Returns the admin role that controls `role`. See {grantRole} and {revokeRole}. To change a role's admin, use {_setRoleAdmin}."
      },
      "getRoleMember(bytes32,uint256)": {
        "details": "Returns one of the accounts that have `role`. `index` must be a value between 0 and {getRoleMemberCount}, non-inclusive. Role bearers are not sorted in any particular way, and their ordering may change at any point. WARNING: When using {getRoleMember} and {getRoleMemberCount}, make sure you perform all queries on the same block. See the following https://forum.openzeppelin.com/t/iterating-over-elements-on-enumerableset-in-openzeppelin-contracts/2296[forum post] for more information."
      },
      "getRoleMemberCount(bytes32)": {
        "details": "Returns the number of accounts that have `role`. Can be used together with {getRoleMember} to enumerate all bearers of a role."
      },
      "grantRole(bytes32,address)": {
        "details": "Grants `role` to `account`. If `account` had not been already granted `role`, emits a {RoleGranted} event. Requirements: - the caller must have ``role``'s admin role."
      },
      "hasRole(bytes32,address)": {
        "details": "Returns `true` if `account` has been granted `role`."
      },
      "increaseAllowance(address,uint256)": {
        "details": "Atomically increases the allowance granted to `spender` by the caller. This is an alternative to {approve} that can be used as a mitigation for problems described in {IERC20-approve}. Emits an {Approval} event indicating the updated allowance. Requirements: - `spender` cannot be the zero address."
      },
      "increaseAllowanceWithAuthorization(address,address,uint256,uint256,uint256,bytes32,uint8,bytes32,bytes32)": {
        "params": {
          "increment": "Amount of increase in allowance",
          "nonce": "Unique nonce",
          "owner": "Token owner's address (Authorizer)",
          "r": "r of the signature",
          "s": "s of the signature",
          "spender": "Spender's address",
          "v": "v of the signature",
          "validAfter": "The time after which this is valid (unix time)",
          "validBefore": "The time before which this is valid (unix time)"
        }
      },
      "initialize(string,string,uint8,address)": {
        "details": "meant to be called once immediately after deployment"
      },
      "isBlacklisted(address)": {
        "details": "Checks if an account is blacklisted",
        "params": {
          "account": "The address to check"
        }
      },
      "name()": {
        "details": "Returns the name of the token."
      },
      "nonces(address)": {
        "params": {
          "owner": "Token owner's address"
        },
        "returns": {
          "_0": "Next nonce"
        }
      },
      "paused()": {
        "returns": {
          "_0": "True if paused"
        }
      },
      "pausers()": {
        "returns": {
          "_0": "Addresses"
        }
      },
      "permit(address,address,uint256,uint256,uint8,bytes32,bytes32)": {
        "params": {
          "deadline": "Expiration time, seconds since the epoch",
          "owner": "Token owner's address (Authorizer)",
          "r": "r of the signature",
          "s": "s of the signature",
          "spender": "Spender's address",
          "v": "v of the signature",
          "value": "Amount of allowance"
        }
      },
      "renounceRole(bytes32,address)": {
        "details": "Revokes `role` from the calling account. Roles are often managed via {grantRole} and {revokeRole}: this function's purpose is to provide a mechanism for accounts to lose their privileges if they are compromised (such as when a trusted device is misplaced). If the calling account had been granted `role`, emits a {RoleRevoked} event. Requirements: - the caller must be `account`."
      },
      "rescueERC20(address,address,uint256)": {
        "params": {
          "amount": "Amount to withdraw",
          "to": "Recipient address",
          "tokenContract": "ERC20 token contract address"
        }
      },
      "rescuers()": {
        "returns": {
          "_0": "Addresses"
        }
      },
      "revokeRole(bytes32,address)": {
        "details": "Revokes `role` from `account`. If `account` had been granted `role`, emits a {RoleRevoked} event. Requirements: - the caller must have ``role``'s admin role."
      },
      "symbol()": {
        "details": "Returns the symbol of the token, usually a shorter version of the name."
      },
      "totalSupply()": {
        "details": "See {IERC20-totalSupply}."
      },
      "transfer(address,uint256)": {
        "details": "See {IERC20-transfer}. Requirements: - `recipient` cannot be the zero address. - the caller must have a balance of at least `amount`."
      },
      "transferFrom(address,address,uint256)": {
        "details": "See {IERC20-transferFrom}. Emits an {Approval} event indicating the updated allowance. This is not required by the EIP. See the note at the beginning of {ERC20}; Requirements: - `sender` and `recipient` cannot be the zero address. - `sender` must have a balance of at least `amount`. - the caller must have allowance for ``sender``'s tokens of at least `amount`."
      },
      "transferWithAuthorization(address,address,uint256,uint256,uint256,bytes32,uint8,bytes32,bytes32)": {
        "params": {
          "from": "Payer's address (Authorizer)",
          "nonce": "Unique nonce",
          "r": "r of the signature",
          "s": "s of the signature",
          "to": "Payee's address",
          "v": "v of the signature",
          "validAfter": "The time after which this is valid (unix time)",
          "validBefore": "The time before which this is valid (unix time)",
          "value": "Amount to be transferred"
        }
      },
      "unBlacklist(address)": {
        "params": {
          "account": "The address to remove from the blacklist"
        }
      },
      "withdraw(uint256)": {
        "details": "Should burn user's tokens. This transaction will be verified when exiting on root chain",
        "params": {
          "amount": "amount of tokens to withdraw"
        }
      },
      "withdrawWithAuthorization(address,uint256,uint256,uint256,bytes32,uint8,bytes32,bytes32)": {
        "params": {
          "nonce": "Unique nonce",
          "owner": "Token owner's address (Authorizer)",
          "r": "r of the signature",
          "s": "s of the signature",
          "v": "v of the signature",
          "validAfter": "The time after which this is valid (unix time)",
          "validBefore": "The time before which this is valid (unix time)",
          "value": "Amount to be withdrawn"
        }
      }
    },
    "version": 1
  },
  "userdoc": {
    "kind": "user",
    "methods": {
      "approveWithAuthorization(address,address,uint256,uint256,uint256,bytes32,uint8,bytes32,bytes32)": {
        "notice": "Update allowance with a signed authorization"
      },
      "authorizationState(address,bytes32)": {
        "notice": "Returns the state of an authorization"
      },
      "blacklisters()": {
        "notice": "Return the members of the blacklister role"
      },
      "cancelAuthorization(address,bytes32,uint8,bytes32,bytes32)": {
        "notice": "Attempt to cancel an authorization"
      },
      "decreaseAllowanceWithAuthorization(address,address,uint256,uint256,uint256,bytes32,uint8,bytes32,bytes32)": {
        "notice": "Decrease allowance with a signed authorization"
      },
      "deposit(address,bytes)": {
        "notice": "called when token is deposited on root chain"
      },
      "increaseAllowanceWithAuthorization(address,address,uint256,uint256,uint256,bytes32,uint8,bytes32,bytes32)": {
        "notice": "Increase allowance with a signed authorization"
      },
      "initialize(string,string,uint8,address)": {
        "notice": "Initialize the contract after it has been proxified"
      },
      "nonces(address)": {
        "notice": "Nonces for permit / meta-transactions"
      },
      "pause()": {
        "notice": "Pause this contract"
      },
      "paused()": {
        "notice": "Returns whether this contract is paused"
      },
      "pausers()": {
        "notice": "Return the members of the pauser role"
      },
      "permit(address,address,uint256,uint256,uint8,bytes32,bytes32)": {
        "notice": "Update allowance with a signed permit"
      },
      "rescueERC20(address,address,uint256)": {
        "notice": "Rescue ERC20 tokens locked up in this contract."
      },
      "rescuers()": {
        "notice": "Return the members of the rescuer role"
      },
      "transferWithAuthorization(address,address,uint256,uint256,uint256,bytes32,uint8,bytes32,bytes32)": {
        "notice": "Execute a transfer with a signed authorization"
      },
      "unBlacklist(address)": {
        "notice": "Removes an account from the blacklist"
      },
      "unpause()": {
        "notice": "Unpause this contract"
      },
      "withdraw(uint256)": {
        "notice": "called when user wants to withdraw tokens back to root chain"
      },
      "withdrawWithAuthorization(address,uint256,uint256,uint256,bytes32,uint8,bytes32,bytes32)": {
        "notice": "Execute a withdrawal with a signed authorization. This is used to transfer tokens back to the root chain."
      }
    },
    "version": 1
  },
  "storageLayout": {
    "storage": [
      {
        "astId": 558,
        "contract": "contracts/USDC.sol:UChildAdministrableERC20",
        "label": "_balances",
        "offset": 0,
        "slot": "0",
        "type": "t_mapping(t_address,t_uint256)"
      },
      {
        "astId": 564,
        "contract": "contracts/USDC.sol:UChildAdministrableERC20",
        "label": "_allowances",
        "offset": 0,
        "slot": "1",
        "type": "t_mapping(t_address,t_mapping(t_address,t_uint256))"
      },
      {
        "astId": 566,
        "contract": "contracts/USDC.sol:UChildAdministrableERC20",
        "label": "_totalSupply",
        "offset": 0,
        "slot": "2",
        "type": "t_uint256"
      },
      {
        "astId": 568,
        "contract": "contracts/USDC.sol:UChildAdministrableERC20",
        "label": "_name",
        "offset": 0,
        "slot": "3",
        "type": "t_string_storage"
      },
      {
        "astId": 570,
        "contract": "contracts/USDC.sol:UChildAdministrableERC20",
        "label": "_symbol",
        "offset": 0,
        "slot": "4",
        "type": "t_string_storage"
      },
      {
        "astId": 572,
        "contract": "contracts/USDC.sol:UChildAdministrableERC20",
        "label": "_decimals",
        "offset": 0,
        "slot": "5",
        "type": "t_uint8"
      },
      {
        "astId": 1536,
        "contract": "contracts/USDC.sol:UChildAdministrableERC20",
        "label": "_roles",
        "offset": 0,
        "slot": "6",
        "type": "t_mapping(t_bytes32,t_struct(RoleData)1532_storage)"
      },
      {
        "astId": 1800,
        "contract": "contracts/USDC.sol:UChildAdministrableERC20",
        "label": "_revertMsg",
        "offset": 0,
        "slot": "7",
        "type": "t_string_storage"
      },
      {
        "astId": 1844,
        "contract": "contracts/USDC.sol:UChildAdministrableERC20",
        "label": "_initialized",
        "offset": 0,
        "slot": "8",
        "type": "t_bool"
      },
      {
        "astId": 2014,
        "contract": "contracts/USDC.sol:UChildAdministrableERC20",
        "label": "DOMAIN_SEPARATOR",
        "offset": 0,
        "slot": "9",
        "type": "t_bytes32"
      },
      {
        "astId": 2035,
        "contract": "contracts/USDC.sol:UChildAdministrableERC20",
        "label": "_nonces",
        "offset": 0,
        "slot": "10",
        "type": "t_mapping(t_address,t_uint256)"
      },
      {
        "astId": 2340,
        "contract": "contracts/USDC.sol:UChildAdministrableERC20",
        "label": "_authorizationStates",
        "offset": 0,
        "slot": "11",
        "type": "t_mapping(t_address,t_mapping(t_bytes32,t_enum(AuthorizationState)2333))"
      },
      {
        "astId": 3242,
        "contract": "contracts/USDC.sol:UChildAdministrableERC20",
        "label": "_blacklisted",
        "offset": 0,
        "slot": "12",
        "type": "t_mapping(t_address,t_bool)"
      },
      {
        "astId": 3381,
        "contract": "contracts/USDC.sol:UChildAdministrableERC20",
        "label": "_paused",
        "offset": 0,
        "slot": "13",
        "type": "t_bool"
      }
    ],
    "types": {
      "t_address": {
        "encoding": "inplace",
        "label": "address",
        "numberOfBytes": "20"
      },
      "t_array(t_bytes32)dyn_storage": {
        "base": "t_bytes32",
        "encoding": "dynamic_array",
        "label": "bytes32[]",
        "numberOfBytes": "32"
      },
      "t_bool": {
        "encoding": "inplace",
        "label": "bool",
        "numberOfBytes": "1"
      },
      "t_bytes32": {
        "encoding": "inplace",
        "label": "bytes32",
        "numberOfBytes": "32"
      },
      "t_enum(AuthorizationState)2333": {
        "encoding": "inplace",
        "label": "enum GasAbstraction.AuthorizationState",
        "numberOfBytes": "1"
      },
      "t_mapping(t_address,t_bool)": {
        "encoding": "mapping",
        "key": "t_address",
        "label": "mapping(address => bool)",
        "numberOfBytes": "32",
        "value": "t_bool"
      },
      "t_mapping(t_address,t_mapping(t_address,t_uint256))": {
        "encoding": "mapping",
        "key": "t_address",
        "label": "mapping(address => mapping(address => uint256))",
        "numberOfBytes": "32",
        "value": "t_mapping(t_address,t_uint256)"
      },
      "t_mapping(t_address,t_mapping(t_bytes32,t_enum(AuthorizationState)2333))": {
        "encoding": "mapping",
        "key": "t_address",
        "label": "mapping(address => mapping(bytes32 => enum GasAbstraction.AuthorizationState))",
        "numberOfBytes": "32",
        "value": "t_mapping(t_bytes32,t_enum(AuthorizationState)2333)"
      },
      "t_mapping(t_address,t_uint256)": {
        "encoding": "mapping",
        "key": "t_address",
        "label": "mapping(address => uint256)",
        "numberOfBytes": "32",
        "value": "t_uint256"
      },
      "t_mapping(t_bytes32,t_enum(AuthorizationState)2333)": {
        "encoding": "mapping",
        "key": "t_bytes32",
        "label": "mapping(bytes32 => enum GasAbstraction.AuthorizationState)",
        "numberOfBytes": "32",
        "value": "t_enum(AuthorizationState)2333"
      },
      "t_mapping(t_bytes32,t_struct(RoleData)1532_storage)": {
        "encoding": "mapping",
        "key": "t_bytes32",
        "label": "mapping(bytes32 => struct AccessControl.RoleData)",
        "numberOfBytes": "32",
        "value": "t_struct(RoleData)1532_storage"
      },
      "t_mapping(t_bytes32,t_uint256)": {
        "encoding": "mapping",
        "key": "t_bytes32",
        "label": "mapping(bytes32 => uint256)",
        "numberOfBytes": "32",
        "value": "t_uint256"
      },
      "t_string_storage": {
        "encoding": "bytes",
        "label": "string",
        "numberOfBytes": "32"
      },
      "t_struct(AddressSet)1315_storage": {
        "encoding": "inplace",
        "label": "struct EnumerableSet.AddressSet",
        "members": [
          {
            "astId": 1314,
            "contract": "contracts/USDC.sol:UChildAdministrableERC20",
            "label": "_inner",
            "offset": 0,
            "slot": "0",
            "type": "t_struct(Set)1135_storage"
          }
        ],
        "numberOfBytes": "64"
      },
      "t_struct(RoleData)1532_storage": {
        "encoding": "inplace",
        "label": "struct AccessControl.RoleData",
        "members": [
          {
            "astId": 1529,
            "contract": "contracts/USDC.sol:UChildAdministrableERC20",
            "label": "members",
            "offset": 0,
            "slot": "0",
            "type": "t_struct(AddressSet)1315_storage"
          },
          {
            "astId": 1531,
            "contract": "contracts/USDC.sol:UChildAdministrableERC20",
            "label": "adminRole",
            "offset": 0,
            "slot": "2",
            "type": "t_bytes32"
          }
        ],
        "numberOfBytes": "96"
      },
      "t_struct(Set)1135_storage": {
        "encoding": "inplace",
        "label": "struct EnumerableSet.Set",
        "members": [
          {
            "astId": 1130,
            "contract": "contracts/USDC.sol:UChildAdministrableERC20",
            "label": "_values",
            "offset": 0,
            "slot": "0",
            "type": "t_array(t_bytes32)dyn_storage"
          },
          {
            "astId": 1134,
            "contract": "contracts/USDC.sol:UChildAdministrableERC20",
            "label": "_indexes",
            "offset": 0,
            "slot": "1",
            "type": "t_mapping(t_bytes32,t_uint256)"
          }
        ],
        "numberOfBytes": "64"
      },
      "t_uint256": {
        "encoding": "inplace",
        "label": "uint256",
        "numberOfBytes": "32"
      },
      "t_uint8": {
        "encoding": "inplace",
        "label": "uint8",
        "numberOfBytes": "1"
      }
    }
  }
}